[32m[I 2022-12-27 18:52:54,223][0m Trial 186 finished with value: -0.18347300133585528 and parameters: {'regressor__regressor__batch_size': 90, 'regressor__regressor__epochs': 490, 'regressor__regressor__optimizer': 'Adam', 'regressor__regressor__optimizer__learning_rate': 4.678750294359116e-05, 'regressor__regressor__model__init_mode': 'ones', 'regressor__regressor__model__activation': 'softmax', 'regressor__regressor__model__dropout_rate': 0.11500761039241952, 'regressor__regressor__model__weight_constraint': 3.624658457014605, 'regressor__regressor__model__regu_L1': 6.042168459984542e-07, 'regressor__regressor__model__regu_L2': 9.16101344215535e-07, 'regressor__regressor__model__n_layers': 9, 'regressor__regressor__model__n_units': 341, 'regressor__regressor__loss': 'mean_absolute_error'}. Best is trial 15 with value: 0.713745100510843.[0m
2022-12-27 18:52:59.990356: W tensorflow/compiler/xla/stream_executor/platform/default/dso_loader.cc:64] Could not load dynamic library 'libcudart.so.11.0'; dlerror: libcudart.so.11.0: cannot open shared object file: No such file or directory; LD_LIBRARY_PATH: /.singularity.d/libs
2022-12-27 18:53:02.360019: W tensorflow/compiler/xla/stream_executor/platform/default/dso_loader.cc:64] Could not load dynamic library 'libnvinfer.so.7'; dlerror: libnvinfer.so.7: cannot open shared object file: No such file or directory; LD_LIBRARY_PATH: /.singularity.d/libs
2022-12-27 18:53:02.360161: W tensorflow/compiler/xla/stream_executor/platform/default/dso_loader.cc:64] Could not load dynamic library 'libnvinfer_plugin.so.7'; dlerror: libnvinfer_plugin.so.7: cannot open shared object file: No such file or directory; LD_LIBRARY_PATH: /.singularity.d/libs
2022-12-27 18:53:02.360202: W tensorflow/compiler/tf2tensorrt/utils/py_utils.cc:38] TF-TRT Warning: Cannot dlopen some TensorRT libraries. If you would like to use Nvidia GPU with TensorRT, please make sure the missing libraries mentioned above are installed properly.
2022-12-27 18:53:06.062442: W tensorflow/compiler/xla/stream_executor/platform/default/dso_loader.cc:64] Could not load dynamic library 'libcuda.so.1'; dlerror: libcuda.so.1: cannot open shared object file: No such file or directory; LD_LIBRARY_PATH: /.singularity.d/libs
2022-12-27 18:53:06.063713: W tensorflow/compiler/xla/stream_executor/cuda/cuda_driver.cc:265] failed call to cuInit: UNKNOWN ERROR (303)
/usr/local/lib/python3.9/dist-packages/sklearn/model_selection/_validation.py:776: UserWarning: Scoring failed. The score on this train-test partition for these parameters will be set to nan. Details: 
Traceback (most recent call last):
  File "/usr/local/lib/python3.9/dist-packages/sklearn/model_selection/_validation.py", line 767, in _score
    scores = scorer(estimator, X_test, y_test)
  File "/usr/local/lib/python3.9/dist-packages/sklearn/metrics/_scorer.py", line 107, in __call__
    score = scorer._score(cached_call, estimator, *args, **kwargs)
  File "/usr/local/lib/python3.9/dist-packages/sklearn/metrics/_scorer.py", line 268, in _score
    return self._sign * self._score_func(y_true, y_pred, **self._kwargs)
  File "/usr/local/lib/python3.9/dist-packages/sklearn/metrics/_regression.py", line 911, in r2_score
    y_type, y_true, y_pred, multioutput = _check_reg_targets(
  File "/usr/local/lib/python3.9/dist-packages/sklearn/metrics/_regression.py", line 102, in _check_reg_targets
    y_pred = check_array(y_pred, ensure_2d=False, dtype=dtype)
  File "/usr/local/lib/python3.9/dist-packages/sklearn/utils/validation.py", line 919, in check_array
    _assert_all_finite(
  File "/usr/local/lib/python3.9/dist-packages/sklearn/utils/validation.py", line 161, in _assert_all_finite
    raise ValueError(msg_err)
ValueError: Input contains NaN.

  warnings.warn(
/usr/local/lib/python3.9/dist-packages/sklearn/model_selection/_validation.py:776: UserWarning: Scoring failed. The score on this train-test partition for these parameters will be set to nan. Details: 
Traceback (most recent call last):
  File "/usr/local/lib/python3.9/dist-packages/sklearn/model_selection/_validation.py", line 767, in _score
    scores = scorer(estimator, X_test, y_test)
  File "/usr/local/lib/python3.9/dist-packages/sklearn/metrics/_scorer.py", line 107, in __call__
    score = scorer._score(cached_call, estimator, *args, **kwargs)
  File "/usr/local/lib/python3.9/dist-packages/sklearn/metrics/_scorer.py", line 268, in _score
    return self._sign * self._score_func(y_true, y_pred, **self._kwargs)
  File "/usr/local/lib/python3.9/dist-packages/sklearn/metrics/_regression.py", line 911, in r2_score
    y_type, y_true, y_pred, multioutput = _check_reg_targets(
  File "/usr/local/lib/python3.9/dist-packages/sklearn/metrics/_regression.py", line 102, in _check_reg_targets
    y_pred = check_array(y_pred, ensure_2d=False, dtype=dtype)
  File "/usr/local/lib/python3.9/dist-packages/sklearn/utils/validation.py", line 919, in check_array
    _assert_all_finite(
  File "/usr/local/lib/python3.9/dist-packages/sklearn/utils/validation.py", line 161, in _assert_all_finite
    raise ValueError(msg_err)
ValueError: Input contains NaN.

  warnings.warn(
[33m[W 2022-12-27 19:47:06,828][0m Trial 184 failed because of the following error: The value nan is not acceptable.[0m
2022-12-27 19:47:12.304930: W tensorflow/compiler/xla/stream_executor/platform/default/dso_loader.cc:64] Could not load dynamic library 'libcudart.so.11.0'; dlerror: libcudart.so.11.0: cannot open shared object file: No such file or directory; LD_LIBRARY_PATH: /.singularity.d/libs
2022-12-27 19:47:13.934956: W tensorflow/compiler/xla/stream_executor/platform/default/dso_loader.cc:64] Could not load dynamic library 'libnvinfer.so.7'; dlerror: libnvinfer.so.7: cannot open shared object file: No such file or directory; LD_LIBRARY_PATH: /.singularity.d/libs
2022-12-27 19:47:13.937337: W tensorflow/compiler/xla/stream_executor/platform/default/dso_loader.cc:64] Could not load dynamic library 'libnvinfer_plugin.so.7'; dlerror: libnvinfer_plugin.so.7: cannot open shared object file: No such file or directory; LD_LIBRARY_PATH: /.singularity.d/libs
2022-12-27 19:47:13.937495: W tensorflow/compiler/tf2tensorrt/utils/py_utils.cc:38] TF-TRT Warning: Cannot dlopen some TensorRT libraries. If you would like to use Nvidia GPU with TensorRT, please make sure the missing libraries mentioned above are installed properly.
2022-12-27 19:47:16.464916: W tensorflow/compiler/xla/stream_executor/platform/default/dso_loader.cc:64] Could not load dynamic library 'libcuda.so.1'; dlerror: libcuda.so.1: cannot open shared object file: No such file or directory; LD_LIBRARY_PATH: /.singularity.d/libs
2022-12-27 19:47:16.465288: W tensorflow/compiler/xla/stream_executor/cuda/cuda_driver.cc:265] failed call to cuInit: UNKNOWN ERROR (303)
[32m[I 2022-12-27 19:47:28,685][0m Trial 185 finished with value: 0.6310222772834854 and parameters: {'regressor__regressor__batch_size': 50, 'regressor__regressor__epochs': 530, 'regressor__regressor__optimizer': 'Adam', 'regressor__regressor__optimizer__learning_rate': 4.658930594730234e-05, 'regressor__regressor__model__init_mode': 'variance_scaling', 'regressor__regressor__model__activation': 'LeakyReLU', 'regressor__regressor__model__dropout_rate': 0.11408181278922762, 'regressor__regressor__model__weight_constraint': 3.654525067202627, 'regressor__regressor__model__regu_L1': 8.042752972283265e-07, 'regressor__regressor__model__regu_L2': 3.219601489710479e-07, 'regressor__regressor__model__n_layers': 9, 'regressor__regressor__model__n_units': 461, 'regressor__regressor__loss': 'mean_absolute_error'}. Best is trial 15 with value: 0.713745100510843.[0m
2022-12-27 19:47:35.155525: W tensorflow/compiler/xla/stream_executor/platform/default/dso_loader.cc:64] Could not load dynamic library 'libcudart.so.11.0'; dlerror: libcudart.so.11.0: cannot open shared object file: No such file or directory; LD_LIBRARY_PATH: /.singularity.d/libs
2022-12-27 19:47:36.964194: W tensorflow/compiler/xla/stream_executor/platform/default/dso_loader.cc:64] Could not load dynamic library 'libnvinfer.so.7'; dlerror: libnvinfer.so.7: cannot open shared object file: No such file or directory; LD_LIBRARY_PATH: /.singularity.d/libs
2022-12-27 19:47:36.964563: W tensorflow/compiler/xla/stream_executor/platform/default/dso_loader.cc:64] Could not load dynamic library 'libnvinfer_plugin.so.7'; dlerror: libnvinfer_plugin.so.7: cannot open shared object file: No such file or directory; LD_LIBRARY_PATH: /.singularity.d/libs
2022-12-27 19:47:36.964598: W tensorflow/compiler/tf2tensorrt/utils/py_utils.cc:38] TF-TRT Warning: Cannot dlopen some TensorRT libraries. If you would like to use Nvidia GPU with TensorRT, please make sure the missing libraries mentioned above are installed properly.
2022-12-27 19:47:39.994787: W tensorflow/compiler/xla/stream_executor/platform/default/dso_loader.cc:64] Could not load dynamic library 'libcuda.so.1'; dlerror: libcuda.so.1: cannot open shared object file: No such file or directory; LD_LIBRARY_PATH: /.singularity.d/libs
2022-12-27 19:47:39.997288: W tensorflow/compiler/xla/stream_executor/cuda/cuda_driver.cc:265] failed call to cuInit: UNKNOWN ERROR (303)
[32m[I 2022-12-27 21:08:10,104][0m Trial 188 finished with value: -0.18329704272278616 and parameters: {'regressor__regressor__batch_size': 90, 'regressor__regressor__epochs': 530, 'regressor__regressor__optimizer': 'Adam', 'regressor__regressor__optimizer__learning_rate': 4.718444996903418e-05, 'regressor__regressor__model__init_mode': 'variance_scaling', 'regressor__regressor__model__activation': 'softmax', 'regressor__regressor__model__dropout_rate': 0.1105525536944853, 'regressor__regressor__model__weight_constraint': 3.629957577836135, 'regressor__regressor__model__regu_L1': 8.826479527367336e-07, 'regressor__regressor__model__regu_L2': 9.247938142484242e-07, 'regressor__regressor__model__n_layers': 9, 'regressor__regressor__model__n_units': 401, 'regressor__regressor__loss': 'mean_absolute_error'}. Best is trial 15 with value: 0.713745100510843.[0m
2022-12-27 21:08:17.289349: W tensorflow/compiler/xla/stream_executor/platform/default/dso_loader.cc:64] Could not load dynamic library 'libcudart.so.11.0'; dlerror: libcudart.so.11.0: cannot open shared object file: No such file or directory; LD_LIBRARY_PATH: /.singularity.d/libs
2022-12-27 21:08:19.799816: W tensorflow/compiler/xla/stream_executor/platform/default/dso_loader.cc:64] Could not load dynamic library 'libnvinfer.so.7'; dlerror: libnvinfer.so.7: cannot open shared object file: No such file or directory; LD_LIBRARY_PATH: /.singularity.d/libs
2022-12-27 21:08:19.799939: W tensorflow/compiler/xla/stream_executor/platform/default/dso_loader.cc:64] Could not load dynamic library 'libnvinfer_plugin.so.7'; dlerror: libnvinfer_plugin.so.7: cannot open shared object file: No such file or directory; LD_LIBRARY_PATH: /.singularity.d/libs
2022-12-27 21:08:19.799963: W tensorflow/compiler/tf2tensorrt/utils/py_utils.cc:38] TF-TRT Warning: Cannot dlopen some TensorRT libraries. If you would like to use Nvidia GPU with TensorRT, please make sure the missing libraries mentioned above are installed properly.
2022-12-27 21:08:22.522735: W tensorflow/compiler/xla/stream_executor/platform/default/dso_loader.cc:64] Could not load dynamic library 'libcuda.so.1'; dlerror: libcuda.so.1: cannot open shared object file: No such file or directory; LD_LIBRARY_PATH: /.singularity.d/libs
2022-12-27 21:08:22.522841: W tensorflow/compiler/xla/stream_executor/cuda/cuda_driver.cc:265] failed call to cuInit: UNKNOWN ERROR (303)
[32m[I 2022-12-27 22:53:47,636][0m Trial 189 finished with value: 0.38645848695154894 and parameters: {'regressor__regressor__batch_size': 50, 'regressor__regressor__epochs': 530, 'regressor__regressor__optimizer': 'Adam', 'regressor__regressor__optimizer__learning_rate': 2.6724866481910037e-05, 'regressor__regressor__model__init_mode': 'variance_scaling', 'regressor__regressor__model__activation': 'LeakyReLU', 'regressor__regressor__model__dropout_rate': 0.8188079670617645, 'regressor__regressor__model__weight_constraint': 3.967136128854535, 'regressor__regressor__model__regu_L1': 2.1588110461964211e-07, 'regressor__regressor__model__regu_L2': 6.740860420799983e-07, 'regressor__regressor__model__n_layers': 5, 'regressor__regressor__model__n_units': 481, 'regressor__regressor__loss': 'mean_absolute_error'}. Best is trial 15 with value: 0.713745100510843.[0m
2022-12-27 22:53:53.433672: W tensorflow/compiler/xla/stream_executor/platform/default/dso_loader.cc:64] Could not load dynamic library 'libcudart.so.11.0'; dlerror: libcudart.so.11.0: cannot open shared object file: No such file or directory; LD_LIBRARY_PATH: /.singularity.d/libs
2022-12-27 22:53:54.978750: W tensorflow/compiler/xla/stream_executor/platform/default/dso_loader.cc:64] Could not load dynamic library 'libnvinfer.so.7'; dlerror: libnvinfer.so.7: cannot open shared object file: No such file or directory; LD_LIBRARY_PATH: /.singularity.d/libs
2022-12-27 22:53:54.978868: W tensorflow/compiler/xla/stream_executor/platform/default/dso_loader.cc:64] Could not load dynamic library 'libnvinfer_plugin.so.7'; dlerror: libnvinfer_plugin.so.7: cannot open shared object file: No such file or directory; LD_LIBRARY_PATH: /.singularity.d/libs
2022-12-27 22:53:54.978891: W tensorflow/compiler/tf2tensorrt/utils/py_utils.cc:38] TF-TRT Warning: Cannot dlopen some TensorRT libraries. If you would like to use Nvidia GPU with TensorRT, please make sure the missing libraries mentioned above are installed properly.
2022-12-27 22:53:57.396294: W tensorflow/compiler/xla/stream_executor/platform/default/dso_loader.cc:64] Could not load dynamic library 'libcuda.so.1'; dlerror: libcuda.so.1: cannot open shared object file: No such file or directory; LD_LIBRARY_PATH: /.singularity.d/libs
2022-12-27 22:53:57.397207: W tensorflow/compiler/xla/stream_executor/cuda/cuda_driver.cc:265] failed call to cuInit: UNKNOWN ERROR (303)
[32m[I 2022-12-27 23:39:03,464][0m Trial 187 finished with value: -0.18326328923433144 and parameters: {'regressor__regressor__batch_size': 50, 'regressor__regressor__epochs': 530, 'regressor__regressor__optimizer': 'Adam', 'regressor__regressor__optimizer__learning_rate': 5.224657027534636e-05, 'regressor__regressor__model__init_mode': 'variance_scaling', 'regressor__regressor__model__activation': 'softmax', 'regressor__regressor__model__dropout_rate': 0.1122890564890216, 'regressor__regressor__model__weight_constraint': 3.6462907036575896, 'regressor__regressor__model__regu_L1': 7.684564478959744e-07, 'regressor__regressor__model__regu_L2': 8.704590932489249e-07, 'regressor__regressor__model__n_layers': 9, 'regressor__regressor__model__n_units': 461, 'regressor__regressor__loss': 'mean_absolute_error'}. Best is trial 15 with value: 0.713745100510843.[0m
2022-12-27 23:39:10.916927: W tensorflow/compiler/xla/stream_executor/platform/default/dso_loader.cc:64] Could not load dynamic library 'libcudart.so.11.0'; dlerror: libcudart.so.11.0: cannot open shared object file: No such file or directory; LD_LIBRARY_PATH: /.singularity.d/libs
2022-12-27 23:39:13.196235: W tensorflow/compiler/xla/stream_executor/platform/default/dso_loader.cc:64] Could not load dynamic library 'libnvinfer.so.7'; dlerror: libnvinfer.so.7: cannot open shared object file: No such file or directory; LD_LIBRARY_PATH: /.singularity.d/libs
2022-12-27 23:39:13.196455: W tensorflow/compiler/xla/stream_executor/platform/default/dso_loader.cc:64] Could not load dynamic library 'libnvinfer_plugin.so.7'; dlerror: libnvinfer_plugin.so.7: cannot open shared object file: No such file or directory; LD_LIBRARY_PATH: /.singularity.d/libs
2022-12-27 23:39:13.196479: W tensorflow/compiler/tf2tensorrt/utils/py_utils.cc:38] TF-TRT Warning: Cannot dlopen some TensorRT libraries. If you would like to use Nvidia GPU with TensorRT, please make sure the missing libraries mentioned above are installed properly.
2022-12-27 23:39:16.939413: W tensorflow/compiler/xla/stream_executor/platform/default/dso_loader.cc:64] Could not load dynamic library 'libcuda.so.1'; dlerror: libcuda.so.1: cannot open shared object file: No such file or directory; LD_LIBRARY_PATH: /.singularity.d/libs
2022-12-27 23:39:16.940047: W tensorflow/compiler/xla/stream_executor/cuda/cuda_driver.cc:265] failed call to cuInit: UNKNOWN ERROR (303)
[32m[I 2022-12-28 01:31:55,913][0m Trial 192 finished with value: 0.3969200220817902 and parameters: {'regressor__regressor__batch_size': 50, 'regressor__regressor__epochs': 550, 'regressor__regressor__optimizer': 'Adadelta', 'regressor__regressor__optimizer__learning_rate': 3.698658207179905e-05, 'regressor__regressor__model__init_mode': 'normal', 'regressor__regressor__model__activation': 'LeakyReLU', 'regressor__regressor__model__dropout_rate': 0.014269192055986715, 'regressor__regressor__model__weight_constraint': 3.9269220524688997, 'regressor__regressor__model__regu_L1': 2.36955530347576e-07, 'regressor__regressor__model__regu_L2': 3.723359114818968e-06, 'regressor__regressor__model__n_layers': 5, 'regressor__regressor__model__n_units': 481, 'regressor__regressor__loss': 'mean_absolute_error'}. Best is trial 15 with value: 0.713745100510843.[0m
[32m[I 2022-12-28 01:43:42,489][0m Trial 190 finished with value: 0.6250967532502056 and parameters: {'regressor__regressor__batch_size': 50, 'regressor__regressor__epochs': 530, 'regressor__regressor__optimizer': 'Adam', 'regressor__regressor__optimizer__learning_rate': 2.6925592504852812e-05, 'regressor__regressor__model__init_mode': 'variance_scaling', 'regressor__regressor__model__activation': 'LeakyReLU', 'regressor__regressor__model__dropout_rate': 0.06328024298321915, 'regressor__regressor__model__weight_constraint': 2.6427596395259108, 'regressor__regressor__model__regu_L1': 2.4167567749385776e-07, 'regressor__regressor__model__regu_L2': 1.1330867373532651e-06, 'regressor__regressor__model__n_layers': 9, 'regressor__regressor__model__n_units': 481, 'regressor__regressor__loss': 'mean_absolute_error'}. Best is trial 15 with value: 0.713745100510843.[0m
2022-12-28 01:43:51.217342: W tensorflow/compiler/xla/stream_executor/platform/default/dso_loader.cc:64] Could not load dynamic library 'libcudart.so.11.0'; dlerror: libcudart.so.11.0: cannot open shared object file: No such file or directory; LD_LIBRARY_PATH: /.singularity.d/libs
2022-12-28 01:43:53.621398: W tensorflow/compiler/xla/stream_executor/platform/default/dso_loader.cc:64] Could not load dynamic library 'libnvinfer.so.7'; dlerror: libnvinfer.so.7: cannot open shared object file: No such file or directory; LD_LIBRARY_PATH: /.singularity.d/libs
2022-12-28 01:43:53.622026: W tensorflow/compiler/xla/stream_executor/platform/default/dso_loader.cc:64] Could not load dynamic library 'libnvinfer_plugin.so.7'; dlerror: libnvinfer_plugin.so.7: cannot open shared object file: No such file or directory; LD_LIBRARY_PATH: /.singularity.d/libs
2022-12-28 01:43:53.622076: W tensorflow/compiler/tf2tensorrt/utils/py_utils.cc:38] TF-TRT Warning: Cannot dlopen some TensorRT libraries. If you would like to use Nvidia GPU with TensorRT, please make sure the missing libraries mentioned above are installed properly.
2022-12-28 01:43:56.964280: W tensorflow/compiler/xla/stream_executor/platform/default/dso_loader.cc:64] Could not load dynamic library 'libcuda.so.1'; dlerror: libcuda.so.1: cannot open shared object file: No such file or directory; LD_LIBRARY_PATH: /.singularity.d/libs
2022-12-28 01:43:56.964394: W tensorflow/compiler/xla/stream_executor/cuda/cuda_driver.cc:265] failed call to cuInit: UNKNOWN ERROR (303)
