[32m[I 2022-12-24 17:26:54,554][0m Trial 33 finished with value: 0.5369012889257421 and parameters: {'regressor__regressor__batch_size': 10, 'regressor__regressor__epochs': 390, 'regressor__regressor__optimizer': 'Adam', 'regressor__regressor__optimizer__learning_rate': 0.0008114037996833446, 'regressor__regressor__model__init_mode': 'lecun_uniform', 'regressor__regressor__model__activation': 'selu', 'regressor__regressor__model__dropout_rate': 0.08028372403913187, 'regressor__regressor__model__weight_constraint': 4.201672201617968, 'regressor__regressor__model__regu_L1': 1.5040796543783031e-06, 'regressor__regressor__model__regu_L2': 3.8080617004732735e-05, 'regressor__regressor__model__n_layers': 19, 'regressor__regressor__model__n_units': 161, 'regressor__regressor__loss': 'mse'}. Best is trial 15 with value: 0.713745100510843.[0m
[32m[I 2022-12-24 17:27:25,965][0m Trial 66 finished with value: -62.50326579413941 and parameters: {'regressor__regressor__batch_size': 90, 'regressor__regressor__epochs': 270, 'regressor__regressor__optimizer': 'Adam', 'regressor__regressor__optimizer__learning_rate': 0.0025352136625220244, 'regressor__regressor__model__init_mode': 'he_uniform', 'regressor__regressor__model__activation': 'tanh', 'regressor__regressor__model__dropout_rate': 0.29508564269461807, 'regressor__regressor__model__weight_constraint': 3.962462876738966, 'regressor__regressor__model__regu_L1': 4.680358310446169e-06, 'regressor__regressor__model__regu_L2': 1.817765951661215e-05, 'regressor__regressor__model__n_layers': 1, 'regressor__regressor__model__n_units': 141, 'regressor__regressor__loss': 'cosine_similarity'}. Best is trial 15 with value: 0.713745100510843.[0m
[32m[I 2022-12-24 17:28:09,722][0m Trial 67 finished with value: -1188.2281716682917 and parameters: {'regressor__regressor__batch_size': 100, 'regressor__regressor__epochs': 270, 'regressor__regressor__optimizer': 'Adam', 'regressor__regressor__optimizer__learning_rate': 0.0033289459777254573, 'regressor__regressor__model__init_mode': 'he_normal', 'regressor__regressor__model__activation': 'exponential', 'regressor__regressor__model__dropout_rate': 0.30042876736679924, 'regressor__regressor__model__weight_constraint': 3.930960207203608, 'regressor__regressor__model__regu_L1': 3.835303923608991e-06, 'regressor__regressor__model__regu_L2': 1.4782154075632173e-05, 'regressor__regressor__model__n_layers': 1, 'regressor__regressor__model__n_units': 141, 'regressor__regressor__loss': 'cosine_similarity'}. Best is trial 15 with value: 0.713745100510843.[0m
/usr/local/lib/python3.9/dist-packages/sklearn/model_selection/_validation.py:776: UserWarning: Scoring failed. The score on this train-test partition for these parameters will be set to nan. Details: 
Traceback (most recent call last):
  File "/usr/local/lib/python3.9/dist-packages/sklearn/model_selection/_validation.py", line 767, in _score
    scores = scorer(estimator, X_test, y_test)
  File "/usr/local/lib/python3.9/dist-packages/sklearn/metrics/_scorer.py", line 107, in __call__
    score = scorer._score(cached_call, estimator, *args, **kwargs)
  File "/usr/local/lib/python3.9/dist-packages/sklearn/metrics/_scorer.py", line 268, in _score
    return self._sign * self._score_func(y_true, y_pred, **self._kwargs)
  File "/usr/local/lib/python3.9/dist-packages/sklearn/metrics/_regression.py", line 911, in r2_score
    y_type, y_true, y_pred, multioutput = _check_reg_targets(
  File "/usr/local/lib/python3.9/dist-packages/sklearn/metrics/_regression.py", line 102, in _check_reg_targets
    y_pred = check_array(y_pred, ensure_2d=False, dtype=dtype)
  File "/usr/local/lib/python3.9/dist-packages/sklearn/utils/validation.py", line 919, in check_array
    _assert_all_finite(
  File "/usr/local/lib/python3.9/dist-packages/sklearn/utils/validation.py", line 161, in _assert_all_finite
    raise ValueError(msg_err)
ValueError: Input contains NaN.

  warnings.warn(
/usr/local/lib/python3.9/dist-packages/sklearn/model_selection/_validation.py:776: UserWarning: Scoring failed. The score on this train-test partition for these parameters will be set to nan. Details: 
Traceback (most recent call last):
  File "/usr/local/lib/python3.9/dist-packages/sklearn/model_selection/_validation.py", line 767, in _score
    scores = scorer(estimator, X_test, y_test)
  File "/usr/local/lib/python3.9/dist-packages/sklearn/metrics/_scorer.py", line 107, in __call__
    score = scorer._score(cached_call, estimator, *args, **kwargs)
  File "/usr/local/lib/python3.9/dist-packages/sklearn/metrics/_scorer.py", line 268, in _score
    return self._sign * self._score_func(y_true, y_pred, **self._kwargs)
  File "/usr/local/lib/python3.9/dist-packages/sklearn/metrics/_regression.py", line 911, in r2_score
    y_type, y_true, y_pred, multioutput = _check_reg_targets(
  File "/usr/local/lib/python3.9/dist-packages/sklearn/metrics/_regression.py", line 102, in _check_reg_targets
    y_pred = check_array(y_pred, ensure_2d=False, dtype=dtype)
  File "/usr/local/lib/python3.9/dist-packages/sklearn/utils/validation.py", line 919, in check_array
    _assert_all_finite(
  File "/usr/local/lib/python3.9/dist-packages/sklearn/utils/validation.py", line 161, in _assert_all_finite
    raise ValueError(msg_err)
ValueError: Input contains NaN.

  warnings.warn(
/usr/local/lib/python3.9/dist-packages/sklearn/model_selection/_validation.py:776: UserWarning: Scoring failed. The score on this train-test partition for these parameters will be set to nan. Details: 
Traceback (most recent call last):
  File "/usr/local/lib/python3.9/dist-packages/sklearn/model_selection/_validation.py", line 767, in _score
    scores = scorer(estimator, X_test, y_test)
  File "/usr/local/lib/python3.9/dist-packages/sklearn/metrics/_scorer.py", line 107, in __call__
    score = scorer._score(cached_call, estimator, *args, **kwargs)
  File "/usr/local/lib/python3.9/dist-packages/sklearn/metrics/_scorer.py", line 268, in _score
    return self._sign * self._score_func(y_true, y_pred, **self._kwargs)
  File "/usr/local/lib/python3.9/dist-packages/sklearn/metrics/_regression.py", line 911, in r2_score
    y_type, y_true, y_pred, multioutput = _check_reg_targets(
  File "/usr/local/lib/python3.9/dist-packages/sklearn/metrics/_regression.py", line 102, in _check_reg_targets
    y_pred = check_array(y_pred, ensure_2d=False, dtype=dtype)
  File "/usr/local/lib/python3.9/dist-packages/sklearn/utils/validation.py", line 919, in check_array
    _assert_all_finite(
  File "/usr/local/lib/python3.9/dist-packages/sklearn/utils/validation.py", line 161, in _assert_all_finite
    raise ValueError(msg_err)
ValueError: Input contains NaN.

  warnings.warn(
/usr/local/lib/python3.9/dist-packages/sklearn/model_selection/_validation.py:776: UserWarning: Scoring failed. The score on this train-test partition for these parameters will be set to nan. Details: 
Traceback (most recent call last):
  File "/usr/local/lib/python3.9/dist-packages/sklearn/model_selection/_validation.py", line 767, in _score
    scores = scorer(estimator, X_test, y_test)
  File "/usr/local/lib/python3.9/dist-packages/sklearn/metrics/_scorer.py", line 107, in __call__
    score = scorer._score(cached_call, estimator, *args, **kwargs)
  File "/usr/local/lib/python3.9/dist-packages/sklearn/metrics/_scorer.py", line 268, in _score
    return self._sign * self._score_func(y_true, y_pred, **self._kwargs)
  File "/usr/local/lib/python3.9/dist-packages/sklearn/metrics/_regression.py", line 911, in r2_score
    y_type, y_true, y_pred, multioutput = _check_reg_targets(
  File "/usr/local/lib/python3.9/dist-packages/sklearn/metrics/_regression.py", line 102, in _check_reg_targets
    y_pred = check_array(y_pred, ensure_2d=False, dtype=dtype)
  File "/usr/local/lib/python3.9/dist-packages/sklearn/utils/validation.py", line 919, in check_array
    _assert_all_finite(
  File "/usr/local/lib/python3.9/dist-packages/sklearn/utils/validation.py", line 161, in _assert_all_finite
    raise ValueError(msg_err)
ValueError: Input contains NaN.

  warnings.warn(
/usr/local/lib/python3.9/dist-packages/sklearn/model_selection/_validation.py:776: UserWarning: Scoring failed. The score on this train-test partition for these parameters will be set to nan. Details: 
Traceback (most recent call last):
  File "/usr/local/lib/python3.9/dist-packages/sklearn/model_selection/_validation.py", line 767, in _score
    scores = scorer(estimator, X_test, y_test)
  File "/usr/local/lib/python3.9/dist-packages/sklearn/metrics/_scorer.py", line 107, in __call__
    score = scorer._score(cached_call, estimator, *args, **kwargs)
  File "/usr/local/lib/python3.9/dist-packages/sklearn/metrics/_scorer.py", line 268, in _score
    return self._sign * self._score_func(y_true, y_pred, **self._kwargs)
  File "/usr/local/lib/python3.9/dist-packages/sklearn/metrics/_regression.py", line 911, in r2_score
    y_type, y_true, y_pred, multioutput = _check_reg_targets(
  File "/usr/local/lib/python3.9/dist-packages/sklearn/metrics/_regression.py", line 102, in _check_reg_targets
    y_pred = check_array(y_pred, ensure_2d=False, dtype=dtype)
  File "/usr/local/lib/python3.9/dist-packages/sklearn/utils/validation.py", line 919, in check_array
    _assert_all_finite(
  File "/usr/local/lib/python3.9/dist-packages/sklearn/utils/validation.py", line 161, in _assert_all_finite
    raise ValueError(msg_err)
ValueError: Input contains NaN.

  warnings.warn(
/usr/local/lib/python3.9/dist-packages/sklearn/model_selection/_validation.py:776: UserWarning: Scoring failed. The score on this train-test partition for these parameters will be set to nan. Details: 
Traceback (most recent call last):
  File "/usr/local/lib/python3.9/dist-packages/sklearn/model_selection/_validation.py", line 767, in _score
    scores = scorer(estimator, X_test, y_test)
  File "/usr/local/lib/python3.9/dist-packages/sklearn/metrics/_scorer.py", line 107, in __call__
    score = scorer._score(cached_call, estimator, *args, **kwargs)
  File "/usr/local/lib/python3.9/dist-packages/sklearn/metrics/_scorer.py", line 268, in _score
    return self._sign * self._score_func(y_true, y_pred, **self._kwargs)
  File "/usr/local/lib/python3.9/dist-packages/sklearn/metrics/_regression.py", line 911, in r2_score
    y_type, y_true, y_pred, multioutput = _check_reg_targets(
  File "/usr/local/lib/python3.9/dist-packages/sklearn/metrics/_regression.py", line 102, in _check_reg_targets
    y_pred = check_array(y_pred, ensure_2d=False, dtype=dtype)
  File "/usr/local/lib/python3.9/dist-packages/sklearn/utils/validation.py", line 919, in check_array
    _assert_all_finite(
  File "/usr/local/lib/python3.9/dist-packages/sklearn/utils/validation.py", line 161, in _assert_all_finite
    raise ValueError(msg_err)
ValueError: Input contains NaN.

  warnings.warn(
/usr/local/lib/python3.9/dist-packages/sklearn/model_selection/_validation.py:776: UserWarning: Scoring failed. The score on this train-test partition for these parameters will be set to nan. Details: 
Traceback (most recent call last):
  File "/usr/local/lib/python3.9/dist-packages/sklearn/model_selection/_validation.py", line 767, in _score
    scores = scorer(estimator, X_test, y_test)
  File "/usr/local/lib/python3.9/dist-packages/sklearn/metrics/_scorer.py", line 107, in __call__
    score = scorer._score(cached_call, estimator, *args, **kwargs)
  File "/usr/local/lib/python3.9/dist-packages/sklearn/metrics/_scorer.py", line 268, in _score
    return self._sign * self._score_func(y_true, y_pred, **self._kwargs)
  File "/usr/local/lib/python3.9/dist-packages/sklearn/metrics/_regression.py", line 911, in r2_score
    y_type, y_true, y_pred, multioutput = _check_reg_targets(
  File "/usr/local/lib/python3.9/dist-packages/sklearn/metrics/_regression.py", line 102, in _check_reg_targets
    y_pred = check_array(y_pred, ensure_2d=False, dtype=dtype)
  File "/usr/local/lib/python3.9/dist-packages/sklearn/utils/validation.py", line 919, in check_array
    _assert_all_finite(
  File "/usr/local/lib/python3.9/dist-packages/sklearn/utils/validation.py", line 161, in _assert_all_finite
    raise ValueError(msg_err)
ValueError: Input contains NaN.

  warnings.warn(
/usr/local/lib/python3.9/dist-packages/sklearn/model_selection/_validation.py:776: UserWarning: Scoring failed. The score on this train-test partition for these parameters will be set to nan. Details: 
Traceback (most recent call last):
  File "/usr/local/lib/python3.9/dist-packages/sklearn/model_selection/_validation.py", line 767, in _score
    scores = scorer(estimator, X_test, y_test)
  File "/usr/local/lib/python3.9/dist-packages/sklearn/metrics/_scorer.py", line 107, in __call__
    score = scorer._score(cached_call, estimator, *args, **kwargs)
  File "/usr/local/lib/python3.9/dist-packages/sklearn/metrics/_scorer.py", line 268, in _score
    return self._sign * self._score_func(y_true, y_pred, **self._kwargs)
  File "/usr/local/lib/python3.9/dist-packages/sklearn/metrics/_regression.py", line 911, in r2_score
    y_type, y_true, y_pred, multioutput = _check_reg_targets(
  File "/usr/local/lib/python3.9/dist-packages/sklearn/metrics/_regression.py", line 102, in _check_reg_targets
    y_pred = check_array(y_pred, ensure_2d=False, dtype=dtype)
  File "/usr/local/lib/python3.9/dist-packages/sklearn/utils/validation.py", line 919, in check_array
    _assert_all_finite(
  File "/usr/local/lib/python3.9/dist-packages/sklearn/utils/validation.py", line 161, in _assert_all_finite
    raise ValueError(msg_err)
ValueError: Input contains NaN.

  warnings.warn(
[33m[W 2022-12-24 17:40:39,317][0m Trial 65 failed because of the following error: The value nan is not acceptable.[0m
[32m[I 2022-12-24 17:45:09,736][0m Trial 70 finished with value: 0.4677882686136373 and parameters: {'regressor__regressor__batch_size': 20, 'regressor__regressor__epochs': 370, 'regressor__regressor__optimizer': 'Adam', 'regressor__regressor__optimizer__learning_rate': 0.00015568872812722983, 'regressor__regressor__model__init_mode': 'lecun_uniform', 'regressor__regressor__model__activation': 'selu', 'regressor__regressor__model__dropout_rate': 0.16116072467392256, 'regressor__regressor__model__weight_constraint': 1.5955404539388156, 'regressor__regressor__model__regu_L1': 1.2604112790636546e-05, 'regressor__regressor__model__regu_L2': 3.034779923387168e-06, 'regressor__regressor__model__n_layers': 11, 'regressor__regressor__model__n_units': 21, 'regressor__regressor__loss': 'huber'}. Best is trial 15 with value: 0.713745100510843.[0m
[32m[I 2022-12-24 17:49:37,891][0m Trial 32 finished with value: 0.07180284102196478 and parameters: {'regressor__regressor__batch_size': 10, 'regressor__regressor__epochs': 410, 'regressor__regressor__optimizer': 'Adam', 'regressor__regressor__optimizer__learning_rate': 0.001666464561810717, 'regressor__regressor__model__init_mode': 'lecun_uniform', 'regressor__regressor__model__activation': 'selu', 'regressor__regressor__model__dropout_rate': 0.07596927119175889, 'regressor__regressor__model__weight_constraint': 4.1662638867308175, 'regressor__regressor__model__regu_L1': 2.951731688738213e-06, 'regressor__regressor__model__regu_L2': 4.0144789277204636e-05, 'regressor__regressor__model__n_layers': 19, 'regressor__regressor__model__n_units': 181, 'regressor__regressor__loss': 'huber'}. Best is trial 15 with value: 0.713745100510843.[0m
[32m[I 2022-12-24 18:03:10,681][0m Trial 73 finished with value: 0.15976650146302065 and parameters: {'regressor__regressor__batch_size': 30, 'regressor__regressor__epochs': 370, 'regressor__regressor__optimizer': 'Adam', 'regressor__regressor__optimizer__learning_rate': 3.256805871990434e-05, 'regressor__regressor__model__init_mode': 'lecun_uniform', 'regressor__regressor__model__activation': 'selu', 'regressor__regressor__model__dropout_rate': 0.17081850536347423, 'regressor__regressor__model__weight_constraint': 1.2181533477006807, 'regressor__regressor__model__regu_L1': 1.2712761005964685e-05, 'regressor__regressor__model__regu_L2': 3.231659293336993e-06, 'regressor__regressor__model__n_layers': 11, 'regressor__regressor__model__n_units': 1, 'regressor__regressor__loss': 'huber'}. Best is trial 15 with value: 0.713745100510843.[0m
[32m[I 2022-12-24 18:09:13,364][0m Trial 72 finished with value: -0.035579928228999025 and parameters: {'regressor__regressor__batch_size': 20, 'regressor__regressor__epochs': 370, 'regressor__regressor__optimizer': 'Adam', 'regressor__regressor__optimizer__learning_rate': 3.603333673202232e-05, 'regressor__regressor__model__init_mode': 'lecun_uniform', 'regressor__regressor__model__activation': 'selu', 'regressor__regressor__model__dropout_rate': 0.0642833371331211, 'regressor__regressor__model__weight_constraint': 1.5073750515330924, 'regressor__regressor__model__regu_L1': 0.013817548022447482, 'regressor__regressor__model__regu_L2': 5.475735373933285e-05, 'regressor__regressor__model__n_layers': 17, 'regressor__regressor__model__n_units': 21, 'regressor__regressor__loss': 'huber'}. Best is trial 15 with value: 0.713745100510843.[0m
[32m[I 2022-12-24 18:15:03,529][0m Trial 68 finished with value: -751.8787170427327 and parameters: {'regressor__regressor__batch_size': 30, 'regressor__regressor__epochs': 270, 'regressor__regressor__optimizer': 'Adam', 'regressor__regressor__optimizer__learning_rate': 0.0029092411584884835, 'regressor__regressor__model__init_mode': 'he_normal', 'regressor__regressor__model__activation': 'selu', 'regressor__regressor__model__dropout_rate': 0.18550575055794238, 'regressor__regressor__model__weight_constraint': 3.9017983912564893, 'regressor__regressor__model__regu_L1': 2.279324959246097e-07, 'regressor__regressor__model__regu_L2': 1.5274261206286167e-05, 'regressor__regressor__model__n_layers': 17, 'regressor__regressor__model__n_units': 181, 'regressor__regressor__loss': 'cosine_similarity'}. Best is trial 15 with value: 0.713745100510843.[0m
[32m[I 2022-12-24 18:21:06,767][0m Trial 69 finished with value: 0.5448820840878174 and parameters: {'regressor__regressor__batch_size': 20, 'regressor__regressor__epochs': 230, 'regressor__regressor__optimizer': 'Adam', 'regressor__regressor__optimizer__learning_rate': 0.00017039741198954933, 'regressor__regressor__model__init_mode': 'lecun_uniform', 'regressor__regressor__model__activation': 'selu', 'regressor__regressor__model__dropout_rate': 0.14783206181540717, 'regressor__regressor__model__weight_constraint': 1.6218805143149089, 'regressor__regressor__model__regu_L1': 1.2446361728424264e-05, 'regressor__regressor__model__regu_L2': 5.0233199448715056e-05, 'regressor__regressor__model__n_layers': 17, 'regressor__regressor__model__n_units': 181, 'regressor__regressor__loss': 'huber'}. Best is trial 15 with value: 0.713745100510843.[0m
[32m[I 2022-12-24 18:21:11,727][0m Trial 71 finished with value: 0.5786355400346117 and parameters: {'regressor__regressor__batch_size': 20, 'regressor__regressor__epochs': 230, 'regressor__regressor__optimizer': 'Adam', 'regressor__regressor__optimizer__learning_rate': 0.000167415777768912, 'regressor__regressor__model__init_mode': 'lecun_uniform', 'regressor__regressor__model__activation': 'selu', 'regressor__regressor__model__dropout_rate': 0.1585244612407673, 'regressor__regressor__model__weight_constraint': 1.8644954283293318, 'regressor__regressor__model__regu_L1': 1.273470820480453e-05, 'regressor__regressor__model__regu_L2': 3.0787464511473942e-06, 'regressor__regressor__model__n_layers': 13, 'regressor__regressor__model__n_units': 181, 'regressor__regressor__loss': 'huber'}. Best is trial 15 with value: 0.713745100510843.[0m
[32m[I 2022-12-24 18:22:01,712][0m Trial 74 finished with value: 0.4575331690115677 and parameters: {'regressor__regressor__batch_size': 20, 'regressor__regressor__epochs': 290, 'regressor__regressor__optimizer': 'Adam', 'regressor__regressor__optimizer__learning_rate': 0.00014418332091632182, 'regressor__regressor__model__init_mode': 'lecun_uniform', 'regressor__regressor__model__activation': 'selu', 'regressor__regressor__model__dropout_rate': 0.13799716614210752, 'regressor__regressor__model__weight_constraint': 1.6388718684209866, 'regressor__regressor__model__regu_L1': 4.7262200787653935e-05, 'regressor__regressor__model__regu_L2': 1.4532406397599716e-06, 'regressor__regressor__model__n_layers': 15, 'regressor__regressor__model__n_units': 21, 'regressor__regressor__loss': 'huber'}. Best is trial 15 with value: 0.713745100510843.[0m
[32m[I 2022-12-24 18:57:01,992][0m Trial 76 finished with value: 0.560529604099206 and parameters: {'regressor__regressor__batch_size': 40, 'regressor__regressor__epochs': 230, 'regressor__regressor__optimizer': 'Adam', 'regressor__regressor__optimizer__learning_rate': 0.00014668043043595657, 'regressor__regressor__model__init_mode': 'lecun_uniform', 'regressor__regressor__model__activation': 'relu', 'regressor__regressor__model__dropout_rate': 0.14092142103958555, 'regressor__regressor__model__weight_constraint': 3.552077049140048, 'regressor__regressor__model__regu_L1': 4.916643119993156e-05, 'regressor__regressor__model__regu_L2': 1.4242534115430245e-06, 'regressor__regressor__model__n_layers': 15, 'regressor__regressor__model__n_units': 201, 'regressor__regressor__loss': 'huber'}. Best is trial 15 with value: 0.713745100510843.[0m
