[32m[I 2022-12-29 22:05:37,379][0m Trial 223 finished with value: 0.7541060326104552 and parameters: {'regressor__regressor__batch_size': 30, 'regressor__regressor__epochs': 410, 'regressor__regressor__optimizer': 'Nadam', 'regressor__regressor__optimizer__learning_rate': 9.216646618121753e-05, 'regressor__regressor__model__init_mode': 'glorot_normal', 'regressor__regressor__model__activation': 'elu', 'regressor__regressor__model__dropout_rate': 6.19684147362097e-05, 'regressor__regressor__model__weight_constraint': 3.4957227256791272, 'regressor__regressor__model__regu_L1': 7.554054679272228e-07, 'regressor__regressor__model__regu_L2': 7.1821604118822205e-06, 'regressor__regressor__model__n_layers': 7, 'regressor__regressor__model__n_units': 401, 'regressor__regressor__loss': 'mean_absolute_error'}. Best is trial 199 with value: 0.7759054127864374.[0m
2022-12-29 22:05:43.248536: W tensorflow/compiler/xla/stream_executor/platform/default/dso_loader.cc:64] Could not load dynamic library 'libcudart.so.11.0'; dlerror: libcudart.so.11.0: cannot open shared object file: No such file or directory; LD_LIBRARY_PATH: /.singularity.d/libs
2022-12-29 22:05:44.820986: W tensorflow/compiler/xla/stream_executor/platform/default/dso_loader.cc:64] Could not load dynamic library 'libnvinfer.so.7'; dlerror: libnvinfer.so.7: cannot open shared object file: No such file or directory; LD_LIBRARY_PATH: /.singularity.d/libs
2022-12-29 22:05:44.821151: W tensorflow/compiler/xla/stream_executor/platform/default/dso_loader.cc:64] Could not load dynamic library 'libnvinfer_plugin.so.7'; dlerror: libnvinfer_plugin.so.7: cannot open shared object file: No such file or directory; LD_LIBRARY_PATH: /.singularity.d/libs
2022-12-29 22:05:44.821179: W tensorflow/compiler/tf2tensorrt/utils/py_utils.cc:38] TF-TRT Warning: Cannot dlopen some TensorRT libraries. If you would like to use Nvidia GPU with TensorRT, please make sure the missing libraries mentioned above are installed properly.
2022-12-29 22:05:47.056249: W tensorflow/compiler/xla/stream_executor/platform/default/dso_loader.cc:64] Could not load dynamic library 'libcuda.so.1'; dlerror: libcuda.so.1: cannot open shared object file: No such file or directory; LD_LIBRARY_PATH: /.singularity.d/libs
2022-12-29 22:05:47.056360: W tensorflow/compiler/xla/stream_executor/cuda/cuda_driver.cc:265] failed call to cuInit: UNKNOWN ERROR (303)
[32m[I 2022-12-29 22:28:44,472][0m Trial 224 finished with value: 0.7611565151294052 and parameters: {'regressor__regressor__batch_size': 30, 'regressor__regressor__epochs': 410, 'regressor__regressor__optimizer': 'Nadam', 'regressor__regressor__optimizer__learning_rate': 8.878330468868294e-05, 'regressor__regressor__model__init_mode': 'glorot_normal', 'regressor__regressor__model__activation': 'elu', 'regressor__regressor__model__dropout_rate': 0.01547304682169624, 'regressor__regressor__model__weight_constraint': 3.489634861979506, 'regressor__regressor__model__regu_L1': 7.124965828779899e-07, 'regressor__regressor__model__regu_L2': 1.1826803362534736e-05, 'regressor__regressor__model__n_layers': 7, 'regressor__regressor__model__n_units': 401, 'regressor__regressor__loss': 'mean_absolute_error'}. Best is trial 199 with value: 0.7759054127864374.[0m
2022-12-29 22:28:48.891082: W tensorflow/compiler/xla/stream_executor/platform/default/dso_loader.cc:64] Could not load dynamic library 'libcudart.so.11.0'; dlerror: libcudart.so.11.0: cannot open shared object file: No such file or directory; LD_LIBRARY_PATH: /.singularity.d/libs
2022-12-29 22:28:50.020224: W tensorflow/compiler/xla/stream_executor/platform/default/dso_loader.cc:64] Could not load dynamic library 'libnvinfer.so.7'; dlerror: libnvinfer.so.7: cannot open shared object file: No such file or directory; LD_LIBRARY_PATH: /.singularity.d/libs
2022-12-29 22:28:50.020364: W tensorflow/compiler/xla/stream_executor/platform/default/dso_loader.cc:64] Could not load dynamic library 'libnvinfer_plugin.so.7'; dlerror: libnvinfer_plugin.so.7: cannot open shared object file: No such file or directory; LD_LIBRARY_PATH: /.singularity.d/libs
2022-12-29 22:28:50.020394: W tensorflow/compiler/tf2tensorrt/utils/py_utils.cc:38] TF-TRT Warning: Cannot dlopen some TensorRT libraries. If you would like to use Nvidia GPU with TensorRT, please make sure the missing libraries mentioned above are installed properly.
2022-12-29 22:28:51.928127: W tensorflow/compiler/xla/stream_executor/platform/default/dso_loader.cc:64] Could not load dynamic library 'libcuda.so.1'; dlerror: libcuda.so.1: cannot open shared object file: No such file or directory; LD_LIBRARY_PATH: /.singularity.d/libs
2022-12-29 22:28:51.928245: W tensorflow/compiler/xla/stream_executor/cuda/cuda_driver.cc:265] failed call to cuInit: UNKNOWN ERROR (303)
[32m[I 2022-12-30 00:03:03,793][0m Trial 225 finished with value: 0.7638105021401151 and parameters: {'regressor__regressor__batch_size': 30, 'regressor__regressor__epochs': 430, 'regressor__regressor__optimizer': 'Nadam', 'regressor__regressor__optimizer__learning_rate': 9.119597429866164e-05, 'regressor__regressor__model__init_mode': 'glorot_normal', 'regressor__regressor__model__activation': 'elu', 'regressor__regressor__model__dropout_rate': 0.013045587528423799, 'regressor__regressor__model__weight_constraint': 3.4188252425285874, 'regressor__regressor__model__regu_L1': 7.229953353483651e-07, 'regressor__regressor__model__regu_L2': 6.433531931497722e-06, 'regressor__regressor__model__n_layers': 7, 'regressor__regressor__model__n_units': 381, 'regressor__regressor__loss': 'mean_absolute_error'}. Best is trial 199 with value: 0.7759054127864374.[0m
[32m[I 2022-12-30 01:48:37,052][0m Trial 228 finished with value: 0.696283704799806 and parameters: {'regressor__regressor__batch_size': 30, 'regressor__regressor__epochs': 430, 'regressor__regressor__optimizer': 'Nadam', 'regressor__regressor__optimizer__learning_rate': 6.850959579057871e-05, 'regressor__regressor__model__init_mode': 'glorot_normal', 'regressor__regressor__model__activation': 'elu', 'regressor__regressor__model__dropout_rate': 0.0024872474790083587, 'regressor__regressor__model__weight_constraint': 3.479758427717395, 'regressor__regressor__model__regu_L1': 8.279206832420702e-07, 'regressor__regressor__model__regu_L2': 1.0982907457462585e-05, 'regressor__regressor__model__n_layers': 5, 'regressor__regressor__model__n_units': 381, 'regressor__regressor__loss': 'mean_absolute_error'}. Best is trial 199 with value: 0.7759054127864374.[0m
[32m[I 2022-12-30 01:50:36,263][0m Trial 226 finished with value: 0.7606250604725275 and parameters: {'regressor__regressor__batch_size': 30, 'regressor__regressor__epochs': 430, 'regressor__regressor__optimizer': 'Nadam', 'regressor__regressor__optimizer__learning_rate': 9.444636271887567e-05, 'regressor__regressor__model__init_mode': 'glorot_normal', 'regressor__regressor__model__activation': 'elu', 'regressor__regressor__model__dropout_rate': 0.01277615714151595, 'regressor__regressor__model__weight_constraint': 3.411521533989849, 'regressor__regressor__model__regu_L1': 7.931262588611382e-07, 'regressor__regressor__model__regu_L2': 8.253944871598217e-06, 'regressor__regressor__model__n_layers': 7, 'regressor__regressor__model__n_units': 381, 'regressor__regressor__loss': 'mean_absolute_error'}. Best is trial 199 with value: 0.7759054127864374.[0m
2022-12-30 01:50:41.815529: W tensorflow/compiler/xla/stream_executor/platform/default/dso_loader.cc:64] Could not load dynamic library 'libcudart.so.11.0'; dlerror: libcudart.so.11.0: cannot open shared object file: No such file or directory; LD_LIBRARY_PATH: /.singularity.d/libs
2022-12-30 01:50:43.254152: W tensorflow/compiler/xla/stream_executor/platform/default/dso_loader.cc:64] Could not load dynamic library 'libnvinfer.so.7'; dlerror: libnvinfer.so.7: cannot open shared object file: No such file or directory; LD_LIBRARY_PATH: /.singularity.d/libs
2022-12-30 01:50:43.254276: W tensorflow/compiler/xla/stream_executor/platform/default/dso_loader.cc:64] Could not load dynamic library 'libnvinfer_plugin.so.7'; dlerror: libnvinfer_plugin.so.7: cannot open shared object file: No such file or directory; LD_LIBRARY_PATH: /.singularity.d/libs
2022-12-30 01:50:43.254304: W tensorflow/compiler/tf2tensorrt/utils/py_utils.cc:38] TF-TRT Warning: Cannot dlopen some TensorRT libraries. If you would like to use Nvidia GPU with TensorRT, please make sure the missing libraries mentioned above are installed properly.
2022-12-30 01:50:45.225077: W tensorflow/compiler/xla/stream_executor/platform/default/dso_loader.cc:64] Could not load dynamic library 'libcuda.so.1'; dlerror: libcuda.so.1: cannot open shared object file: No such file or directory; LD_LIBRARY_PATH: /.singularity.d/libs
2022-12-30 01:50:45.225282: W tensorflow/compiler/xla/stream_executor/cuda/cuda_driver.cc:265] failed call to cuInit: UNKNOWN ERROR (303)
[32m[I 2022-12-30 02:03:55,129][0m Trial 229 finished with value: 0.7050065298374599 and parameters: {'regressor__regressor__batch_size': 30, 'regressor__regressor__epochs': 410, 'regressor__regressor__optimizer': 'Nadam', 'regressor__regressor__optimizer__learning_rate': 7.708797654923585e-05, 'regressor__regressor__model__init_mode': 'glorot_normal', 'regressor__regressor__model__activation': 'elu', 'regressor__regressor__model__dropout_rate': 0.015527991509642645, 'regressor__regressor__model__weight_constraint': 3.431415596558658, 'regressor__regressor__model__regu_L1': 7.829279665435584e-07, 'regressor__regressor__model__regu_L2': 1.216224598488369e-05, 'regressor__regressor__model__n_layers': 5, 'regressor__regressor__model__n_units': 381, 'regressor__regressor__loss': 'mean_absolute_error'}. Best is trial 199 with value: 0.7759054127864374.[0m
2022-12-30 02:04:01.987337: W tensorflow/compiler/xla/stream_executor/platform/default/dso_loader.cc:64] Could not load dynamic library 'libcudart.so.11.0'; dlerror: libcudart.so.11.0: cannot open shared object file: No such file or directory; LD_LIBRARY_PATH: /.singularity.d/libs
2022-12-30 02:04:03.620587: W tensorflow/compiler/xla/stream_executor/platform/default/dso_loader.cc:64] Could not load dynamic library 'libnvinfer.so.7'; dlerror: libnvinfer.so.7: cannot open shared object file: No such file or directory; LD_LIBRARY_PATH: /.singularity.d/libs
2022-12-30 02:04:03.621278: W tensorflow/compiler/xla/stream_executor/platform/default/dso_loader.cc:64] Could not load dynamic library 'libnvinfer_plugin.so.7'; dlerror: libnvinfer_plugin.so.7: cannot open shared object file: No such file or directory; LD_LIBRARY_PATH: /.singularity.d/libs
2022-12-30 02:04:03.621309: W tensorflow/compiler/tf2tensorrt/utils/py_utils.cc:38] TF-TRT Warning: Cannot dlopen some TensorRT libraries. If you would like to use Nvidia GPU with TensorRT, please make sure the missing libraries mentioned above are installed properly.
2022-12-30 02:04:06.151690: W tensorflow/compiler/xla/stream_executor/platform/default/dso_loader.cc:64] Could not load dynamic library 'libcuda.so.1'; dlerror: libcuda.so.1: cannot open shared object file: No such file or directory; LD_LIBRARY_PATH: /.singularity.d/libs
2022-12-30 02:04:06.151903: W tensorflow/compiler/xla/stream_executor/cuda/cuda_driver.cc:265] failed call to cuInit: UNKNOWN ERROR (303)
[32m[I 2022-12-30 03:51:51,065][0m Trial 227 finished with value: 0.7525690569223042 and parameters: {'regressor__regressor__batch_size': 30, 'regressor__regressor__epochs': 430, 'regressor__regressor__optimizer': 'Nadam', 'regressor__regressor__optimizer__learning_rate': 9.114585719895061e-05, 'regressor__regressor__model__init_mode': 'glorot_normal', 'regressor__regressor__model__activation': 'elu', 'regressor__regressor__model__dropout_rate': 0.0029150689026377317, 'regressor__regressor__model__weight_constraint': 3.4313484968644197, 'regressor__regressor__model__regu_L1': 8.21541731181207e-07, 'regressor__regressor__model__regu_L2': 1.2226294100232362e-05, 'regressor__regressor__model__n_layers': 7, 'regressor__regressor__model__n_units': 381, 'regressor__regressor__loss': 'mean_absolute_error'}. Best is trial 199 with value: 0.7759054127864374.[0m
2022-12-30 03:51:56.466572: W tensorflow/compiler/xla/stream_executor/platform/default/dso_loader.cc:64] Could not load dynamic library 'libcudart.so.11.0'; dlerror: libcudart.so.11.0: cannot open shared object file: No such file or directory; LD_LIBRARY_PATH: /.singularity.d/libs
2022-12-30 03:51:58.152668: W tensorflow/compiler/xla/stream_executor/platform/default/dso_loader.cc:64] Could not load dynamic library 'libnvinfer.so.7'; dlerror: libnvinfer.so.7: cannot open shared object file: No such file or directory; LD_LIBRARY_PATH: /.singularity.d/libs
2022-12-30 03:51:58.152937: W tensorflow/compiler/xla/stream_executor/platform/default/dso_loader.cc:64] Could not load dynamic library 'libnvinfer_plugin.so.7'; dlerror: libnvinfer_plugin.so.7: cannot open shared object file: No such file or directory; LD_LIBRARY_PATH: /.singularity.d/libs
2022-12-30 03:51:58.152998: W tensorflow/compiler/tf2tensorrt/utils/py_utils.cc:38] TF-TRT Warning: Cannot dlopen some TensorRT libraries. If you would like to use Nvidia GPU with TensorRT, please make sure the missing libraries mentioned above are installed properly.
2022-12-30 03:52:00.741291: W tensorflow/compiler/xla/stream_executor/platform/default/dso_loader.cc:64] Could not load dynamic library 'libcuda.so.1'; dlerror: libcuda.so.1: cannot open shared object file: No such file or directory; LD_LIBRARY_PATH: /.singularity.d/libs
2022-12-30 03:52:00.741858: W tensorflow/compiler/xla/stream_executor/cuda/cuda_driver.cc:265] failed call to cuInit: UNKNOWN ERROR (303)
[32m[I 2022-12-30 04:01:38,041][0m Trial 230 finished with value: 0.7098319971078053 and parameters: {'regressor__regressor__batch_size': 30, 'regressor__regressor__epochs': 430, 'regressor__regressor__optimizer': 'Nadam', 'regressor__regressor__optimizer__learning_rate': 7.764610959931454e-05, 'regressor__regressor__model__init_mode': 'glorot_normal', 'regressor__regressor__model__activation': 'elu', 'regressor__regressor__model__dropout_rate': 0.014060932012096369, 'regressor__regressor__model__weight_constraint': 3.3934364809158977, 'regressor__regressor__model__regu_L1': 8.214778418444578e-07, 'regressor__regressor__model__regu_L2': 7.406281416753556e-06, 'regressor__regressor__model__n_layers': 5, 'regressor__regressor__model__n_units': 381, 'regressor__regressor__loss': 'mean_absolute_error'}. Best is trial 199 with value: 0.7759054127864374.[0m
[32m[I 2022-12-30 07:14:52,786][0m Trial 232 finished with value: 0.7517012935309146 and parameters: {'regressor__regressor__batch_size': 30, 'regressor__regressor__epochs': 390, 'regressor__regressor__optimizer': 'Nadam', 'regressor__regressor__optimizer__learning_rate': 7.840941511290125e-05, 'regressor__regressor__model__init_mode': 'glorot_normal', 'regressor__regressor__model__activation': 'elu', 'regressor__regressor__model__dropout_rate': 0.021186676879391853, 'regressor__regressor__model__weight_constraint': 3.401089225934042, 'regressor__regressor__model__regu_L1': 1.7939504406435645e-06, 'regressor__regressor__model__regu_L2': 1.1687464954921793e-05, 'regressor__regressor__model__n_layers': 7, 'regressor__regressor__model__n_units': 381, 'regressor__regressor__loss': 'mean_absolute_error'}. Best is trial 199 with value: 0.7759054127864374.[0m
[32m[I 2022-12-30 07:17:56,295][0m Trial 231 finished with value: 0.7549441196439366 and parameters: {'regressor__regressor__batch_size': 30, 'regressor__regressor__epochs': 390, 'regressor__regressor__optimizer': 'Nadam', 'regressor__regressor__optimizer__learning_rate': 8.611933148051641e-05, 'regressor__regressor__model__init_mode': 'glorot_normal', 'regressor__regressor__model__activation': 'elu', 'regressor__regressor__model__dropout_rate': 0.016554673815286594, 'regressor__regressor__model__weight_constraint': 3.415354765800241, 'regressor__regressor__model__regu_L1': 8.235800143945955e-07, 'regressor__regressor__model__regu_L2': 1.2026026506490062e-05, 'regressor__regressor__model__n_layers': 7, 'regressor__regressor__model__n_units': 401, 'regressor__regressor__loss': 'mean_absolute_error'}. Best is trial 199 with value: 0.7759054127864374.[0m
2022-12-30 07:18:02.324239: W tensorflow/compiler/xla/stream_executor/platform/default/dso_loader.cc:64] Could not load dynamic library 'libcudart.so.11.0'; dlerror: libcudart.so.11.0: cannot open shared object file: No such file or directory; LD_LIBRARY_PATH: /.singularity.d/libs
2022-12-30 07:18:03.903262: W tensorflow/compiler/xla/stream_executor/platform/default/dso_loader.cc:64] Could not load dynamic library 'libnvinfer.so.7'; dlerror: libnvinfer.so.7: cannot open shared object file: No such file or directory; LD_LIBRARY_PATH: /.singularity.d/libs
2022-12-30 07:18:03.903428: W tensorflow/compiler/xla/stream_executor/platform/default/dso_loader.cc:64] Could not load dynamic library 'libnvinfer_plugin.so.7'; dlerror: libnvinfer_plugin.so.7: cannot open shared object file: No such file or directory; LD_LIBRARY_PATH: /.singularity.d/libs
2022-12-30 07:18:03.903455: W tensorflow/compiler/tf2tensorrt/utils/py_utils.cc:38] TF-TRT Warning: Cannot dlopen some TensorRT libraries. If you would like to use Nvidia GPU with TensorRT, please make sure the missing libraries mentioned above are installed properly.
2022-12-30 07:18:05.970092: W tensorflow/compiler/xla/stream_executor/platform/default/dso_loader.cc:64] Could not load dynamic library 'libcuda.so.1'; dlerror: libcuda.so.1: cannot open shared object file: No such file or directory; LD_LIBRARY_PATH: /.singularity.d/libs
2022-12-30 07:18:05.970202: W tensorflow/compiler/xla/stream_executor/cuda/cuda_driver.cc:265] failed call to cuInit: UNKNOWN ERROR (303)
[32m[I 2022-12-30 07:31:41,054][0m Trial 233 finished with value: 0.7590320842069339 and parameters: {'regressor__regressor__batch_size': 30, 'regressor__regressor__epochs': 390, 'regressor__regressor__optimizer': 'Nadam', 'regressor__regressor__optimizer__learning_rate': 9.406717615729022e-05, 'regressor__regressor__model__init_mode': 'glorot_normal', 'regressor__regressor__model__activation': 'elu', 'regressor__regressor__model__dropout_rate': 0.028087774019496414, 'regressor__regressor__model__weight_constraint': 3.371627773462822, 'regressor__regressor__model__regu_L1': 9.128118986949562e-07, 'regressor__regressor__model__regu_L2': 4.723240754045637e-06, 'regressor__regressor__model__n_layers': 7, 'regressor__regressor__model__n_units': 361, 'regressor__regressor__loss': 'mean_absolute_error'}. Best is trial 199 with value: 0.7759054127864374.[0m
2022-12-30 07:31:47.391787: W tensorflow/compiler/xla/stream_executor/platform/default/dso_loader.cc:64] Could not load dynamic library 'libcudart.so.11.0'; dlerror: libcudart.so.11.0: cannot open shared object file: No such file or directory; LD_LIBRARY_PATH: /.singularity.d/libs
2022-12-30 07:31:49.381979: W tensorflow/compiler/xla/stream_executor/platform/default/dso_loader.cc:64] Could not load dynamic library 'libnvinfer.so.7'; dlerror: libnvinfer.so.7: cannot open shared object file: No such file or directory; LD_LIBRARY_PATH: /.singularity.d/libs
2022-12-30 07:31:49.382125: W tensorflow/compiler/xla/stream_executor/platform/default/dso_loader.cc:64] Could not load dynamic library 'libnvinfer_plugin.so.7'; dlerror: libnvinfer_plugin.so.7: cannot open shared object file: No such file or directory; LD_LIBRARY_PATH: /.singularity.d/libs
2022-12-30 07:31:49.382152: W tensorflow/compiler/tf2tensorrt/utils/py_utils.cc:38] TF-TRT Warning: Cannot dlopen some TensorRT libraries. If you would like to use Nvidia GPU with TensorRT, please make sure the missing libraries mentioned above are installed properly.
2022-12-30 07:31:51.826659: W tensorflow/compiler/xla/stream_executor/platform/default/dso_loader.cc:64] Could not load dynamic library 'libcuda.so.1'; dlerror: libcuda.so.1: cannot open shared object file: No such file or directory; LD_LIBRARY_PATH: /.singularity.d/libs
2022-12-30 07:31:51.826788: W tensorflow/compiler/xla/stream_executor/cuda/cuda_driver.cc:265] failed call to cuInit: UNKNOWN ERROR (303)
