[32m[I 2022-12-25 03:04:22,832][0m Trial 110 finished with value: -17172888478608.354 and parameters: {'regressor__regressor__batch_size': 50, 'regressor__regressor__epochs': 290, 'regressor__regressor__optimizer': 'Adamax', 'regressor__regressor__optimizer__learning_rate': 0.0014150646253914937, 'regressor__regressor__model__init_mode': 'ones', 'regressor__regressor__model__activation': 'linear', 'regressor__regressor__model__dropout_rate': 0.0472968388158167, 'regressor__regressor__model__weight_constraint': 2.191076839534694, 'regressor__regressor__model__regu_L1': 3.4401663449748754e-07, 'regressor__regressor__model__regu_L2': 1.4478534627113462e-05, 'regressor__regressor__model__n_layers': 17, 'regressor__regressor__model__n_units': 201, 'regressor__regressor__loss': 'mae'}. Best is trial 15 with value: 0.713745100510843.[0m
/usr/local/lib/python3.9/dist-packages/sklearn/model_selection/_validation.py:776: UserWarning: Scoring failed. The score on this train-test partition for these parameters will be set to nan. Details: 
Traceback (most recent call last):
  File "/usr/local/lib/python3.9/dist-packages/sklearn/model_selection/_validation.py", line 767, in _score
    scores = scorer(estimator, X_test, y_test)
  File "/usr/local/lib/python3.9/dist-packages/sklearn/metrics/_scorer.py", line 107, in __call__
    score = scorer._score(cached_call, estimator, *args, **kwargs)
  File "/usr/local/lib/python3.9/dist-packages/sklearn/metrics/_scorer.py", line 268, in _score
    return self._sign * self._score_func(y_true, y_pred, **self._kwargs)
  File "/usr/local/lib/python3.9/dist-packages/sklearn/metrics/_regression.py", line 911, in r2_score
    y_type, y_true, y_pred, multioutput = _check_reg_targets(
  File "/usr/local/lib/python3.9/dist-packages/sklearn/metrics/_regression.py", line 102, in _check_reg_targets
    y_pred = check_array(y_pred, ensure_2d=False, dtype=dtype)
  File "/usr/local/lib/python3.9/dist-packages/sklearn/utils/validation.py", line 919, in check_array
    _assert_all_finite(
  File "/usr/local/lib/python3.9/dist-packages/sklearn/utils/validation.py", line 161, in _assert_all_finite
    raise ValueError(msg_err)
ValueError: Input contains NaN.

  warnings.warn(
[33m[W 2022-12-25 03:04:52,253][0m Trial 112 failed because of the following error: The value nan is not acceptable.[0m
/usr/local/lib/python3.9/dist-packages/sklearn/model_selection/_validation.py:776: UserWarning: Scoring failed. The score on this train-test partition for these parameters will be set to nan. Details: 
Traceback (most recent call last):
  File "/usr/local/lib/python3.9/dist-packages/sklearn/model_selection/_validation.py", line 767, in _score
    scores = scorer(estimator, X_test, y_test)
  File "/usr/local/lib/python3.9/dist-packages/sklearn/metrics/_scorer.py", line 107, in __call__
    score = scorer._score(cached_call, estimator, *args, **kwargs)
  File "/usr/local/lib/python3.9/dist-packages/sklearn/metrics/_scorer.py", line 268, in _score
    return self._sign * self._score_func(y_true, y_pred, **self._kwargs)
  File "/usr/local/lib/python3.9/dist-packages/sklearn/metrics/_regression.py", line 911, in r2_score
    y_type, y_true, y_pred, multioutput = _check_reg_targets(
  File "/usr/local/lib/python3.9/dist-packages/sklearn/metrics/_regression.py", line 102, in _check_reg_targets
    y_pred = check_array(y_pred, ensure_2d=False, dtype=dtype)
  File "/usr/local/lib/python3.9/dist-packages/sklearn/utils/validation.py", line 919, in check_array
    _assert_all_finite(
  File "/usr/local/lib/python3.9/dist-packages/sklearn/utils/validation.py", line 161, in _assert_all_finite
    raise ValueError(msg_err)
ValueError: Input contains NaN.

  warnings.warn(
/usr/local/lib/python3.9/dist-packages/sklearn/model_selection/_validation.py:776: UserWarning: Scoring failed. The score on this train-test partition for these parameters will be set to nan. Details: 
Traceback (most recent call last):
  File "/usr/local/lib/python3.9/dist-packages/sklearn/model_selection/_validation.py", line 767, in _score
    scores = scorer(estimator, X_test, y_test)
  File "/usr/local/lib/python3.9/dist-packages/sklearn/metrics/_scorer.py", line 107, in __call__
    score = scorer._score(cached_call, estimator, *args, **kwargs)
  File "/usr/local/lib/python3.9/dist-packages/sklearn/metrics/_scorer.py", line 268, in _score
    return self._sign * self._score_func(y_true, y_pred, **self._kwargs)
  File "/usr/local/lib/python3.9/dist-packages/sklearn/metrics/_regression.py", line 911, in r2_score
    y_type, y_true, y_pred, multioutput = _check_reg_targets(
  File "/usr/local/lib/python3.9/dist-packages/sklearn/metrics/_regression.py", line 102, in _check_reg_targets
    y_pred = check_array(y_pred, ensure_2d=False, dtype=dtype)
  File "/usr/local/lib/python3.9/dist-packages/sklearn/utils/validation.py", line 919, in check_array
    _assert_all_finite(
  File "/usr/local/lib/python3.9/dist-packages/sklearn/utils/validation.py", line 161, in _assert_all_finite
    raise ValueError(msg_err)
ValueError: Input contains NaN.

  warnings.warn(
/usr/local/lib/python3.9/dist-packages/sklearn/model_selection/_validation.py:776: UserWarning: Scoring failed. The score on this train-test partition for these parameters will be set to nan. Details: 
Traceback (most recent call last):
  File "/usr/local/lib/python3.9/dist-packages/sklearn/model_selection/_validation.py", line 767, in _score
    scores = scorer(estimator, X_test, y_test)
  File "/usr/local/lib/python3.9/dist-packages/sklearn/metrics/_scorer.py", line 107, in __call__
    score = scorer._score(cached_call, estimator, *args, **kwargs)
  File "/usr/local/lib/python3.9/dist-packages/sklearn/metrics/_scorer.py", line 268, in _score
    return self._sign * self._score_func(y_true, y_pred, **self._kwargs)
  File "/usr/local/lib/python3.9/dist-packages/sklearn/metrics/_regression.py", line 911, in r2_score
    y_type, y_true, y_pred, multioutput = _check_reg_targets(
  File "/usr/local/lib/python3.9/dist-packages/sklearn/metrics/_regression.py", line 102, in _check_reg_targets
    y_pred = check_array(y_pred, ensure_2d=False, dtype=dtype)
  File "/usr/local/lib/python3.9/dist-packages/sklearn/utils/validation.py", line 919, in check_array
    _assert_all_finite(
  File "/usr/local/lib/python3.9/dist-packages/sklearn/utils/validation.py", line 161, in _assert_all_finite
    raise ValueError(msg_err)
ValueError: Input contains NaN.

  warnings.warn(
/usr/local/lib/python3.9/dist-packages/sklearn/model_selection/_validation.py:776: UserWarning: Scoring failed. The score on this train-test partition for these parameters will be set to nan. Details: 
Traceback (most recent call last):
  File "/usr/local/lib/python3.9/dist-packages/sklearn/model_selection/_validation.py", line 767, in _score
    scores = scorer(estimator, X_test, y_test)
  File "/usr/local/lib/python3.9/dist-packages/sklearn/metrics/_scorer.py", line 107, in __call__
    score = scorer._score(cached_call, estimator, *args, **kwargs)
  File "/usr/local/lib/python3.9/dist-packages/sklearn/metrics/_scorer.py", line 268, in _score
    return self._sign * self._score_func(y_true, y_pred, **self._kwargs)
  File "/usr/local/lib/python3.9/dist-packages/sklearn/metrics/_regression.py", line 911, in r2_score
    y_type, y_true, y_pred, multioutput = _check_reg_targets(
  File "/usr/local/lib/python3.9/dist-packages/sklearn/metrics/_regression.py", line 102, in _check_reg_targets
    y_pred = check_array(y_pred, ensure_2d=False, dtype=dtype)
  File "/usr/local/lib/python3.9/dist-packages/sklearn/utils/validation.py", line 919, in check_array
    _assert_all_finite(
  File "/usr/local/lib/python3.9/dist-packages/sklearn/utils/validation.py", line 161, in _assert_all_finite
    raise ValueError(msg_err)
ValueError: Input contains NaN.

  warnings.warn(
/usr/local/lib/python3.9/dist-packages/sklearn/model_selection/_validation.py:776: UserWarning: Scoring failed. The score on this train-test partition for these parameters will be set to nan. Details: 
Traceback (most recent call last):
  File "/usr/local/lib/python3.9/dist-packages/sklearn/model_selection/_validation.py", line 767, in _score
    scores = scorer(estimator, X_test, y_test)
  File "/usr/local/lib/python3.9/dist-packages/sklearn/metrics/_scorer.py", line 107, in __call__
    score = scorer._score(cached_call, estimator, *args, **kwargs)
  File "/usr/local/lib/python3.9/dist-packages/sklearn/metrics/_scorer.py", line 268, in _score
    return self._sign * self._score_func(y_true, y_pred, **self._kwargs)
  File "/usr/local/lib/python3.9/dist-packages/sklearn/metrics/_regression.py", line 911, in r2_score
    y_type, y_true, y_pred, multioutput = _check_reg_targets(
  File "/usr/local/lib/python3.9/dist-packages/sklearn/metrics/_regression.py", line 102, in _check_reg_targets
    y_pred = check_array(y_pred, ensure_2d=False, dtype=dtype)
  File "/usr/local/lib/python3.9/dist-packages/sklearn/utils/validation.py", line 919, in check_array
    _assert_all_finite(
  File "/usr/local/lib/python3.9/dist-packages/sklearn/utils/validation.py", line 161, in _assert_all_finite
    raise ValueError(msg_err)
ValueError: Input contains NaN.

  warnings.warn(
/usr/local/lib/python3.9/dist-packages/sklearn/model_selection/_validation.py:776: UserWarning: Scoring failed. The score on this train-test partition for these parameters will be set to nan. Details: 
Traceback (most recent call last):
  File "/usr/local/lib/python3.9/dist-packages/sklearn/model_selection/_validation.py", line 767, in _score
    scores = scorer(estimator, X_test, y_test)
  File "/usr/local/lib/python3.9/dist-packages/sklearn/metrics/_scorer.py", line 107, in __call__
    score = scorer._score(cached_call, estimator, *args, **kwargs)
  File "/usr/local/lib/python3.9/dist-packages/sklearn/metrics/_scorer.py", line 268, in _score
    return self._sign * self._score_func(y_true, y_pred, **self._kwargs)
  File "/usr/local/lib/python3.9/dist-packages/sklearn/metrics/_regression.py", line 911, in r2_score
    y_type, y_true, y_pred, multioutput = _check_reg_targets(
  File "/usr/local/lib/python3.9/dist-packages/sklearn/metrics/_regression.py", line 102, in _check_reg_targets
    y_pred = check_array(y_pred, ensure_2d=False, dtype=dtype)
  File "/usr/local/lib/python3.9/dist-packages/sklearn/utils/validation.py", line 919, in check_array
    _assert_all_finite(
  File "/usr/local/lib/python3.9/dist-packages/sklearn/utils/validation.py", line 161, in _assert_all_finite
    raise ValueError(msg_err)
ValueError: Input contains NaN.

  warnings.warn(
[32m[I 2022-12-25 03:32:10,226][0m Trial 117 finished with value: -0.0007154505820681001 and parameters: {'regressor__regressor__batch_size': 160, 'regressor__regressor__epochs': 350, 'regressor__regressor__optimizer': 'Ftrl', 'regressor__regressor__optimizer__learning_rate': 0.00018603911506139264, 'regressor__regressor__model__init_mode': 'lecun_uniform', 'regressor__regressor__model__activation': 'hard_sigmoid', 'regressor__regressor__model__dropout_rate': 0.09038894183491045, 'regressor__regressor__model__weight_constraint': 1.7188111671991502, 'regressor__regressor__model__regu_L1': 8.259630837103301e-05, 'regressor__regressor__model__regu_L2': 9.916892464868677e-07, 'regressor__regressor__model__n_layers': 9, 'regressor__regressor__model__n_units': 141, 'regressor__regressor__loss': 'mse'}. Best is trial 15 with value: 0.713745100510843.[0m
[32m[I 2022-12-25 03:32:11,821][0m Trial 116 finished with value: -0.0007118101867927829 and parameters: {'regressor__regressor__batch_size': 160, 'regressor__regressor__epochs': 330, 'regressor__regressor__optimizer': 'Ftrl', 'regressor__regressor__optimizer__learning_rate': 2.4355700840369744e-05, 'regressor__regressor__model__init_mode': 'constant', 'regressor__regressor__model__activation': 'exponential', 'regressor__regressor__model__dropout_rate': 0.09680789343128805, 'regressor__regressor__model__weight_constraint': 1.736707300176274, 'regressor__regressor__model__regu_L1': 7.319316357083472e-05, 'regressor__regressor__model__regu_L2': 9.921765820836356e-07, 'regressor__regressor__model__n_layers': 7, 'regressor__regressor__model__n_units': 221, 'regressor__regressor__loss': 'mse'}. Best is trial 15 with value: 0.713745100510843.[0m
/usr/local/lib/python3.9/dist-packages/sklearn/model_selection/_validation.py:776: UserWarning: Scoring failed. The score on this train-test partition for these parameters will be set to nan. Details: 
Traceback (most recent call last):
  File "/usr/local/lib/python3.9/dist-packages/sklearn/model_selection/_validation.py", line 767, in _score
    scores = scorer(estimator, X_test, y_test)
  File "/usr/local/lib/python3.9/dist-packages/sklearn/metrics/_scorer.py", line 107, in __call__
    score = scorer._score(cached_call, estimator, *args, **kwargs)
  File "/usr/local/lib/python3.9/dist-packages/sklearn/metrics/_scorer.py", line 268, in _score
    return self._sign * self._score_func(y_true, y_pred, **self._kwargs)
  File "/usr/local/lib/python3.9/dist-packages/sklearn/metrics/_regression.py", line 911, in r2_score
    y_type, y_true, y_pred, multioutput = _check_reg_targets(
  File "/usr/local/lib/python3.9/dist-packages/sklearn/metrics/_regression.py", line 102, in _check_reg_targets
    y_pred = check_array(y_pred, ensure_2d=False, dtype=dtype)
  File "/usr/local/lib/python3.9/dist-packages/sklearn/utils/validation.py", line 919, in check_array
    _assert_all_finite(
  File "/usr/local/lib/python3.9/dist-packages/sklearn/utils/validation.py", line 161, in _assert_all_finite
    raise ValueError(msg_err)
ValueError: Input contains NaN.

  warnings.warn(
/usr/local/lib/python3.9/dist-packages/sklearn/model_selection/_validation.py:776: UserWarning: Scoring failed. The score on this train-test partition for these parameters will be set to nan. Details: 
Traceback (most recent call last):
  File "/usr/local/lib/python3.9/dist-packages/sklearn/model_selection/_validation.py", line 767, in _score
    scores = scorer(estimator, X_test, y_test)
  File "/usr/local/lib/python3.9/dist-packages/sklearn/metrics/_scorer.py", line 107, in __call__
    score = scorer._score(cached_call, estimator, *args, **kwargs)
  File "/usr/local/lib/python3.9/dist-packages/sklearn/metrics/_scorer.py", line 268, in _score
    return self._sign * self._score_func(y_true, y_pred, **self._kwargs)
  File "/usr/local/lib/python3.9/dist-packages/sklearn/metrics/_regression.py", line 911, in r2_score
    y_type, y_true, y_pred, multioutput = _check_reg_targets(
  File "/usr/local/lib/python3.9/dist-packages/sklearn/metrics/_regression.py", line 102, in _check_reg_targets
    y_pred = check_array(y_pred, ensure_2d=False, dtype=dtype)
  File "/usr/local/lib/python3.9/dist-packages/sklearn/utils/validation.py", line 919, in check_array
    _assert_all_finite(
  File "/usr/local/lib/python3.9/dist-packages/sklearn/utils/validation.py", line 161, in _assert_all_finite
    raise ValueError(msg_err)
ValueError: Input contains NaN.

  warnings.warn(
[33m[W 2022-12-25 03:36:31,463][0m Trial 111 failed because of the following error: The value nan is not acceptable.[0m
/usr/local/lib/python3.9/dist-packages/sklearn/model_selection/_validation.py:776: UserWarning: Scoring failed. The score on this train-test partition for these parameters will be set to nan. Details: 
Traceback (most recent call last):
  File "/usr/local/lib/python3.9/dist-packages/sklearn/model_selection/_validation.py", line 767, in _score
    scores = scorer(estimator, X_test, y_test)
  File "/usr/local/lib/python3.9/dist-packages/sklearn/metrics/_scorer.py", line 107, in __call__
    score = scorer._score(cached_call, estimator, *args, **kwargs)
  File "/usr/local/lib/python3.9/dist-packages/sklearn/metrics/_scorer.py", line 268, in _score
    return self._sign * self._score_func(y_true, y_pred, **self._kwargs)
  File "/usr/local/lib/python3.9/dist-packages/sklearn/metrics/_regression.py", line 911, in r2_score
    y_type, y_true, y_pred, multioutput = _check_reg_targets(
  File "/usr/local/lib/python3.9/dist-packages/sklearn/metrics/_regression.py", line 102, in _check_reg_targets
    y_pred = check_array(y_pred, ensure_2d=False, dtype=dtype)
  File "/usr/local/lib/python3.9/dist-packages/sklearn/utils/validation.py", line 919, in check_array
    _assert_all_finite(
  File "/usr/local/lib/python3.9/dist-packages/sklearn/utils/validation.py", line 161, in _assert_all_finite
    raise ValueError(msg_err)
ValueError: Input contains NaN.

  warnings.warn(
/usr/local/lib/python3.9/dist-packages/sklearn/model_selection/_validation.py:776: UserWarning: Scoring failed. The score on this train-test partition for these parameters will be set to nan. Details: 
Traceback (most recent call last):
  File "/usr/local/lib/python3.9/dist-packages/sklearn/model_selection/_validation.py", line 767, in _score
    scores = scorer(estimator, X_test, y_test)
  File "/usr/local/lib/python3.9/dist-packages/sklearn/metrics/_scorer.py", line 107, in __call__
    score = scorer._score(cached_call, estimator, *args, **kwargs)
  File "/usr/local/lib/python3.9/dist-packages/sklearn/metrics/_scorer.py", line 268, in _score
    return self._sign * self._score_func(y_true, y_pred, **self._kwargs)
  File "/usr/local/lib/python3.9/dist-packages/sklearn/metrics/_regression.py", line 911, in r2_score
    y_type, y_true, y_pred, multioutput = _check_reg_targets(
  File "/usr/local/lib/python3.9/dist-packages/sklearn/metrics/_regression.py", line 102, in _check_reg_targets
    y_pred = check_array(y_pred, ensure_2d=False, dtype=dtype)
  File "/usr/local/lib/python3.9/dist-packages/sklearn/utils/validation.py", line 919, in check_array
    _assert_all_finite(
  File "/usr/local/lib/python3.9/dist-packages/sklearn/utils/validation.py", line 161, in _assert_all_finite
    raise ValueError(msg_err)
ValueError: Input contains NaN.

  warnings.warn(
/usr/local/lib/python3.9/dist-packages/sklearn/model_selection/_validation.py:776: UserWarning: Scoring failed. The score on this train-test partition for these parameters will be set to nan. Details: 
Traceback (most recent call last):
  File "/usr/local/lib/python3.9/dist-packages/sklearn/model_selection/_validation.py", line 767, in _score
    scores = scorer(estimator, X_test, y_test)
  File "/usr/local/lib/python3.9/dist-packages/sklearn/metrics/_scorer.py", line 107, in __call__
    score = scorer._score(cached_call, estimator, *args, **kwargs)
  File "/usr/local/lib/python3.9/dist-packages/sklearn/metrics/_scorer.py", line 268, in _score
    return self._sign * self._score_func(y_true, y_pred, **self._kwargs)
  File "/usr/local/lib/python3.9/dist-packages/sklearn/metrics/_regression.py", line 911, in r2_score
    y_type, y_true, y_pred, multioutput = _check_reg_targets(
  File "/usr/local/lib/python3.9/dist-packages/sklearn/metrics/_regression.py", line 102, in _check_reg_targets
    y_pred = check_array(y_pred, ensure_2d=False, dtype=dtype)
  File "/usr/local/lib/python3.9/dist-packages/sklearn/utils/validation.py", line 919, in check_array
    _assert_all_finite(
  File "/usr/local/lib/python3.9/dist-packages/sklearn/utils/validation.py", line 161, in _assert_all_finite
    raise ValueError(msg_err)
ValueError: Input contains NaN.

  warnings.warn(
