[32m[I 2023-01-01 12:47:55,620][0m Trial 273 finished with value: 0.7687513387117906 and parameters: {'regressor__regressor__batch_size': 20, 'regressor__regressor__epochs': 330, 'regressor__regressor__optimizer': 'Nadam', 'regressor__regressor__optimizer__learning_rate': 0.00013848706426442927, 'regressor__regressor__model__init_mode': 'glorot_normal', 'regressor__regressor__model__activation': 'elu', 'regressor__regressor__model__dropout_rate': 0.04928309095481775, 'regressor__regressor__model__weight_constraint': 4.095647083756705, 'regressor__regressor__model__regu_L1': 1.6251988573264125e-06, 'regressor__regressor__model__regu_L2': 2.05266236310606e-05, 'regressor__regressor__model__n_layers': 7, 'regressor__regressor__model__n_units': 321, 'regressor__regressor__loss': 'mean_absolute_error'}. Best is trial 266 with value: 0.7782852798158189.[0m
2023-01-01 12:47:59.981043: W tensorflow/compiler/xla/stream_executor/platform/default/dso_loader.cc:64] Could not load dynamic library 'libcudart.so.11.0'; dlerror: libcudart.so.11.0: cannot open shared object file: No such file or directory; LD_LIBRARY_PATH: /.singularity.d/libs
2023-01-01 12:48:01.549120: W tensorflow/compiler/xla/stream_executor/platform/default/dso_loader.cc:64] Could not load dynamic library 'libnvinfer.so.7'; dlerror: libnvinfer.so.7: cannot open shared object file: No such file or directory; LD_LIBRARY_PATH: /.singularity.d/libs
2023-01-01 12:48:01.549248: W tensorflow/compiler/xla/stream_executor/platform/default/dso_loader.cc:64] Could not load dynamic library 'libnvinfer_plugin.so.7'; dlerror: libnvinfer_plugin.so.7: cannot open shared object file: No such file or directory; LD_LIBRARY_PATH: /.singularity.d/libs
2023-01-01 12:48:01.549272: W tensorflow/compiler/tf2tensorrt/utils/py_utils.cc:38] TF-TRT Warning: Cannot dlopen some TensorRT libraries. If you would like to use Nvidia GPU with TensorRT, please make sure the missing libraries mentioned above are installed properly.
2023-01-01 12:48:03.828051: W tensorflow/compiler/xla/stream_executor/platform/default/dso_loader.cc:64] Could not load dynamic library 'libcuda.so.1'; dlerror: libcuda.so.1: cannot open shared object file: No such file or directory; LD_LIBRARY_PATH: /.singularity.d/libs
2023-01-01 12:48:03.828217: W tensorflow/compiler/xla/stream_executor/cuda/cuda_driver.cc:265] failed call to cuInit: UNKNOWN ERROR (303)
[32m[I 2023-01-01 13:03:10,836][0m Trial 272 finished with value: 0.7633291450839605 and parameters: {'regressor__regressor__batch_size': 20, 'regressor__regressor__epochs': 330, 'regressor__regressor__optimizer': 'Nadam', 'regressor__regressor__optimizer__learning_rate': 0.00013742503263402137, 'regressor__regressor__model__init_mode': 'glorot_normal', 'regressor__regressor__model__activation': 'elu', 'regressor__regressor__model__dropout_rate': 0.05566025972294479, 'regressor__regressor__model__weight_constraint': 4.053158487772266, 'regressor__regressor__model__regu_L1': 1.2876788915830794e-06, 'regressor__regressor__model__regu_L2': 1.8958953204858487e-05, 'regressor__regressor__model__n_layers': 7, 'regressor__regressor__model__n_units': 321, 'regressor__regressor__loss': 'mean_absolute_error'}. Best is trial 266 with value: 0.7782852798158189.[0m
2023-01-01 13:03:15.533076: W tensorflow/compiler/xla/stream_executor/platform/default/dso_loader.cc:64] Could not load dynamic library 'libcudart.so.11.0'; dlerror: libcudart.so.11.0: cannot open shared object file: No such file or directory; LD_LIBRARY_PATH: /.singularity.d/libs
2023-01-01 13:03:16.926062: W tensorflow/compiler/xla/stream_executor/platform/default/dso_loader.cc:64] Could not load dynamic library 'libnvinfer.so.7'; dlerror: libnvinfer.so.7: cannot open shared object file: No such file or directory; LD_LIBRARY_PATH: /.singularity.d/libs
2023-01-01 13:03:16.926193: W tensorflow/compiler/xla/stream_executor/platform/default/dso_loader.cc:64] Could not load dynamic library 'libnvinfer_plugin.so.7'; dlerror: libnvinfer_plugin.so.7: cannot open shared object file: No such file or directory; LD_LIBRARY_PATH: /.singularity.d/libs
2023-01-01 13:03:16.926218: W tensorflow/compiler/tf2tensorrt/utils/py_utils.cc:38] TF-TRT Warning: Cannot dlopen some TensorRT libraries. If you would like to use Nvidia GPU with TensorRT, please make sure the missing libraries mentioned above are installed properly.
2023-01-01 13:03:18.568943: W tensorflow/compiler/xla/stream_executor/platform/default/dso_loader.cc:64] Could not load dynamic library 'libcuda.so.1'; dlerror: libcuda.so.1: cannot open shared object file: No such file or directory; LD_LIBRARY_PATH: /.singularity.d/libs
2023-01-01 13:03:18.569362: W tensorflow/compiler/xla/stream_executor/cuda/cuda_driver.cc:265] failed call to cuInit: UNKNOWN ERROR (303)
[32m[I 2023-01-01 16:13:35,834][0m Trial 274 finished with value: 0.7761631503608653 and parameters: {'regressor__regressor__batch_size': 20, 'regressor__regressor__epochs': 390, 'regressor__regressor__optimizer': 'Nadam', 'regressor__regressor__optimizer__learning_rate': 0.0001410165240143092, 'regressor__regressor__model__init_mode': 'glorot_normal', 'regressor__regressor__model__activation': 'elu', 'regressor__regressor__model__dropout_rate': 0.05474430160950383, 'regressor__regressor__model__weight_constraint': 4.079845777878982, 'regressor__regressor__model__regu_L1': 1.7224221277483512e-06, 'regressor__regressor__model__regu_L2': 2.0755363327262333e-05, 'regressor__regressor__model__n_layers': 7, 'regressor__regressor__model__n_units': 381, 'regressor__regressor__loss': 'mean_absolute_error'}. Best is trial 266 with value: 0.7782852798158189.[0m
2023-01-01 16:13:39.922451: W tensorflow/compiler/xla/stream_executor/platform/default/dso_loader.cc:64] Could not load dynamic library 'libcudart.so.11.0'; dlerror: libcudart.so.11.0: cannot open shared object file: No such file or directory; LD_LIBRARY_PATH: /.singularity.d/libs
2023-01-01 16:13:41.003884: W tensorflow/compiler/xla/stream_executor/platform/default/dso_loader.cc:64] Could not load dynamic library 'libnvinfer.so.7'; dlerror: libnvinfer.so.7: cannot open shared object file: No such file or directory; LD_LIBRARY_PATH: /.singularity.d/libs
2023-01-01 16:13:41.004078: W tensorflow/compiler/xla/stream_executor/platform/default/dso_loader.cc:64] Could not load dynamic library 'libnvinfer_plugin.so.7'; dlerror: libnvinfer_plugin.so.7: cannot open shared object file: No such file or directory; LD_LIBRARY_PATH: /.singularity.d/libs
2023-01-01 16:13:41.004104: W tensorflow/compiler/tf2tensorrt/utils/py_utils.cc:38] TF-TRT Warning: Cannot dlopen some TensorRT libraries. If you would like to use Nvidia GPU with TensorRT, please make sure the missing libraries mentioned above are installed properly.
2023-01-01 16:13:42.717713: W tensorflow/compiler/xla/stream_executor/platform/default/dso_loader.cc:64] Could not load dynamic library 'libcuda.so.1'; dlerror: libcuda.so.1: cannot open shared object file: No such file or directory; LD_LIBRARY_PATH: /.singularity.d/libs
2023-01-01 16:13:42.717871: W tensorflow/compiler/xla/stream_executor/cuda/cuda_driver.cc:265] failed call to cuInit: UNKNOWN ERROR (303)
[32m[I 2023-01-01 17:10:55,794][0m Trial 275 finished with value: 0.6926806480116813 and parameters: {'regressor__regressor__batch_size': 20, 'regressor__regressor__epochs': 390, 'regressor__regressor__optimizer': 'Nadam', 'regressor__regressor__optimizer__learning_rate': 0.0001376807831736238, 'regressor__regressor__model__init_mode': 'truncated_normal', 'regressor__regressor__model__activation': 'elu', 'regressor__regressor__model__dropout_rate': 0.05778137716944065, 'regressor__regressor__model__weight_constraint': 4.036259851007543, 'regressor__regressor__model__regu_L1': 1.707979312616193e-06, 'regressor__regressor__model__regu_L2': 2.0254561402032104e-05, 'regressor__regressor__model__n_layers': 7, 'regressor__regressor__model__n_units': 361, 'regressor__regressor__loss': 'mean_absolute_error'}. Best is trial 266 with value: 0.7782852798158189.[0m
2023-01-01 17:11:00.271889: W tensorflow/compiler/xla/stream_executor/platform/default/dso_loader.cc:64] Could not load dynamic library 'libcudart.so.11.0'; dlerror: libcudart.so.11.0: cannot open shared object file: No such file or directory; LD_LIBRARY_PATH: /.singularity.d/libs
2023-01-01 17:11:01.603610: W tensorflow/compiler/xla/stream_executor/platform/default/dso_loader.cc:64] Could not load dynamic library 'libnvinfer.so.7'; dlerror: libnvinfer.so.7: cannot open shared object file: No such file or directory; LD_LIBRARY_PATH: /.singularity.d/libs
2023-01-01 17:11:01.603735: W tensorflow/compiler/xla/stream_executor/platform/default/dso_loader.cc:64] Could not load dynamic library 'libnvinfer_plugin.so.7'; dlerror: libnvinfer_plugin.so.7: cannot open shared object file: No such file or directory; LD_LIBRARY_PATH: /.singularity.d/libs
2023-01-01 17:11:01.603758: W tensorflow/compiler/tf2tensorrt/utils/py_utils.cc:38] TF-TRT Warning: Cannot dlopen some TensorRT libraries. If you would like to use Nvidia GPU with TensorRT, please make sure the missing libraries mentioned above are installed properly.
2023-01-01 17:11:03.815868: W tensorflow/compiler/xla/stream_executor/platform/default/dso_loader.cc:64] Could not load dynamic library 'libcuda.so.1'; dlerror: libcuda.so.1: cannot open shared object file: No such file or directory; LD_LIBRARY_PATH: /.singularity.d/libs
2023-01-01 17:11:03.817189: W tensorflow/compiler/xla/stream_executor/cuda/cuda_driver.cc:265] failed call to cuInit: UNKNOWN ERROR (303)
[32m[I 2023-01-01 17:44:19,108][0m Trial 276 finished with value: 0.6244311526776973 and parameters: {'regressor__regressor__batch_size': 20, 'regressor__regressor__epochs': 390, 'regressor__regressor__optimizer': 'Nadam', 'regressor__regressor__optimizer__learning_rate': 0.00013743300977018478, 'regressor__regressor__model__init_mode': 'truncated_normal', 'regressor__regressor__model__activation': 'elu', 'regressor__regressor__model__dropout_rate': 0.05443350495967869, 'regressor__regressor__model__weight_constraint': 4.12566527325934, 'regressor__regressor__model__regu_L1': 1.704775158808572e-06, 'regressor__regressor__model__regu_L2': 4.226858123669803e-05, 'regressor__regressor__model__n_layers': 7, 'regressor__regressor__model__n_units': 321, 'regressor__regressor__loss': 'mean_absolute_error'}. Best is trial 266 with value: 0.7782852798158189.[0m
2023-01-01 17:44:24.022160: W tensorflow/compiler/xla/stream_executor/platform/default/dso_loader.cc:64] Could not load dynamic library 'libcudart.so.11.0'; dlerror: libcudart.so.11.0: cannot open shared object file: No such file or directory; LD_LIBRARY_PATH: /.singularity.d/libs
2023-01-01 17:44:25.295398: W tensorflow/compiler/xla/stream_executor/platform/default/dso_loader.cc:64] Could not load dynamic library 'libnvinfer.so.7'; dlerror: libnvinfer.so.7: cannot open shared object file: No such file or directory; LD_LIBRARY_PATH: /.singularity.d/libs
2023-01-01 17:44:25.295692: W tensorflow/compiler/xla/stream_executor/platform/default/dso_loader.cc:64] Could not load dynamic library 'libnvinfer_plugin.so.7'; dlerror: libnvinfer_plugin.so.7: cannot open shared object file: No such file or directory; LD_LIBRARY_PATH: /.singularity.d/libs
2023-01-01 17:44:25.295748: W tensorflow/compiler/tf2tensorrt/utils/py_utils.cc:38] TF-TRT Warning: Cannot dlopen some TensorRT libraries. If you would like to use Nvidia GPU with TensorRT, please make sure the missing libraries mentioned above are installed properly.
2023-01-01 17:44:27.513852: W tensorflow/compiler/xla/stream_executor/platform/default/dso_loader.cc:64] Could not load dynamic library 'libcuda.so.1'; dlerror: libcuda.so.1: cannot open shared object file: No such file or directory; LD_LIBRARY_PATH: /.singularity.d/libs
2023-01-01 17:44:27.514299: W tensorflow/compiler/xla/stream_executor/cuda/cuda_driver.cc:265] failed call to cuInit: UNKNOWN ERROR (303)
/usr/local/lib/python3.9/dist-packages/sklearn/model_selection/_validation.py:776: UserWarning: Scoring failed. The score on this train-test partition for these parameters will be set to nan. Details: 
Traceback (most recent call last):
  File "/usr/local/lib/python3.9/dist-packages/sklearn/model_selection/_validation.py", line 767, in _score
    scores = scorer(estimator, X_test, y_test)
  File "/usr/local/lib/python3.9/dist-packages/sklearn/metrics/_scorer.py", line 107, in __call__
    score = scorer._score(cached_call, estimator, *args, **kwargs)
  File "/usr/local/lib/python3.9/dist-packages/sklearn/metrics/_scorer.py", line 268, in _score
    return self._sign * self._score_func(y_true, y_pred, **self._kwargs)
  File "/usr/local/lib/python3.9/dist-packages/sklearn/metrics/_regression.py", line 911, in r2_score
    y_type, y_true, y_pred, multioutput = _check_reg_targets(
  File "/usr/local/lib/python3.9/dist-packages/sklearn/metrics/_regression.py", line 102, in _check_reg_targets
    y_pred = check_array(y_pred, ensure_2d=False, dtype=dtype)
  File "/usr/local/lib/python3.9/dist-packages/sklearn/utils/validation.py", line 919, in check_array
    _assert_all_finite(
  File "/usr/local/lib/python3.9/dist-packages/sklearn/utils/validation.py", line 161, in _assert_all_finite
    raise ValueError(msg_err)
ValueError: Input contains NaN.

  warnings.warn(
[32m[I 2023-01-01 17:56:07,769][0m Trial 277 finished with value: 0.612593989010571 and parameters: {'regressor__regressor__batch_size': 20, 'regressor__regressor__epochs': 390, 'regressor__regressor__optimizer': 'Nadam', 'regressor__regressor__optimizer__learning_rate': 0.00014264800498725843, 'regressor__regressor__model__init_mode': 'truncated_normal', 'regressor__regressor__model__activation': 'elu', 'regressor__regressor__model__dropout_rate': 0.05575481538556107, 'regressor__regressor__model__weight_constraint': 4.379544432020567, 'regressor__regressor__model__regu_L1': 1.7452420250358923e-06, 'regressor__regressor__model__regu_L2': 4.404820521311981e-05, 'regressor__regressor__model__n_layers': 7, 'regressor__regressor__model__n_units': 321, 'regressor__regressor__loss': 'mean_absolute_error'}. Best is trial 266 with value: 0.7782852798158189.[0m
2023-01-01 17:56:12.632549: W tensorflow/compiler/xla/stream_executor/platform/default/dso_loader.cc:64] Could not load dynamic library 'libcudart.so.11.0'; dlerror: libcudart.so.11.0: cannot open shared object file: No such file or directory; LD_LIBRARY_PATH: /.singularity.d/libs
2023-01-01 17:56:14.509744: W tensorflow/compiler/xla/stream_executor/platform/default/dso_loader.cc:64] Could not load dynamic library 'libnvinfer.so.7'; dlerror: libnvinfer.so.7: cannot open shared object file: No such file or directory; LD_LIBRARY_PATH: /.singularity.d/libs
2023-01-01 17:56:14.509914: W tensorflow/compiler/xla/stream_executor/platform/default/dso_loader.cc:64] Could not load dynamic library 'libnvinfer_plugin.so.7'; dlerror: libnvinfer_plugin.so.7: cannot open shared object file: No such file or directory; LD_LIBRARY_PATH: /.singularity.d/libs
2023-01-01 17:56:14.509945: W tensorflow/compiler/tf2tensorrt/utils/py_utils.cc:38] TF-TRT Warning: Cannot dlopen some TensorRT libraries. If you would like to use Nvidia GPU with TensorRT, please make sure the missing libraries mentioned above are installed properly.
2023-01-01 17:56:17.172387: W tensorflow/compiler/xla/stream_executor/platform/default/dso_loader.cc:64] Could not load dynamic library 'libcuda.so.1'; dlerror: libcuda.so.1: cannot open shared object file: No such file or directory; LD_LIBRARY_PATH: /.singularity.d/libs
2023-01-01 17:56:17.172613: W tensorflow/compiler/xla/stream_executor/cuda/cuda_driver.cc:265] failed call to cuInit: UNKNOWN ERROR (303)
/usr/local/lib/python3.9/dist-packages/sklearn/model_selection/_validation.py:776: UserWarning: Scoring failed. The score on this train-test partition for these parameters will be set to nan. Details: 
Traceback (most recent call last):
  File "/usr/local/lib/python3.9/dist-packages/sklearn/model_selection/_validation.py", line 767, in _score
    scores = scorer(estimator, X_test, y_test)
  File "/usr/local/lib/python3.9/dist-packages/sklearn/metrics/_scorer.py", line 107, in __call__
    score = scorer._score(cached_call, estimator, *args, **kwargs)
  File "/usr/local/lib/python3.9/dist-packages/sklearn/metrics/_scorer.py", line 268, in _score
    return self._sign * self._score_func(y_true, y_pred, **self._kwargs)
  File "/usr/local/lib/python3.9/dist-packages/sklearn/metrics/_regression.py", line 911, in r2_score
    y_type, y_true, y_pred, multioutput = _check_reg_targets(
  File "/usr/local/lib/python3.9/dist-packages/sklearn/metrics/_regression.py", line 102, in _check_reg_targets
    y_pred = check_array(y_pred, ensure_2d=False, dtype=dtype)
  File "/usr/local/lib/python3.9/dist-packages/sklearn/utils/validation.py", line 919, in check_array
    _assert_all_finite(
  File "/usr/local/lib/python3.9/dist-packages/sklearn/utils/validation.py", line 161, in _assert_all_finite
    raise ValueError(msg_err)
ValueError: Input contains NaN.

  warnings.warn(
