[32m[I 2022-12-28 02:08:57,626][0m Trial 191 finished with value: 0.43364868164105275 and parameters: {'regressor__regressor__batch_size': 50, 'regressor__regressor__epochs': 530, 'regressor__regressor__optimizer': 'Adam', 'regressor__regressor__optimizer__learning_rate': 1.0050154335629995e-05, 'regressor__regressor__model__init_mode': 'normal', 'regressor__regressor__model__activation': 'LeakyReLU', 'regressor__regressor__model__dropout_rate': 0.06145671132974952, 'regressor__regressor__model__weight_constraint': 3.956386840473826, 'regressor__regressor__model__regu_L1': 1.0719536894312002e-06, 'regressor__regressor__model__regu_L2': 0.01710260492490248, 'regressor__regressor__model__n_layers': 9, 'regressor__regressor__model__n_units': 481, 'regressor__regressor__loss': 'mean_absolute_error'}. Best is trial 15 with value: 0.713745100510843.[0m
2022-12-28 02:09:05.698019: W tensorflow/compiler/xla/stream_executor/platform/default/dso_loader.cc:64] Could not load dynamic library 'libcudart.so.11.0'; dlerror: libcudart.so.11.0: cannot open shared object file: No such file or directory; LD_LIBRARY_PATH: /.singularity.d/libs
2022-12-28 02:09:07.691119: W tensorflow/compiler/xla/stream_executor/platform/default/dso_loader.cc:64] Could not load dynamic library 'libnvinfer.so.7'; dlerror: libnvinfer.so.7: cannot open shared object file: No such file or directory; LD_LIBRARY_PATH: /.singularity.d/libs
2022-12-28 02:09:07.706577: W tensorflow/compiler/xla/stream_executor/platform/default/dso_loader.cc:64] Could not load dynamic library 'libnvinfer_plugin.so.7'; dlerror: libnvinfer_plugin.so.7: cannot open shared object file: No such file or directory; LD_LIBRARY_PATH: /.singularity.d/libs
2022-12-28 02:09:07.706677: W tensorflow/compiler/tf2tensorrt/utils/py_utils.cc:38] TF-TRT Warning: Cannot dlopen some TensorRT libraries. If you would like to use Nvidia GPU with TensorRT, please make sure the missing libraries mentioned above are installed properly.
2022-12-28 02:09:10.566564: W tensorflow/compiler/xla/stream_executor/platform/default/dso_loader.cc:64] Could not load dynamic library 'libcuda.so.1'; dlerror: libcuda.so.1: cannot open shared object file: No such file or directory; LD_LIBRARY_PATH: /.singularity.d/libs
2022-12-28 02:09:10.566783: W tensorflow/compiler/xla/stream_executor/cuda/cuda_driver.cc:265] failed call to cuInit: UNKNOWN ERROR (303)
[32m[I 2022-12-28 07:47:15,279][0m Trial 193 finished with value: 0.430955648951743 and parameters: {'regressor__regressor__batch_size': 40, 'regressor__regressor__epochs': 590, 'regressor__regressor__optimizer': 'Adadelta', 'regressor__regressor__optimizer__learning_rate': 3.836192116203572e-05, 'regressor__regressor__model__init_mode': 'variance_scaling', 'regressor__regressor__model__activation': 'LeakyReLU', 'regressor__regressor__model__dropout_rate': 0.061456846156139895, 'regressor__regressor__model__weight_constraint': 3.8474769395372084, 'regressor__regressor__model__regu_L1': 1.1547080729477333e-06, 'regressor__regressor__model__regu_L2': 1.1580689156406375e-06, 'regressor__regressor__model__n_layers': 9, 'regressor__regressor__model__n_units': 461, 'regressor__regressor__loss': 'mean_absolute_error'}. Best is trial 15 with value: 0.713745100510843.[0m
2022-12-28 07:47:21.425146: W tensorflow/compiler/xla/stream_executor/platform/default/dso_loader.cc:64] Could not load dynamic library 'libcudart.so.11.0'; dlerror: libcudart.so.11.0: cannot open shared object file: No such file or directory; LD_LIBRARY_PATH: /.singularity.d/libs
2022-12-28 07:47:23.892173: W tensorflow/compiler/xla/stream_executor/platform/default/dso_loader.cc:64] Could not load dynamic library 'libnvinfer.so.7'; dlerror: libnvinfer.so.7: cannot open shared object file: No such file or directory; LD_LIBRARY_PATH: /.singularity.d/libs
2022-12-28 07:47:23.892373: W tensorflow/compiler/xla/stream_executor/platform/default/dso_loader.cc:64] Could not load dynamic library 'libnvinfer_plugin.so.7'; dlerror: libnvinfer_plugin.so.7: cannot open shared object file: No such file or directory; LD_LIBRARY_PATH: /.singularity.d/libs
2022-12-28 07:47:23.892402: W tensorflow/compiler/tf2tensorrt/utils/py_utils.cc:38] TF-TRT Warning: Cannot dlopen some TensorRT libraries. If you would like to use Nvidia GPU with TensorRT, please make sure the missing libraries mentioned above are installed properly.
2022-12-28 07:47:27.558750: W tensorflow/compiler/xla/stream_executor/platform/default/dso_loader.cc:64] Could not load dynamic library 'libcuda.so.1'; dlerror: libcuda.so.1: cannot open shared object file: No such file or directory; LD_LIBRARY_PATH: /.singularity.d/libs
2022-12-28 07:47:27.558845: W tensorflow/compiler/xla/stream_executor/cuda/cuda_driver.cc:265] failed call to cuInit: UNKNOWN ERROR (303)
[32m[I 2022-12-28 08:21:13,903][0m Trial 194 finished with value: 0.4224182905168468 and parameters: {'regressor__regressor__batch_size': 40, 'regressor__regressor__epochs': 590, 'regressor__regressor__optimizer': 'Adadelta', 'regressor__regressor__optimizer__learning_rate': 3.648391385322858e-05, 'regressor__regressor__model__init_mode': 'variance_scaling', 'regressor__regressor__model__activation': 'LeakyReLU', 'regressor__regressor__model__dropout_rate': 0.05972093521255964, 'regressor__regressor__model__weight_constraint': 3.9010540863728598, 'regressor__regressor__model__regu_L1': 1.1870038648969836e-06, 'regressor__regressor__model__regu_L2': 0.005627378832759976, 'regressor__regressor__model__n_layers': 9, 'regressor__regressor__model__n_units': 481, 'regressor__regressor__loss': 'mean_absolute_error'}. Best is trial 15 with value: 0.713745100510843.[0m
2022-12-28 08:21:21.773652: W tensorflow/compiler/xla/stream_executor/platform/default/dso_loader.cc:64] Could not load dynamic library 'libcudart.so.11.0'; dlerror: libcudart.so.11.0: cannot open shared object file: No such file or directory; LD_LIBRARY_PATH: /.singularity.d/libs
2022-12-28 08:21:23.716286: W tensorflow/compiler/xla/stream_executor/platform/default/dso_loader.cc:64] Could not load dynamic library 'libnvinfer.so.7'; dlerror: libnvinfer.so.7: cannot open shared object file: No such file or directory; LD_LIBRARY_PATH: /.singularity.d/libs
2022-12-28 08:21:23.716410: W tensorflow/compiler/xla/stream_executor/platform/default/dso_loader.cc:64] Could not load dynamic library 'libnvinfer_plugin.so.7'; dlerror: libnvinfer_plugin.so.7: cannot open shared object file: No such file or directory; LD_LIBRARY_PATH: /.singularity.d/libs
2022-12-28 08:21:23.716437: W tensorflow/compiler/tf2tensorrt/utils/py_utils.cc:38] TF-TRT Warning: Cannot dlopen some TensorRT libraries. If you would like to use Nvidia GPU with TensorRT, please make sure the missing libraries mentioned above are installed properly.
2022-12-28 08:21:26.002725: W tensorflow/compiler/xla/stream_executor/platform/default/dso_loader.cc:64] Could not load dynamic library 'libcuda.so.1'; dlerror: libcuda.so.1: cannot open shared object file: No such file or directory; LD_LIBRARY_PATH: /.singularity.d/libs
2022-12-28 08:21:26.002832: W tensorflow/compiler/xla/stream_executor/cuda/cuda_driver.cc:265] failed call to cuInit: UNKNOWN ERROR (303)
[32m[I 2022-12-28 09:52:24,425][0m Trial 196 finished with value: 0.4509164663210333 and parameters: {'regressor__regressor__batch_size': 40, 'regressor__regressor__epochs': 550, 'regressor__regressor__optimizer': 'Adam', 'regressor__regressor__optimizer__learning_rate': 3.259095235154554e-05, 'regressor__regressor__model__init_mode': 'variance_scaling', 'regressor__regressor__model__activation': 'LeakyReLU', 'regressor__regressor__model__dropout_rate': 0.07090258898682195, 'regressor__regressor__model__weight_constraint': 3.310820811009118, 'regressor__regressor__model__regu_L1': 1.4721580511972265e-07, 'regressor__regressor__model__regu_L2': 0.009027314795128277, 'regressor__regressor__model__n_layers': 9, 'regressor__regressor__model__n_units': 461, 'regressor__regressor__loss': 'mean_absolute_error'}. Best is trial 15 with value: 0.713745100510843.[0m
2022-12-28 09:52:31.559627: W tensorflow/compiler/xla/stream_executor/platform/default/dso_loader.cc:64] Could not load dynamic library 'libcudart.so.11.0'; dlerror: libcudart.so.11.0: cannot open shared object file: No such file or directory; LD_LIBRARY_PATH: /.singularity.d/libs
2022-12-28 09:52:34.360388: W tensorflow/compiler/xla/stream_executor/platform/default/dso_loader.cc:64] Could not load dynamic library 'libnvinfer.so.7'; dlerror: libnvinfer.so.7: cannot open shared object file: No such file or directory; LD_LIBRARY_PATH: /.singularity.d/libs
2022-12-28 09:52:34.360662: W tensorflow/compiler/xla/stream_executor/platform/default/dso_loader.cc:64] Could not load dynamic library 'libnvinfer_plugin.so.7'; dlerror: libnvinfer_plugin.so.7: cannot open shared object file: No such file or directory; LD_LIBRARY_PATH: /.singularity.d/libs
2022-12-28 09:52:34.360688: W tensorflow/compiler/tf2tensorrt/utils/py_utils.cc:38] TF-TRT Warning: Cannot dlopen some TensorRT libraries. If you would like to use Nvidia GPU with TensorRT, please make sure the missing libraries mentioned above are installed properly.
2022-12-28 09:52:38.523220: W tensorflow/compiler/xla/stream_executor/platform/default/dso_loader.cc:64] Could not load dynamic library 'libcuda.so.1'; dlerror: libcuda.so.1: cannot open shared object file: No such file or directory; LD_LIBRARY_PATH: /.singularity.d/libs
2022-12-28 09:52:38.523336: W tensorflow/compiler/xla/stream_executor/cuda/cuda_driver.cc:265] failed call to cuInit: UNKNOWN ERROR (303)
[32m[I 2022-12-28 10:02:13,430][0m Trial 195 finished with value: 0.6407410584146684 and parameters: {'regressor__regressor__batch_size': 40, 'regressor__regressor__epochs': 550, 'regressor__regressor__optimizer': 'Adam', 'regressor__regressor__optimizer__learning_rate': 3.1492868091102056e-05, 'regressor__regressor__model__init_mode': 'variance_scaling', 'regressor__regressor__model__activation': 'LeakyReLU', 'regressor__regressor__model__dropout_rate': 0.06299243485694567, 'regressor__regressor__model__weight_constraint': 3.3385469239668124, 'regressor__regressor__model__regu_L1': 1.1036174540146565e-06, 'regressor__regressor__model__regu_L2': 3.7955734713958976e-07, 'regressor__regressor__model__n_layers': 9, 'regressor__regressor__model__n_units': 461, 'regressor__regressor__loss': 'mean_absolute_error'}. Best is trial 15 with value: 0.713745100510843.[0m
2022-12-28 10:02:21.007091: W tensorflow/compiler/xla/stream_executor/platform/default/dso_loader.cc:64] Could not load dynamic library 'libcudart.so.11.0'; dlerror: libcudart.so.11.0: cannot open shared object file: No such file or directory; LD_LIBRARY_PATH: /.singularity.d/libs
2022-12-28 10:02:23.736448: W tensorflow/compiler/xla/stream_executor/platform/default/dso_loader.cc:64] Could not load dynamic library 'libnvinfer.so.7'; dlerror: libnvinfer.so.7: cannot open shared object file: No such file or directory; LD_LIBRARY_PATH: /.singularity.d/libs
2022-12-28 10:02:23.737876: W tensorflow/compiler/xla/stream_executor/platform/default/dso_loader.cc:64] Could not load dynamic library 'libnvinfer_plugin.so.7'; dlerror: libnvinfer_plugin.so.7: cannot open shared object file: No such file or directory; LD_LIBRARY_PATH: /.singularity.d/libs
2022-12-28 10:02:23.738142: W tensorflow/compiler/tf2tensorrt/utils/py_utils.cc:38] TF-TRT Warning: Cannot dlopen some TensorRT libraries. If you would like to use Nvidia GPU with TensorRT, please make sure the missing libraries mentioned above are installed properly.
2022-12-28 10:02:27.621793: W tensorflow/compiler/xla/stream_executor/platform/default/dso_loader.cc:64] Could not load dynamic library 'libcuda.so.1'; dlerror: libcuda.so.1: cannot open shared object file: No such file or directory; LD_LIBRARY_PATH: /.singularity.d/libs
2022-12-28 10:02:27.621964: W tensorflow/compiler/xla/stream_executor/cuda/cuda_driver.cc:265] failed call to cuInit: UNKNOWN ERROR (303)
/usr/local/lib/python3.9/dist-packages/sklearn/model_selection/_validation.py:776: UserWarning: Scoring failed. The score on this train-test partition for these parameters will be set to nan. Details: 
Traceback (most recent call last):
  File "/usr/local/lib/python3.9/dist-packages/sklearn/model_selection/_validation.py", line 767, in _score
    scores = scorer(estimator, X_test, y_test)
  File "/usr/local/lib/python3.9/dist-packages/sklearn/metrics/_scorer.py", line 107, in __call__
    score = scorer._score(cached_call, estimator, *args, **kwargs)
  File "/usr/local/lib/python3.9/dist-packages/sklearn/metrics/_scorer.py", line 268, in _score
    return self._sign * self._score_func(y_true, y_pred, **self._kwargs)
  File "/usr/local/lib/python3.9/dist-packages/sklearn/metrics/_regression.py", line 911, in r2_score
    y_type, y_true, y_pred, multioutput = _check_reg_targets(
  File "/usr/local/lib/python3.9/dist-packages/sklearn/metrics/_regression.py", line 102, in _check_reg_targets
    y_pred = check_array(y_pred, ensure_2d=False, dtype=dtype)
  File "/usr/local/lib/python3.9/dist-packages/sklearn/utils/validation.py", line 919, in check_array
    _assert_all_finite(
  File "/usr/local/lib/python3.9/dist-packages/sklearn/utils/validation.py", line 161, in _assert_all_finite
    raise ValueError(msg_err)
ValueError: Input contains NaN.

  warnings.warn(
/usr/local/lib/python3.9/dist-packages/sklearn/model_selection/_validation.py:776: UserWarning: Scoring failed. The score on this train-test partition for these parameters will be set to nan. Details: 
Traceback (most recent call last):
  File "/usr/local/lib/python3.9/dist-packages/sklearn/model_selection/_validation.py", line 767, in _score
    scores = scorer(estimator, X_test, y_test)
  File "/usr/local/lib/python3.9/dist-packages/sklearn/metrics/_scorer.py", line 107, in __call__
    score = scorer._score(cached_call, estimator, *args, **kwargs)
  File "/usr/local/lib/python3.9/dist-packages/sklearn/metrics/_scorer.py", line 268, in _score
    return self._sign * self._score_func(y_true, y_pred, **self._kwargs)
  File "/usr/local/lib/python3.9/dist-packages/sklearn/metrics/_regression.py", line 911, in r2_score
    y_type, y_true, y_pred, multioutput = _check_reg_targets(
  File "/usr/local/lib/python3.9/dist-packages/sklearn/metrics/_regression.py", line 102, in _check_reg_targets
    y_pred = check_array(y_pred, ensure_2d=False, dtype=dtype)
  File "/usr/local/lib/python3.9/dist-packages/sklearn/utils/validation.py", line 919, in check_array
    _assert_all_finite(
  File "/usr/local/lib/python3.9/dist-packages/sklearn/utils/validation.py", line 161, in _assert_all_finite
    raise ValueError(msg_err)
ValueError: Input contains NaN.

  warnings.warn(
/usr/local/lib/python3.9/dist-packages/sklearn/model_selection/_validation.py:776: UserWarning: Scoring failed. The score on this train-test partition for these parameters will be set to nan. Details: 
Traceback (most recent call last):
  File "/usr/local/lib/python3.9/dist-packages/sklearn/model_selection/_validation.py", line 767, in _score
    scores = scorer(estimator, X_test, y_test)
  File "/usr/local/lib/python3.9/dist-packages/sklearn/metrics/_scorer.py", line 107, in __call__
    score = scorer._score(cached_call, estimator, *args, **kwargs)
  File "/usr/local/lib/python3.9/dist-packages/sklearn/metrics/_scorer.py", line 268, in _score
    return self._sign * self._score_func(y_true, y_pred, **self._kwargs)
  File "/usr/local/lib/python3.9/dist-packages/sklearn/metrics/_regression.py", line 911, in r2_score
    y_type, y_true, y_pred, multioutput = _check_reg_targets(
  File "/usr/local/lib/python3.9/dist-packages/sklearn/metrics/_regression.py", line 102, in _check_reg_targets
    y_pred = check_array(y_pred, ensure_2d=False, dtype=dtype)
  File "/usr/local/lib/python3.9/dist-packages/sklearn/utils/validation.py", line 919, in check_array
    _assert_all_finite(
  File "/usr/local/lib/python3.9/dist-packages/sklearn/utils/validation.py", line 161, in _assert_all_finite
    raise ValueError(msg_err)
ValueError: Input contains NaN.

  warnings.warn(
