[32m[I 2022-12-27 14:38:35,585][0m Trial 179 finished with value: -0.18415354132295883 and parameters: {'regressor__regressor__batch_size': 40, 'regressor__regressor__epochs': 570, 'regressor__regressor__optimizer': 'Adam', 'regressor__regressor__optimizer__learning_rate': 5.295948835532214e-05, 'regressor__regressor__model__init_mode': 'variance_scaling', 'regressor__regressor__model__activation': 'sigmoid', 'regressor__regressor__model__dropout_rate': 0.07322555681654261, 'regressor__regressor__model__weight_constraint': 4.227868192730037, 'regressor__regressor__model__regu_L1': 1.8988261430183872e-07, 'regressor__regressor__model__regu_L2': 6.35560359444703e-07, 'regressor__regressor__model__n_layers': 9, 'regressor__regressor__model__n_units': 481, 'regressor__regressor__loss': 'mean_absolute_error'}. Best is trial 15 with value: 0.713745100510843.[0m
2022-12-27 14:38:41.539898: W tensorflow/compiler/xla/stream_executor/platform/default/dso_loader.cc:64] Could not load dynamic library 'libcudart.so.11.0'; dlerror: libcudart.so.11.0: cannot open shared object file: No such file or directory; LD_LIBRARY_PATH: /.singularity.d/libs
2022-12-27 14:38:43.550334: W tensorflow/compiler/xla/stream_executor/platform/default/dso_loader.cc:64] Could not load dynamic library 'libnvinfer.so.7'; dlerror: libnvinfer.so.7: cannot open shared object file: No such file or directory; LD_LIBRARY_PATH: /.singularity.d/libs
2022-12-27 14:38:43.550482: W tensorflow/compiler/xla/stream_executor/platform/default/dso_loader.cc:64] Could not load dynamic library 'libnvinfer_plugin.so.7'; dlerror: libnvinfer_plugin.so.7: cannot open shared object file: No such file or directory; LD_LIBRARY_PATH: /.singularity.d/libs
2022-12-27 14:38:43.550510: W tensorflow/compiler/tf2tensorrt/utils/py_utils.cc:38] TF-TRT Warning: Cannot dlopen some TensorRT libraries. If you would like to use Nvidia GPU with TensorRT, please make sure the missing libraries mentioned above are installed properly.
2022-12-27 14:38:46.943320: W tensorflow/compiler/xla/stream_executor/platform/default/dso_loader.cc:64] Could not load dynamic library 'libcuda.so.1'; dlerror: libcuda.so.1: cannot open shared object file: No such file or directory; LD_LIBRARY_PATH: /.singularity.d/libs
2022-12-27 14:38:46.943426: W tensorflow/compiler/xla/stream_executor/cuda/cuda_driver.cc:265] failed call to cuInit: UNKNOWN ERROR (303)
/usr/local/lib/python3.9/dist-packages/sklearn/model_selection/_validation.py:776: UserWarning: Scoring failed. The score on this train-test partition for these parameters will be set to nan. Details: 
Traceback (most recent call last):
  File "/usr/local/lib/python3.9/dist-packages/sklearn/model_selection/_validation.py", line 767, in _score
    scores = scorer(estimator, X_test, y_test)
  File "/usr/local/lib/python3.9/dist-packages/sklearn/metrics/_scorer.py", line 107, in __call__
    score = scorer._score(cached_call, estimator, *args, **kwargs)
  File "/usr/local/lib/python3.9/dist-packages/sklearn/metrics/_scorer.py", line 268, in _score
    return self._sign * self._score_func(y_true, y_pred, **self._kwargs)
  File "/usr/local/lib/python3.9/dist-packages/sklearn/metrics/_regression.py", line 911, in r2_score
    y_type, y_true, y_pred, multioutput = _check_reg_targets(
  File "/usr/local/lib/python3.9/dist-packages/sklearn/metrics/_regression.py", line 102, in _check_reg_targets
    y_pred = check_array(y_pred, ensure_2d=False, dtype=dtype)
  File "/usr/local/lib/python3.9/dist-packages/sklearn/utils/validation.py", line 919, in check_array
    _assert_all_finite(
  File "/usr/local/lib/python3.9/dist-packages/sklearn/utils/validation.py", line 161, in _assert_all_finite
    raise ValueError(msg_err)
ValueError: Input contains NaN.

  warnings.warn(
/usr/local/lib/python3.9/dist-packages/sklearn/model_selection/_validation.py:776: UserWarning: Scoring failed. The score on this train-test partition for these parameters will be set to nan. Details: 
Traceback (most recent call last):
  File "/usr/local/lib/python3.9/dist-packages/sklearn/model_selection/_validation.py", line 767, in _score
    scores = scorer(estimator, X_test, y_test)
  File "/usr/local/lib/python3.9/dist-packages/sklearn/metrics/_scorer.py", line 107, in __call__
    score = scorer._score(cached_call, estimator, *args, **kwargs)
  File "/usr/local/lib/python3.9/dist-packages/sklearn/metrics/_scorer.py", line 268, in _score
    return self._sign * self._score_func(y_true, y_pred, **self._kwargs)
  File "/usr/local/lib/python3.9/dist-packages/sklearn/metrics/_regression.py", line 911, in r2_score
    y_type, y_true, y_pred, multioutput = _check_reg_targets(
  File "/usr/local/lib/python3.9/dist-packages/sklearn/metrics/_regression.py", line 102, in _check_reg_targets
    y_pred = check_array(y_pred, ensure_2d=False, dtype=dtype)
  File "/usr/local/lib/python3.9/dist-packages/sklearn/utils/validation.py", line 919, in check_array
    _assert_all_finite(
  File "/usr/local/lib/python3.9/dist-packages/sklearn/utils/validation.py", line 161, in _assert_all_finite
    raise ValueError(msg_err)
ValueError: Input contains NaN.

  warnings.warn(
/usr/local/lib/python3.9/dist-packages/sklearn/model_selection/_validation.py:776: UserWarning: Scoring failed. The score on this train-test partition for these parameters will be set to nan. Details: 
Traceback (most recent call last):
  File "/usr/local/lib/python3.9/dist-packages/sklearn/model_selection/_validation.py", line 767, in _score
    scores = scorer(estimator, X_test, y_test)
  File "/usr/local/lib/python3.9/dist-packages/sklearn/metrics/_scorer.py", line 107, in __call__
    score = scorer._score(cached_call, estimator, *args, **kwargs)
  File "/usr/local/lib/python3.9/dist-packages/sklearn/metrics/_scorer.py", line 268, in _score
    return self._sign * self._score_func(y_true, y_pred, **self._kwargs)
  File "/usr/local/lib/python3.9/dist-packages/sklearn/metrics/_regression.py", line 911, in r2_score
    y_type, y_true, y_pred, multioutput = _check_reg_targets(
  File "/usr/local/lib/python3.9/dist-packages/sklearn/metrics/_regression.py", line 102, in _check_reg_targets
    y_pred = check_array(y_pred, ensure_2d=False, dtype=dtype)
  File "/usr/local/lib/python3.9/dist-packages/sklearn/utils/validation.py", line 919, in check_array
    _assert_all_finite(
  File "/usr/local/lib/python3.9/dist-packages/sklearn/utils/validation.py", line 161, in _assert_all_finite
    raise ValueError(msg_err)
ValueError: Input contains NaN.

  warnings.warn(
/usr/local/lib/python3.9/dist-packages/sklearn/model_selection/_validation.py:776: UserWarning: Scoring failed. The score on this train-test partition for these parameters will be set to nan. Details: 
Traceback (most recent call last):
  File "/usr/local/lib/python3.9/dist-packages/sklearn/model_selection/_validation.py", line 767, in _score
    scores = scorer(estimator, X_test, y_test)
  File "/usr/local/lib/python3.9/dist-packages/sklearn/metrics/_scorer.py", line 107, in __call__
    score = scorer._score(cached_call, estimator, *args, **kwargs)
  File "/usr/local/lib/python3.9/dist-packages/sklearn/metrics/_scorer.py", line 268, in _score
    return self._sign * self._score_func(y_true, y_pred, **self._kwargs)
  File "/usr/local/lib/python3.9/dist-packages/sklearn/metrics/_regression.py", line 911, in r2_score
    y_type, y_true, y_pred, multioutput = _check_reg_targets(
  File "/usr/local/lib/python3.9/dist-packages/sklearn/metrics/_regression.py", line 102, in _check_reg_targets
    y_pred = check_array(y_pred, ensure_2d=False, dtype=dtype)
  File "/usr/local/lib/python3.9/dist-packages/sklearn/utils/validation.py", line 919, in check_array
    _assert_all_finite(
  File "/usr/local/lib/python3.9/dist-packages/sklearn/utils/validation.py", line 161, in _assert_all_finite
    raise ValueError(msg_err)
ValueError: Input contains NaN.

  warnings.warn(
/usr/local/lib/python3.9/dist-packages/sklearn/model_selection/_validation.py:776: UserWarning: Scoring failed. The score on this train-test partition for these parameters will be set to nan. Details: 
Traceback (most recent call last):
  File "/usr/local/lib/python3.9/dist-packages/sklearn/model_selection/_validation.py", line 767, in _score
    scores = scorer(estimator, X_test, y_test)
  File "/usr/local/lib/python3.9/dist-packages/sklearn/metrics/_scorer.py", line 107, in __call__
    score = scorer._score(cached_call, estimator, *args, **kwargs)
  File "/usr/local/lib/python3.9/dist-packages/sklearn/metrics/_scorer.py", line 268, in _score
    return self._sign * self._score_func(y_true, y_pred, **self._kwargs)
  File "/usr/local/lib/python3.9/dist-packages/sklearn/metrics/_regression.py", line 911, in r2_score
    y_type, y_true, y_pred, multioutput = _check_reg_targets(
  File "/usr/local/lib/python3.9/dist-packages/sklearn/metrics/_regression.py", line 102, in _check_reg_targets
    y_pred = check_array(y_pred, ensure_2d=False, dtype=dtype)
  File "/usr/local/lib/python3.9/dist-packages/sklearn/utils/validation.py", line 919, in check_array
    _assert_all_finite(
  File "/usr/local/lib/python3.9/dist-packages/sklearn/utils/validation.py", line 161, in _assert_all_finite
    raise ValueError(msg_err)
ValueError: Input contains NaN.

  warnings.warn(
/usr/local/lib/python3.9/dist-packages/sklearn/model_selection/_validation.py:776: UserWarning: Scoring failed. The score on this train-test partition for these parameters will be set to nan. Details: 
Traceback (most recent call last):
  File "/usr/local/lib/python3.9/dist-packages/sklearn/model_selection/_validation.py", line 767, in _score
    scores = scorer(estimator, X_test, y_test)
  File "/usr/local/lib/python3.9/dist-packages/sklearn/metrics/_scorer.py", line 107, in __call__
    score = scorer._score(cached_call, estimator, *args, **kwargs)
  File "/usr/local/lib/python3.9/dist-packages/sklearn/metrics/_scorer.py", line 268, in _score
    return self._sign * self._score_func(y_true, y_pred, **self._kwargs)
  File "/usr/local/lib/python3.9/dist-packages/sklearn/metrics/_regression.py", line 911, in r2_score
    y_type, y_true, y_pred, multioutput = _check_reg_targets(
  File "/usr/local/lib/python3.9/dist-packages/sklearn/metrics/_regression.py", line 102, in _check_reg_targets
    y_pred = check_array(y_pred, ensure_2d=False, dtype=dtype)
  File "/usr/local/lib/python3.9/dist-packages/sklearn/utils/validation.py", line 919, in check_array
    _assert_all_finite(
  File "/usr/local/lib/python3.9/dist-packages/sklearn/utils/validation.py", line 161, in _assert_all_finite
    raise ValueError(msg_err)
ValueError: Input contains NaN.

  warnings.warn(
/usr/local/lib/python3.9/dist-packages/sklearn/model_selection/_validation.py:776: UserWarning: Scoring failed. The score on this train-test partition for these parameters will be set to nan. Details: 
Traceback (most recent call last):
  File "/usr/local/lib/python3.9/dist-packages/sklearn/model_selection/_validation.py", line 767, in _score
    scores = scorer(estimator, X_test, y_test)
  File "/usr/local/lib/python3.9/dist-packages/sklearn/metrics/_scorer.py", line 107, in __call__
    score = scorer._score(cached_call, estimator, *args, **kwargs)
  File "/usr/local/lib/python3.9/dist-packages/sklearn/metrics/_scorer.py", line 268, in _score
    return self._sign * self._score_func(y_true, y_pred, **self._kwargs)
  File "/usr/local/lib/python3.9/dist-packages/sklearn/metrics/_regression.py", line 911, in r2_score
    y_type, y_true, y_pred, multioutput = _check_reg_targets(
  File "/usr/local/lib/python3.9/dist-packages/sklearn/metrics/_regression.py", line 102, in _check_reg_targets
    y_pred = check_array(y_pred, ensure_2d=False, dtype=dtype)
  File "/usr/local/lib/python3.9/dist-packages/sklearn/utils/validation.py", line 919, in check_array
    _assert_all_finite(
  File "/usr/local/lib/python3.9/dist-packages/sklearn/utils/validation.py", line 161, in _assert_all_finite
    raise ValueError(msg_err)
ValueError: Input contains NaN.

  warnings.warn(
/usr/local/lib/python3.9/dist-packages/sklearn/model_selection/_validation.py:776: UserWarning: Scoring failed. The score on this train-test partition for these parameters will be set to nan. Details: 
Traceback (most recent call last):
  File "/usr/local/lib/python3.9/dist-packages/sklearn/model_selection/_validation.py", line 767, in _score
    scores = scorer(estimator, X_test, y_test)
  File "/usr/local/lib/python3.9/dist-packages/sklearn/metrics/_scorer.py", line 107, in __call__
    score = scorer._score(cached_call, estimator, *args, **kwargs)
  File "/usr/local/lib/python3.9/dist-packages/sklearn/metrics/_scorer.py", line 268, in _score
    return self._sign * self._score_func(y_true, y_pred, **self._kwargs)
  File "/usr/local/lib/python3.9/dist-packages/sklearn/metrics/_regression.py", line 911, in r2_score
    y_type, y_true, y_pred, multioutput = _check_reg_targets(
  File "/usr/local/lib/python3.9/dist-packages/sklearn/metrics/_regression.py", line 102, in _check_reg_targets
    y_pred = check_array(y_pred, ensure_2d=False, dtype=dtype)
  File "/usr/local/lib/python3.9/dist-packages/sklearn/utils/validation.py", line 919, in check_array
    _assert_all_finite(
  File "/usr/local/lib/python3.9/dist-packages/sklearn/utils/validation.py", line 161, in _assert_all_finite
    raise ValueError(msg_err)
ValueError: Input contains NaN.

  warnings.warn(
