[32m[I 2022-12-26 20:23:54,762][0m Trial 163 finished with value: 0.6607205864299586 and parameters: {'regressor__regressor__batch_size': 60, 'regressor__regressor__epochs': 610, 'regressor__regressor__optimizer': 'Adam', 'regressor__regressor__optimizer__learning_rate': 4.281270042509417e-05, 'regressor__regressor__model__init_mode': 'variance_scaling', 'regressor__regressor__model__activation': 'LeakyReLU', 'regressor__regressor__model__dropout_rate': 0.0458672783611901, 'regressor__regressor__model__weight_constraint': 3.8442541290942818, 'regressor__regressor__model__regu_L1': 1.362806557340964e-07, 'regressor__regressor__model__regu_L2': 7.525428589461191e-07, 'regressor__regressor__model__n_layers': 7, 'regressor__regressor__model__n_units': 461, 'regressor__regressor__loss': 'log_cosh'}. Best is trial 15 with value: 0.713745100510843.[0m
2022-12-26 20:23:59.706552: W tensorflow/compiler/xla/stream_executor/platform/default/dso_loader.cc:64] Could not load dynamic library 'libcudart.so.11.0'; dlerror: libcudart.so.11.0: cannot open shared object file: No such file or directory; LD_LIBRARY_PATH: /.singularity.d/libs
2022-12-26 20:24:01.391404: W tensorflow/compiler/xla/stream_executor/platform/default/dso_loader.cc:64] Could not load dynamic library 'libnvinfer.so.7'; dlerror: libnvinfer.so.7: cannot open shared object file: No such file or directory; LD_LIBRARY_PATH: /.singularity.d/libs
2022-12-26 20:24:01.391528: W tensorflow/compiler/xla/stream_executor/platform/default/dso_loader.cc:64] Could not load dynamic library 'libnvinfer_plugin.so.7'; dlerror: libnvinfer_plugin.so.7: cannot open shared object file: No such file or directory; LD_LIBRARY_PATH: /.singularity.d/libs
2022-12-26 20:24:01.391577: W tensorflow/compiler/tf2tensorrt/utils/py_utils.cc:38] TF-TRT Warning: Cannot dlopen some TensorRT libraries. If you would like to use Nvidia GPU with TensorRT, please make sure the missing libraries mentioned above are installed properly.
2022-12-26 20:24:03.635077: W tensorflow/compiler/xla/stream_executor/platform/default/dso_loader.cc:64] Could not load dynamic library 'libcuda.so.1'; dlerror: libcuda.so.1: cannot open shared object file: No such file or directory; LD_LIBRARY_PATH: /.singularity.d/libs
2022-12-26 20:24:03.635192: W tensorflow/compiler/xla/stream_executor/cuda/cuda_driver.cc:265] failed call to cuInit: UNKNOWN ERROR (303)
[32m[I 2022-12-26 20:30:58,632][0m Trial 161 finished with value: 0.6304830727799079 and parameters: {'regressor__regressor__batch_size': 60, 'regressor__regressor__epochs': 570, 'regressor__regressor__optimizer': 'Adam', 'regressor__regressor__optimizer__learning_rate': 1.9124304321231543e-05, 'regressor__regressor__model__init_mode': 'variance_scaling', 'regressor__regressor__model__activation': 'LeakyReLU', 'regressor__regressor__model__dropout_rate': 0.044142957467465, 'regressor__regressor__model__weight_constraint': 2.859705196733568, 'regressor__regressor__model__regu_L1': 2.09898996902709e-07, 'regressor__regressor__model__regu_L2': 2.2192728040651288e-07, 'regressor__regressor__model__n_layers': 9, 'regressor__regressor__model__n_units': 461, 'regressor__regressor__loss': 'log_cosh'}. Best is trial 15 with value: 0.713745100510843.[0m
2022-12-26 20:31:03.319795: W tensorflow/compiler/xla/stream_executor/platform/default/dso_loader.cc:64] Could not load dynamic library 'libcudart.so.11.0'; dlerror: libcudart.so.11.0: cannot open shared object file: No such file or directory; LD_LIBRARY_PATH: /.singularity.d/libs
2022-12-26 20:31:04.677099: W tensorflow/compiler/xla/stream_executor/platform/default/dso_loader.cc:64] Could not load dynamic library 'libnvinfer.so.7'; dlerror: libnvinfer.so.7: cannot open shared object file: No such file or directory; LD_LIBRARY_PATH: /.singularity.d/libs
2022-12-26 20:31:04.677245: W tensorflow/compiler/xla/stream_executor/platform/default/dso_loader.cc:64] Could not load dynamic library 'libnvinfer_plugin.so.7'; dlerror: libnvinfer_plugin.so.7: cannot open shared object file: No such file or directory; LD_LIBRARY_PATH: /.singularity.d/libs
2022-12-26 20:31:04.677279: W tensorflow/compiler/tf2tensorrt/utils/py_utils.cc:38] TF-TRT Warning: Cannot dlopen some TensorRT libraries. If you would like to use Nvidia GPU with TensorRT, please make sure the missing libraries mentioned above are installed properly.
2022-12-26 20:31:07.270561: W tensorflow/compiler/xla/stream_executor/platform/default/dso_loader.cc:64] Could not load dynamic library 'libcuda.so.1'; dlerror: libcuda.so.1: cannot open shared object file: No such file or directory; LD_LIBRARY_PATH: /.singularity.d/libs
2022-12-26 20:31:07.281041: W tensorflow/compiler/xla/stream_executor/cuda/cuda_driver.cc:265] failed call to cuInit: UNKNOWN ERROR (303)
[32m[I 2022-12-26 20:38:32,664][0m Trial 162 finished with value: 0.6219634210966692 and parameters: {'regressor__regressor__batch_size': 60, 'regressor__regressor__epochs': 610, 'regressor__regressor__optimizer': 'Adam', 'regressor__regressor__optimizer__learning_rate': 1.7021517049271266e-05, 'regressor__regressor__model__init_mode': 'variance_scaling', 'regressor__regressor__model__activation': 'LeakyReLU', 'regressor__regressor__model__dropout_rate': 0.04800004322288313, 'regressor__regressor__model__weight_constraint': 3.810013678246061, 'regressor__regressor__model__regu_L1': 1.3233258848160357e-07, 'regressor__regressor__model__regu_L2': 7.348106142818419e-07, 'regressor__regressor__model__n_layers': 9, 'regressor__regressor__model__n_units': 461, 'regressor__regressor__loss': 'log_cosh'}. Best is trial 15 with value: 0.713745100510843.[0m
2022-12-26 20:38:37.913995: W tensorflow/compiler/xla/stream_executor/platform/default/dso_loader.cc:64] Could not load dynamic library 'libcudart.so.11.0'; dlerror: libcudart.so.11.0: cannot open shared object file: No such file or directory; LD_LIBRARY_PATH: /.singularity.d/libs
2022-12-26 20:38:39.662099: W tensorflow/compiler/xla/stream_executor/platform/default/dso_loader.cc:64] Could not load dynamic library 'libnvinfer.so.7'; dlerror: libnvinfer.so.7: cannot open shared object file: No such file or directory; LD_LIBRARY_PATH: /.singularity.d/libs
2022-12-26 20:38:39.662547: W tensorflow/compiler/xla/stream_executor/platform/default/dso_loader.cc:64] Could not load dynamic library 'libnvinfer_plugin.so.7'; dlerror: libnvinfer_plugin.so.7: cannot open shared object file: No such file or directory; LD_LIBRARY_PATH: /.singularity.d/libs
2022-12-26 20:38:39.662581: W tensorflow/compiler/tf2tensorrt/utils/py_utils.cc:38] TF-TRT Warning: Cannot dlopen some TensorRT libraries. If you would like to use Nvidia GPU with TensorRT, please make sure the missing libraries mentioned above are installed properly.
2022-12-26 20:38:42.892759: W tensorflow/compiler/xla/stream_executor/platform/default/dso_loader.cc:64] Could not load dynamic library 'libcuda.so.1'; dlerror: libcuda.so.1: cannot open shared object file: No such file or directory; LD_LIBRARY_PATH: /.singularity.d/libs
2022-12-26 20:38:42.893050: W tensorflow/compiler/xla/stream_executor/cuda/cuda_driver.cc:265] failed call to cuInit: UNKNOWN ERROR (303)
[32m[I 2022-12-26 21:18:34,021][0m Trial 165 finished with value: 0.3119964861937492 and parameters: {'regressor__regressor__batch_size': 60, 'regressor__regressor__epochs': 610, 'regressor__regressor__optimizer': 'RMSprop', 'regressor__regressor__optimizer__learning_rate': 1.9476947644676558e-05, 'regressor__regressor__model__init_mode': 'he_normal', 'regressor__regressor__model__activation': 'LeakyReLU', 'regressor__regressor__model__dropout_rate': 0.11196654915323337, 'regressor__regressor__model__weight_constraint': 3.8335093291875375, 'regressor__regressor__model__regu_L1': 2.1133782424250432e-07, 'regressor__regressor__model__regu_L2': 5.03777345866434e-07, 'regressor__regressor__model__n_layers': 7, 'regressor__regressor__model__n_units': 461, 'regressor__regressor__loss': 'msle'}. Best is trial 15 with value: 0.713745100510843.[0m
2022-12-26 21:18:43.040211: W tensorflow/compiler/xla/stream_executor/platform/default/dso_loader.cc:64] Could not load dynamic library 'libcudart.so.11.0'; dlerror: libcudart.so.11.0: cannot open shared object file: No such file or directory; LD_LIBRARY_PATH: /.singularity.d/libs
2022-12-26 21:18:45.480034: W tensorflow/compiler/xla/stream_executor/platform/default/dso_loader.cc:64] Could not load dynamic library 'libnvinfer.so.7'; dlerror: libnvinfer.so.7: cannot open shared object file: No such file or directory; LD_LIBRARY_PATH: /.singularity.d/libs
2022-12-26 21:18:45.480404: W tensorflow/compiler/xla/stream_executor/platform/default/dso_loader.cc:64] Could not load dynamic library 'libnvinfer_plugin.so.7'; dlerror: libnvinfer_plugin.so.7: cannot open shared object file: No such file or directory; LD_LIBRARY_PATH: /.singularity.d/libs
2022-12-26 21:18:45.480444: W tensorflow/compiler/tf2tensorrt/utils/py_utils.cc:38] TF-TRT Warning: Cannot dlopen some TensorRT libraries. If you would like to use Nvidia GPU with TensorRT, please make sure the missing libraries mentioned above are installed properly.
2022-12-26 21:18:48.836287: W tensorflow/compiler/xla/stream_executor/platform/default/dso_loader.cc:64] Could not load dynamic library 'libcuda.so.1'; dlerror: libcuda.so.1: cannot open shared object file: No such file or directory; LD_LIBRARY_PATH: /.singularity.d/libs
2022-12-26 21:18:48.836396: W tensorflow/compiler/xla/stream_executor/cuda/cuda_driver.cc:265] failed call to cuInit: UNKNOWN ERROR (303)
[32m[I 2022-12-26 23:06:41,663][0m Trial 168 finished with value: -0.1343675543246299 and parameters: {'regressor__regressor__batch_size': 90, 'regressor__regressor__epochs': 510, 'regressor__regressor__optimizer': 'Adam', 'regressor__regressor__optimizer__learning_rate': 4.022289627474088e-05, 'regressor__regressor__model__init_mode': 'he_normal', 'regressor__regressor__model__activation': 'hard_sigmoid', 'regressor__regressor__model__dropout_rate': 0.05097477536215872, 'regressor__regressor__model__weight_constraint': 3.7998287029065043, 'regressor__regressor__model__regu_L1': 0.006583862166063733, 'regressor__regressor__model__regu_L2': 2.6067199595761194e-07, 'regressor__regressor__model__n_layers': 7, 'regressor__regressor__model__n_units': 461, 'regressor__regressor__loss': 'msle'}. Best is trial 15 with value: 0.713745100510843.[0m
[32m[I 2022-12-26 23:14:48,616][0m Trial 166 finished with value: -0.1356788013785538 and parameters: {'regressor__regressor__batch_size': 40, 'regressor__regressor__epochs': 610, 'regressor__regressor__optimizer': 'Adam', 'regressor__regressor__optimizer__learning_rate': 2.052695129658474e-05, 'regressor__regressor__model__init_mode': 'he_normal', 'regressor__regressor__model__activation': 'hard_sigmoid', 'regressor__regressor__model__dropout_rate': 0.04962249362829635, 'regressor__regressor__model__weight_constraint': 4.041276510902956, 'regressor__regressor__model__regu_L1': 0.0014050020581475448, 'regressor__regressor__model__regu_L2': 2.348168739603571e-07, 'regressor__regressor__model__n_layers': 7, 'regressor__regressor__model__n_units': 461, 'regressor__regressor__loss': 'msle'}. Best is trial 15 with value: 0.713745100510843.[0m
2022-12-26 23:14:53.512282: W tensorflow/compiler/xla/stream_executor/platform/default/dso_loader.cc:64] Could not load dynamic library 'libcudart.so.11.0'; dlerror: libcudart.so.11.0: cannot open shared object file: No such file or directory; LD_LIBRARY_PATH: /.singularity.d/libs
2022-12-26 23:14:55.672250: W tensorflow/compiler/xla/stream_executor/platform/default/dso_loader.cc:64] Could not load dynamic library 'libnvinfer.so.7'; dlerror: libnvinfer.so.7: cannot open shared object file: No such file or directory; LD_LIBRARY_PATH: /.singularity.d/libs
2022-12-26 23:14:55.672426: W tensorflow/compiler/xla/stream_executor/platform/default/dso_loader.cc:64] Could not load dynamic library 'libnvinfer_plugin.so.7'; dlerror: libnvinfer_plugin.so.7: cannot open shared object file: No such file or directory; LD_LIBRARY_PATH: /.singularity.d/libs
2022-12-26 23:14:55.672477: W tensorflow/compiler/tf2tensorrt/utils/py_utils.cc:38] TF-TRT Warning: Cannot dlopen some TensorRT libraries. If you would like to use Nvidia GPU with TensorRT, please make sure the missing libraries mentioned above are installed properly.
2022-12-26 23:14:59.103995: W tensorflow/compiler/xla/stream_executor/platform/default/dso_loader.cc:64] Could not load dynamic library 'libcuda.so.1'; dlerror: libcuda.so.1: cannot open shared object file: No such file or directory; LD_LIBRARY_PATH: /.singularity.d/libs
2022-12-26 23:14:59.104265: W tensorflow/compiler/xla/stream_executor/cuda/cuda_driver.cc:265] failed call to cuInit: UNKNOWN ERROR (303)
[32m[I 2022-12-27 00:53:15,677][0m Trial 167 finished with value: 0.09396506113853506 and parameters: {'regressor__regressor__batch_size': 60, 'regressor__regressor__epochs': 610, 'regressor__regressor__optimizer': 'Adam', 'regressor__regressor__optimizer__learning_rate': 2.063690318369436e-05, 'regressor__regressor__model__init_mode': 'he_normal', 'regressor__regressor__model__activation': 'hard_sigmoid', 'regressor__regressor__model__dropout_rate': 0.04497387406731719, 'regressor__regressor__model__weight_constraint': 3.9853663943427784, 'regressor__regressor__model__regu_L1': 1.3093368855278048e-07, 'regressor__regressor__model__regu_L2': 2.054115447225713e-07, 'regressor__regressor__model__n_layers': 7, 'regressor__regressor__model__n_units': 461, 'regressor__regressor__loss': 'msle'}. Best is trial 15 with value: 0.713745100510843.[0m
2022-12-27 00:53:24.382284: W tensorflow/compiler/xla/stream_executor/platform/default/dso_loader.cc:64] Could not load dynamic library 'libcudart.so.11.0'; dlerror: libcudart.so.11.0: cannot open shared object file: No such file or directory; LD_LIBRARY_PATH: /.singularity.d/libs
2022-12-27 00:53:27.219823: W tensorflow/compiler/xla/stream_executor/platform/default/dso_loader.cc:64] Could not load dynamic library 'libnvinfer.so.7'; dlerror: libnvinfer.so.7: cannot open shared object file: No such file or directory; LD_LIBRARY_PATH: /.singularity.d/libs
2022-12-27 00:53:27.220008: W tensorflow/compiler/xla/stream_executor/platform/default/dso_loader.cc:64] Could not load dynamic library 'libnvinfer_plugin.so.7'; dlerror: libnvinfer_plugin.so.7: cannot open shared object file: No such file or directory; LD_LIBRARY_PATH: /.singularity.d/libs
2022-12-27 00:53:27.220274: W tensorflow/compiler/tf2tensorrt/utils/py_utils.cc:38] TF-TRT Warning: Cannot dlopen some TensorRT libraries. If you would like to use Nvidia GPU with TensorRT, please make sure the missing libraries mentioned above are installed properly.
2022-12-27 00:53:30.423027: W tensorflow/compiler/xla/stream_executor/platform/default/dso_loader.cc:64] Could not load dynamic library 'libcuda.so.1'; dlerror: libcuda.so.1: cannot open shared object file: No such file or directory; LD_LIBRARY_PATH: /.singularity.d/libs
2022-12-27 00:53:30.423259: W tensorflow/compiler/xla/stream_executor/cuda/cuda_driver.cc:265] failed call to cuInit: UNKNOWN ERROR (303)
[32m[I 2022-12-27 01:13:39,209][0m Trial 169 finished with value: -0.133139360188942 and parameters: {'regressor__regressor__batch_size': 40, 'regressor__regressor__epochs': 510, 'regressor__regressor__optimizer': 'Adam', 'regressor__regressor__optimizer__learning_rate': 2.157624219531702e-05, 'regressor__regressor__model__init_mode': 'uniform', 'regressor__regressor__model__activation': 'hard_sigmoid', 'regressor__regressor__model__dropout_rate': 0.08929505295836765, 'regressor__regressor__model__weight_constraint': 4.1188253777196016, 'regressor__regressor__model__regu_L1': 0.006537667222055537, 'regressor__regressor__model__regu_L2': 2.3781408810315894e-07, 'regressor__regressor__model__n_layers': 7, 'regressor__regressor__model__n_units': 461, 'regressor__regressor__loss': 'msle'}. Best is trial 15 with value: 0.713745100510843.[0m
[32m[I 2022-12-27 03:00:51,017][0m Trial 170 finished with value: -65.68237145469182 and parameters: {'regressor__regressor__batch_size': 40, 'regressor__regressor__epochs': 590, 'regressor__regressor__optimizer': 'Adam', 'regressor__regressor__optimizer__learning_rate': 4.2737714380977836e-05, 'regressor__regressor__model__init_mode': 'uniform', 'regressor__regressor__model__activation': 'hard_sigmoid', 'regressor__regressor__model__dropout_rate': 0.0573438509045398, 'regressor__regressor__model__weight_constraint': 4.10471240343984, 'regressor__regressor__model__regu_L1': 0.02470468684688028, 'regressor__regressor__model__regu_L2': 2.179098883305325e-07, 'regressor__regressor__model__n_layers': 7, 'regressor__regressor__model__n_units': 441, 'regressor__regressor__loss': 'cosine_similarity'}. Best is trial 15 with value: 0.713745100510843.[0m
2022-12-27 03:00:57.004362: W tensorflow/compiler/xla/stream_executor/platform/default/dso_loader.cc:64] Could not load dynamic library 'libcudart.so.11.0'; dlerror: libcudart.so.11.0: cannot open shared object file: No such file or directory; LD_LIBRARY_PATH: /.singularity.d/libs
2022-12-27 03:00:58.909216: W tensorflow/compiler/xla/stream_executor/platform/default/dso_loader.cc:64] Could not load dynamic library 'libnvinfer.so.7'; dlerror: libnvinfer.so.7: cannot open shared object file: No such file or directory; LD_LIBRARY_PATH: /.singularity.d/libs
2022-12-27 03:00:58.909330: W tensorflow/compiler/xla/stream_executor/platform/default/dso_loader.cc:64] Could not load dynamic library 'libnvinfer_plugin.so.7'; dlerror: libnvinfer_plugin.so.7: cannot open shared object file: No such file or directory; LD_LIBRARY_PATH: /.singularity.d/libs
2022-12-27 03:00:58.909357: W tensorflow/compiler/tf2tensorrt/utils/py_utils.cc:38] TF-TRT Warning: Cannot dlopen some TensorRT libraries. If you would like to use Nvidia GPU with TensorRT, please make sure the missing libraries mentioned above are installed properly.
2022-12-27 03:01:01.752984: W tensorflow/compiler/xla/stream_executor/platform/default/dso_loader.cc:64] Could not load dynamic library 'libcuda.so.1'; dlerror: libcuda.so.1: cannot open shared object file: No such file or directory; LD_LIBRARY_PATH: /.singularity.d/libs
2022-12-27 03:01:01.753103: W tensorflow/compiler/xla/stream_executor/cuda/cuda_driver.cc:265] failed call to cuInit: UNKNOWN ERROR (303)
[32m[I 2022-12-27 04:18:21,511][0m Trial 171 finished with value: -0.06868474271777555 and parameters: {'regressor__regressor__batch_size': 40, 'regressor__regressor__epochs': 590, 'regressor__regressor__optimizer': 'Adam', 'regressor__regressor__optimizer__learning_rate': 1.9478620331772233e-05, 'regressor__regressor__model__init_mode': 'identity', 'regressor__regressor__model__activation': 'LeakyReLU', 'regressor__regressor__model__dropout_rate': 0.09757575954818062, 'regressor__regressor__model__weight_constraint': 3.617683177370405, 'regressor__regressor__model__regu_L1': 3.825922980504801e-07, 'regressor__regressor__model__regu_L2': 2.2145296527525788e-07, 'regressor__regressor__model__n_layers': 7, 'regressor__regressor__model__n_units': 441, 'regressor__regressor__loss': 'cosine_similarity'}. Best is trial 15 with value: 0.713745100510843.[0m
2022-12-27 04:18:31.725870: W tensorflow/compiler/xla/stream_executor/platform/default/dso_loader.cc:64] Could not load dynamic library 'libcudart.so.11.0'; dlerror: libcudart.so.11.0: cannot open shared object file: No such file or directory; LD_LIBRARY_PATH: /.singularity.d/libs
2022-12-27 04:18:34.063095: W tensorflow/compiler/xla/stream_executor/platform/default/dso_loader.cc:64] Could not load dynamic library 'libnvinfer.so.7'; dlerror: libnvinfer.so.7: cannot open shared object file: No such file or directory; LD_LIBRARY_PATH: /.singularity.d/libs
2022-12-27 04:18:34.063230: W tensorflow/compiler/xla/stream_executor/platform/default/dso_loader.cc:64] Could not load dynamic library 'libnvinfer_plugin.so.7'; dlerror: libnvinfer_plugin.so.7: cannot open shared object file: No such file or directory; LD_LIBRARY_PATH: /.singularity.d/libs
2022-12-27 04:18:34.063255: W tensorflow/compiler/tf2tensorrt/utils/py_utils.cc:38] TF-TRT Warning: Cannot dlopen some TensorRT libraries. If you would like to use Nvidia GPU with TensorRT, please make sure the missing libraries mentioned above are installed properly.
2022-12-27 04:18:36.979525: W tensorflow/compiler/xla/stream_executor/platform/default/dso_loader.cc:64] Could not load dynamic library 'libcuda.so.1'; dlerror: libcuda.so.1: cannot open shared object file: No such file or directory; LD_LIBRARY_PATH: /.singularity.d/libs
2022-12-27 04:18:36.979642: W tensorflow/compiler/xla/stream_executor/cuda/cuda_driver.cc:265] failed call to cuInit: UNKNOWN ERROR (303)
