[32m[I 2022-12-26 10:37:01,955][0m Trial 152 finished with value: 0.6277172809154983 and parameters: {'regressor__regressor__batch_size': 60, 'regressor__regressor__epochs': 590, 'regressor__regressor__optimizer': 'Adam', 'regressor__regressor__optimizer__learning_rate': 1.9103043548265935e-05, 'regressor__regressor__model__init_mode': 'variance_scaling', 'regressor__regressor__model__activation': 'LeakyReLU', 'regressor__regressor__model__dropout_rate': 0.04236140765293327, 'regressor__regressor__model__weight_constraint': 3.216923059414828, 'regressor__regressor__model__regu_L1': 1.8796806802698656e-07, 'regressor__regressor__model__regu_L2': 1.0468577915994619e-07, 'regressor__regressor__model__n_layers': 9, 'regressor__regressor__model__n_units': 481, 'regressor__regressor__loss': 'log_cosh'}. Best is trial 15 with value: 0.713745100510843.[0m
[32m[I 2022-12-26 10:54:34,961][0m Trial 153 finished with value: 0.4599341076881357 and parameters: {'regressor__regressor__batch_size': 50, 'regressor__regressor__epochs': 590, 'regressor__regressor__optimizer': 'Adagrad', 'regressor__regressor__optimizer__learning_rate': 2.541838031604571e-05, 'regressor__regressor__model__init_mode': 'variance_scaling', 'regressor__regressor__model__activation': 'LeakyReLU', 'regressor__regressor__model__dropout_rate': 0.07687665350885808, 'regressor__regressor__model__weight_constraint': 3.0711862882537897, 'regressor__regressor__model__regu_L1': 1.0073369199914254e-07, 'regressor__regressor__model__regu_L2': 6.293945825518624e-07, 'regressor__regressor__model__n_layers': 9, 'regressor__regressor__model__n_units': 461, 'regressor__regressor__loss': 'log_cosh'}. Best is trial 15 with value: 0.713745100510843.[0m
2022-12-26 10:54:44.071902: W tensorflow/compiler/xla/stream_executor/platform/default/dso_loader.cc:64] Could not load dynamic library 'libcudart.so.11.0'; dlerror: libcudart.so.11.0: cannot open shared object file: No such file or directory; LD_LIBRARY_PATH: /.singularity.d/libs
2022-12-26 10:54:46.485656: W tensorflow/compiler/xla/stream_executor/platform/default/dso_loader.cc:64] Could not load dynamic library 'libnvinfer.so.7'; dlerror: libnvinfer.so.7: cannot open shared object file: No such file or directory; LD_LIBRARY_PATH: /.singularity.d/libs
2022-12-26 10:54:46.486310: W tensorflow/compiler/xla/stream_executor/platform/default/dso_loader.cc:64] Could not load dynamic library 'libnvinfer_plugin.so.7'; dlerror: libnvinfer_plugin.so.7: cannot open shared object file: No such file or directory; LD_LIBRARY_PATH: /.singularity.d/libs
2022-12-26 10:54:46.492398: W tensorflow/compiler/tf2tensorrt/utils/py_utils.cc:38] TF-TRT Warning: Cannot dlopen some TensorRT libraries. If you would like to use Nvidia GPU with TensorRT, please make sure the missing libraries mentioned above are installed properly.
2022-12-26 10:54:50.187262: W tensorflow/compiler/xla/stream_executor/platform/default/dso_loader.cc:64] Could not load dynamic library 'libcuda.so.1'; dlerror: libcuda.so.1: cannot open shared object file: No such file or directory; LD_LIBRARY_PATH: /.singularity.d/libs
2022-12-26 10:54:50.187363: W tensorflow/compiler/xla/stream_executor/cuda/cuda_driver.cc:265] failed call to cuInit: UNKNOWN ERROR (303)
[32m[I 2022-12-26 11:34:09,051][0m Trial 154 finished with value: 0.45838833273803364 and parameters: {'regressor__regressor__batch_size': 50, 'regressor__regressor__epochs': 550, 'regressor__regressor__optimizer': 'Adagrad', 'regressor__regressor__optimizer__learning_rate': 2.3540746041627647e-05, 'regressor__regressor__model__init_mode': 'variance_scaling', 'regressor__regressor__model__activation': 'LeakyReLU', 'regressor__regressor__model__dropout_rate': 0.07571453772785948, 'regressor__regressor__model__weight_constraint': 3.2010397986255583, 'regressor__regressor__model__regu_L1': 1.9863545198344768e-07, 'regressor__regressor__model__regu_L2': 3.905235867462757e-07, 'regressor__regressor__model__n_layers': 9, 'regressor__regressor__model__n_units': 461, 'regressor__regressor__loss': 'log_cosh'}. Best is trial 15 with value: 0.713745100510843.[0m
2022-12-26 11:34:14.966255: W tensorflow/compiler/xla/stream_executor/platform/default/dso_loader.cc:64] Could not load dynamic library 'libcudart.so.11.0'; dlerror: libcudart.so.11.0: cannot open shared object file: No such file or directory; LD_LIBRARY_PATH: /.singularity.d/libs
2022-12-26 11:34:17.182582: W tensorflow/compiler/xla/stream_executor/platform/default/dso_loader.cc:64] Could not load dynamic library 'libnvinfer.so.7'; dlerror: libnvinfer.so.7: cannot open shared object file: No such file or directory; LD_LIBRARY_PATH: /.singularity.d/libs
2022-12-26 11:34:17.182703: W tensorflow/compiler/xla/stream_executor/platform/default/dso_loader.cc:64] Could not load dynamic library 'libnvinfer_plugin.so.7'; dlerror: libnvinfer_plugin.so.7: cannot open shared object file: No such file or directory; LD_LIBRARY_PATH: /.singularity.d/libs
2022-12-26 11:34:17.182734: W tensorflow/compiler/tf2tensorrt/utils/py_utils.cc:38] TF-TRT Warning: Cannot dlopen some TensorRT libraries. If you would like to use Nvidia GPU with TensorRT, please make sure the missing libraries mentioned above are installed properly.
2022-12-26 11:34:20.643814: W tensorflow/compiler/xla/stream_executor/platform/default/dso_loader.cc:64] Could not load dynamic library 'libcuda.so.1'; dlerror: libcuda.so.1: cannot open shared object file: No such file or directory; LD_LIBRARY_PATH: /.singularity.d/libs
2022-12-26 11:34:20.644023: W tensorflow/compiler/xla/stream_executor/cuda/cuda_driver.cc:265] failed call to cuInit: UNKNOWN ERROR (303)
[32m[I 2022-12-26 12:55:21,703][0m Trial 155 finished with value: 0.6253637502788998 and parameters: {'regressor__regressor__batch_size': 50, 'regressor__regressor__epochs': 550, 'regressor__regressor__optimizer': 'Adam', 'regressor__regressor__optimizer__learning_rate': 1.9509959658240354e-05, 'regressor__regressor__model__init_mode': 'variance_scaling', 'regressor__regressor__model__activation': 'LeakyReLU', 'regressor__regressor__model__dropout_rate': 0.07846579976228005, 'regressor__regressor__model__weight_constraint': 3.0973050438295635, 'regressor__regressor__model__regu_L1': 1.8357489659985507e-07, 'regressor__regressor__model__regu_L2': 4.5293390934674084e-07, 'regressor__regressor__model__n_layers': 9, 'regressor__regressor__model__n_units': 461, 'regressor__regressor__loss': 'log_cosh'}. Best is trial 15 with value: 0.713745100510843.[0m
2022-12-26 12:55:29.045394: W tensorflow/compiler/xla/stream_executor/platform/default/dso_loader.cc:64] Could not load dynamic library 'libcudart.so.11.0'; dlerror: libcudart.so.11.0: cannot open shared object file: No such file or directory; LD_LIBRARY_PATH: /.singularity.d/libs
2022-12-26 12:55:30.753111: W tensorflow/compiler/xla/stream_executor/platform/default/dso_loader.cc:64] Could not load dynamic library 'libnvinfer.so.7'; dlerror: libnvinfer.so.7: cannot open shared object file: No such file or directory; LD_LIBRARY_PATH: /.singularity.d/libs
2022-12-26 12:55:30.753561: W tensorflow/compiler/xla/stream_executor/platform/default/dso_loader.cc:64] Could not load dynamic library 'libnvinfer_plugin.so.7'; dlerror: libnvinfer_plugin.so.7: cannot open shared object file: No such file or directory; LD_LIBRARY_PATH: /.singularity.d/libs
2022-12-26 12:55:30.753590: W tensorflow/compiler/tf2tensorrt/utils/py_utils.cc:38] TF-TRT Warning: Cannot dlopen some TensorRT libraries. If you would like to use Nvidia GPU with TensorRT, please make sure the missing libraries mentioned above are installed properly.
2022-12-26 12:55:33.501740: W tensorflow/compiler/xla/stream_executor/platform/default/dso_loader.cc:64] Could not load dynamic library 'libcuda.so.1'; dlerror: libcuda.so.1: cannot open shared object file: No such file or directory; LD_LIBRARY_PATH: /.singularity.d/libs
2022-12-26 12:55:33.501864: W tensorflow/compiler/xla/stream_executor/cuda/cuda_driver.cc:265] failed call to cuInit: UNKNOWN ERROR (303)
[32m[I 2022-12-26 15:21:03,978][0m Trial 159 finished with value: 0.6010776506161953 and parameters: {'regressor__regressor__batch_size': 80, 'regressor__regressor__epochs': 550, 'regressor__regressor__optimizer': 'Adam', 'regressor__regressor__optimizer__learning_rate': 1.6954590458142704e-05, 'regressor__regressor__model__init_mode': 'glorot_normal', 'regressor__regressor__model__activation': 'LeakyReLU', 'regressor__regressor__model__dropout_rate': 0.06906405333523308, 'regressor__regressor__model__weight_constraint': 2.749925298304678, 'regressor__regressor__model__regu_L1': 1.6927397076917856e-07, 'regressor__regressor__model__regu_L2': 4.91788686636548e-07, 'regressor__regressor__model__n_layers': 9, 'regressor__regressor__model__n_units': 421, 'regressor__regressor__loss': 'log_cosh'}. Best is trial 15 with value: 0.713745100510843.[0m
2022-12-26 15:21:12.774488: W tensorflow/compiler/xla/stream_executor/platform/default/dso_loader.cc:64] Could not load dynamic library 'libcudart.so.11.0'; dlerror: libcudart.so.11.0: cannot open shared object file: No such file or directory; LD_LIBRARY_PATH: /.singularity.d/libs
2022-12-26 15:21:14.920874: W tensorflow/compiler/xla/stream_executor/platform/default/dso_loader.cc:64] Could not load dynamic library 'libnvinfer.so.7'; dlerror: libnvinfer.so.7: cannot open shared object file: No such file or directory; LD_LIBRARY_PATH: /.singularity.d/libs
2022-12-26 15:21:14.921365: W tensorflow/compiler/xla/stream_executor/platform/default/dso_loader.cc:64] Could not load dynamic library 'libnvinfer_plugin.so.7'; dlerror: libnvinfer_plugin.so.7: cannot open shared object file: No such file or directory; LD_LIBRARY_PATH: /.singularity.d/libs
2022-12-26 15:21:14.921397: W tensorflow/compiler/tf2tensorrt/utils/py_utils.cc:38] TF-TRT Warning: Cannot dlopen some TensorRT libraries. If you would like to use Nvidia GPU with TensorRT, please make sure the missing libraries mentioned above are installed properly.
2022-12-26 15:21:17.521724: W tensorflow/compiler/xla/stream_executor/platform/default/dso_loader.cc:64] Could not load dynamic library 'libcuda.so.1'; dlerror: libcuda.so.1: cannot open shared object file: No such file or directory; LD_LIBRARY_PATH: /.singularity.d/libs
2022-12-26 15:21:17.521957: W tensorflow/compiler/xla/stream_executor/cuda/cuda_driver.cc:265] failed call to cuInit: UNKNOWN ERROR (303)
[32m[I 2022-12-26 15:35:14,407][0m Trial 156 finished with value: 0.634621948350304 and parameters: {'regressor__regressor__batch_size': 50, 'regressor__regressor__epochs': 550, 'regressor__regressor__optimizer': 'Adam', 'regressor__regressor__optimizer__learning_rate': 2.084443965092692e-05, 'regressor__regressor__model__init_mode': 'variance_scaling', 'regressor__regressor__model__activation': 'LeakyReLU', 'regressor__regressor__model__dropout_rate': 0.06588671373404642, 'regressor__regressor__model__weight_constraint': 3.0737938096073347, 'regressor__regressor__model__regu_L1': 1.8348955351690602e-07, 'regressor__regressor__model__regu_L2': 4.424033902351979e-07, 'regressor__regressor__model__n_layers': 9, 'regressor__regressor__model__n_units': 461, 'regressor__regressor__loss': 'log_cosh'}. Best is trial 15 with value: 0.713745100510843.[0m
2022-12-26 15:35:24.257900: W tensorflow/compiler/xla/stream_executor/platform/default/dso_loader.cc:64] Could not load dynamic library 'libcudart.so.11.0'; dlerror: libcudart.so.11.0: cannot open shared object file: No such file or directory; LD_LIBRARY_PATH: /.singularity.d/libs
2022-12-26 15:35:26.879166: W tensorflow/compiler/xla/stream_executor/platform/default/dso_loader.cc:64] Could not load dynamic library 'libnvinfer.so.7'; dlerror: libnvinfer.so.7: cannot open shared object file: No such file or directory; LD_LIBRARY_PATH: /.singularity.d/libs
2022-12-26 15:35:26.879320: W tensorflow/compiler/xla/stream_executor/platform/default/dso_loader.cc:64] Could not load dynamic library 'libnvinfer_plugin.so.7'; dlerror: libnvinfer_plugin.so.7: cannot open shared object file: No such file or directory; LD_LIBRARY_PATH: /.singularity.d/libs
2022-12-26 15:35:26.879354: W tensorflow/compiler/tf2tensorrt/utils/py_utils.cc:38] TF-TRT Warning: Cannot dlopen some TensorRT libraries. If you would like to use Nvidia GPU with TensorRT, please make sure the missing libraries mentioned above are installed properly.
2022-12-26 15:35:30.343476: W tensorflow/compiler/xla/stream_executor/platform/default/dso_loader.cc:64] Could not load dynamic library 'libcuda.so.1'; dlerror: libcuda.so.1: cannot open shared object file: No such file or directory; LD_LIBRARY_PATH: /.singularity.d/libs
2022-12-26 15:35:30.343563: W tensorflow/compiler/xla/stream_executor/cuda/cuda_driver.cc:265] failed call to cuInit: UNKNOWN ERROR (303)
[32m[I 2022-12-26 16:10:17,204][0m Trial 158 finished with value: 0.6104629854115602 and parameters: {'regressor__regressor__batch_size': 50, 'regressor__regressor__epochs': 550, 'regressor__regressor__optimizer': 'Adam', 'regressor__regressor__optimizer__learning_rate': 1.654429760182903e-05, 'regressor__regressor__model__init_mode': 'variance_scaling', 'regressor__regressor__model__activation': 'LeakyReLU', 'regressor__regressor__model__dropout_rate': 0.07474041585189138, 'regressor__regressor__model__weight_constraint': 2.8198959463336175, 'regressor__regressor__model__regu_L1': 1.8618399846216324e-07, 'regressor__regressor__model__regu_L2': 3.952205617124332e-07, 'regressor__regressor__model__n_layers': 9, 'regressor__regressor__model__n_units': 421, 'regressor__regressor__loss': 'log_cosh'}. Best is trial 15 with value: 0.713745100510843.[0m
2022-12-26 16:10:23.261717: W tensorflow/compiler/xla/stream_executor/platform/default/dso_loader.cc:64] Could not load dynamic library 'libcudart.so.11.0'; dlerror: libcudart.so.11.0: cannot open shared object file: No such file or directory; LD_LIBRARY_PATH: /.singularity.d/libs
2022-12-26 16:10:25.211193: W tensorflow/compiler/xla/stream_executor/platform/default/dso_loader.cc:64] Could not load dynamic library 'libnvinfer.so.7'; dlerror: libnvinfer.so.7: cannot open shared object file: No such file or directory; LD_LIBRARY_PATH: /.singularity.d/libs
2022-12-26 16:10:25.211341: W tensorflow/compiler/xla/stream_executor/platform/default/dso_loader.cc:64] Could not load dynamic library 'libnvinfer_plugin.so.7'; dlerror: libnvinfer_plugin.so.7: cannot open shared object file: No such file or directory; LD_LIBRARY_PATH: /.singularity.d/libs
2022-12-26 16:10:25.211371: W tensorflow/compiler/tf2tensorrt/utils/py_utils.cc:38] TF-TRT Warning: Cannot dlopen some TensorRT libraries. If you would like to use Nvidia GPU with TensorRT, please make sure the missing libraries mentioned above are installed properly.
2022-12-26 16:10:29.094545: W tensorflow/compiler/xla/stream_executor/platform/default/dso_loader.cc:64] Could not load dynamic library 'libcuda.so.1'; dlerror: libcuda.so.1: cannot open shared object file: No such file or directory; LD_LIBRARY_PATH: /.singularity.d/libs
2022-12-26 16:10:29.095641: W tensorflow/compiler/xla/stream_executor/cuda/cuda_driver.cc:265] failed call to cuInit: UNKNOWN ERROR (303)
[32m[I 2022-12-26 16:36:13,634][0m Trial 160 finished with value: 0.6046645374198893 and parameters: {'regressor__regressor__batch_size': 80, 'regressor__regressor__epochs': 550, 'regressor__regressor__optimizer': 'Adam', 'regressor__regressor__optimizer__learning_rate': 1.568119185319969e-05, 'regressor__regressor__model__init_mode': 'truncated_normal', 'regressor__regressor__model__activation': 'LeakyReLU', 'regressor__regressor__model__dropout_rate': 0.06723128291002381, 'regressor__regressor__model__weight_constraint': 2.8039936601935063, 'regressor__regressor__model__regu_L1': 1.3411615402512952e-07, 'regressor__regressor__model__regu_L2': 7.562556134671665e-07, 'regressor__regressor__model__n_layers': 9, 'regressor__regressor__model__n_units': 421, 'regressor__regressor__loss': 'log_cosh'}. Best is trial 15 with value: 0.713745100510843.[0m
2022-12-26 16:36:21.285948: W tensorflow/compiler/xla/stream_executor/platform/default/dso_loader.cc:64] Could not load dynamic library 'libcudart.so.11.0'; dlerror: libcudart.so.11.0: cannot open shared object file: No such file or directory; LD_LIBRARY_PATH: /.singularity.d/libs
2022-12-26 16:36:23.248324: W tensorflow/compiler/xla/stream_executor/platform/default/dso_loader.cc:64] Could not load dynamic library 'libnvinfer.so.7'; dlerror: libnvinfer.so.7: cannot open shared object file: No such file or directory; LD_LIBRARY_PATH: /.singularity.d/libs
2022-12-26 16:36:23.248859: W tensorflow/compiler/xla/stream_executor/platform/default/dso_loader.cc:64] Could not load dynamic library 'libnvinfer_plugin.so.7'; dlerror: libnvinfer_plugin.so.7: cannot open shared object file: No such file or directory; LD_LIBRARY_PATH: /.singularity.d/libs
2022-12-26 16:36:23.248888: W tensorflow/compiler/tf2tensorrt/utils/py_utils.cc:38] TF-TRT Warning: Cannot dlopen some TensorRT libraries. If you would like to use Nvidia GPU with TensorRT, please make sure the missing libraries mentioned above are installed properly.
2022-12-26 16:36:26.098367: W tensorflow/compiler/xla/stream_executor/platform/default/dso_loader.cc:64] Could not load dynamic library 'libcuda.so.1'; dlerror: libcuda.so.1: cannot open shared object file: No such file or directory; LD_LIBRARY_PATH: /.singularity.d/libs
2022-12-26 16:36:26.098656: W tensorflow/compiler/xla/stream_executor/cuda/cuda_driver.cc:265] failed call to cuInit: UNKNOWN ERROR (303)
[32m[I 2022-12-26 16:42:32,920][0m Trial 157 finished with value: 0.6393740128442922 and parameters: {'regressor__regressor__batch_size': 50, 'regressor__regressor__epochs': 570, 'regressor__regressor__optimizer': 'Adam', 'regressor__regressor__optimizer__learning_rate': 2.151819674868587e-05, 'regressor__regressor__model__init_mode': 'variance_scaling', 'regressor__regressor__model__activation': 'LeakyReLU', 'regressor__regressor__model__dropout_rate': 0.06301032203994894, 'regressor__regressor__model__weight_constraint': 3.8118632844779947, 'regressor__regressor__model__regu_L1': 1.7396793073683253e-07, 'regressor__regressor__model__regu_L2': 4.548615145867748e-07, 'regressor__regressor__model__n_layers': 9, 'regressor__regressor__model__n_units': 461, 'regressor__regressor__loss': 'log_cosh'}. Best is trial 15 with value: 0.713745100510843.[0m
2022-12-26 16:42:38.719434: W tensorflow/compiler/xla/stream_executor/platform/default/dso_loader.cc:64] Could not load dynamic library 'libcudart.so.11.0'; dlerror: libcudart.so.11.0: cannot open shared object file: No such file or directory; LD_LIBRARY_PATH: /.singularity.d/libs
2022-12-26 16:42:40.684821: W tensorflow/compiler/xla/stream_executor/platform/default/dso_loader.cc:64] Could not load dynamic library 'libnvinfer.so.7'; dlerror: libnvinfer.so.7: cannot open shared object file: No such file or directory; LD_LIBRARY_PATH: /.singularity.d/libs
2022-12-26 16:42:40.686683: W tensorflow/compiler/xla/stream_executor/platform/default/dso_loader.cc:64] Could not load dynamic library 'libnvinfer_plugin.so.7'; dlerror: libnvinfer_plugin.so.7: cannot open shared object file: No such file or directory; LD_LIBRARY_PATH: /.singularity.d/libs
2022-12-26 16:42:40.686733: W tensorflow/compiler/tf2tensorrt/utils/py_utils.cc:38] TF-TRT Warning: Cannot dlopen some TensorRT libraries. If you would like to use Nvidia GPU with TensorRT, please make sure the missing libraries mentioned above are installed properly.
2022-12-26 16:42:44.290452: W tensorflow/compiler/xla/stream_executor/platform/default/dso_loader.cc:64] Could not load dynamic library 'libcuda.so.1'; dlerror: libcuda.so.1: cannot open shared object file: No such file or directory; LD_LIBRARY_PATH: /.singularity.d/libs
2022-12-26 16:42:44.290589: W tensorflow/compiler/xla/stream_executor/cuda/cuda_driver.cc:265] failed call to cuInit: UNKNOWN ERROR (303)
[32m[I 2022-12-26 17:26:36,670][0m Trial 164 finished with value: 0.5669845804370164 and parameters: {'regressor__regressor__batch_size': 60, 'regressor__regressor__epochs': 130, 'regressor__regressor__optimizer': 'RMSprop', 'regressor__regressor__optimizer__learning_rate': 4.298642407150227e-05, 'regressor__regressor__model__init_mode': 'variance_scaling', 'regressor__regressor__model__activation': 'LeakyReLU', 'regressor__regressor__model__dropout_rate': 0.10798111779579954, 'regressor__regressor__model__weight_constraint': 2.485165366233688, 'regressor__regressor__model__regu_L1': 2.3219052034132762e-07, 'regressor__regressor__model__regu_L2': 1.1572613348597883e-06, 'regressor__regressor__model__n_layers': 7, 'regressor__regressor__model__n_units': 401, 'regressor__regressor__loss': 'log_cosh'}. Best is trial 15 with value: 0.713745100510843.[0m
