[32m[I 2022-12-24 17:18:15,938][0m Trial 59 finished with value: 0.1551406666887969 and parameters: {'regressor__regressor__batch_size': 130, 'regressor__regressor__epochs': 110, 'regressor__regressor__optimizer': 'SGD', 'regressor__regressor__optimizer__learning_rate': 0.08565053388353361, 'regressor__regressor__model__init_mode': 'identity', 'regressor__regressor__model__activation': 'softsign', 'regressor__regressor__model__dropout_rate': 0.1852380407258063, 'regressor__regressor__model__weight_constraint': 2.9141243426730234, 'regressor__regressor__model__regu_L1': 9.400123115469328e-07, 'regressor__regressor__model__regu_L2': 2.2294806060064048e-07, 'regressor__regressor__model__n_layers': 9, 'regressor__regressor__model__n_units': 61, 'regressor__regressor__loss': 'msle'}. Best is trial 15 with value: 0.713745100510843.[0m
[32m[I 2022-12-24 17:19:16,603][0m Trial 58 finished with value: -0.14461804976771928 and parameters: {'regressor__regressor__batch_size': 130, 'regressor__regressor__epochs': 210, 'regressor__regressor__optimizer': 'RMSprop', 'regressor__regressor__optimizer__learning_rate': 0.011281040066547838, 'regressor__regressor__model__init_mode': 'uniform', 'regressor__regressor__model__activation': 'softsign', 'regressor__regressor__model__dropout_rate': 0.4102469772368524, 'regressor__regressor__model__weight_constraint': 3.2209992048037677, 'regressor__regressor__model__regu_L1': 7.886992499617027e-07, 'regressor__regressor__model__regu_L2': 1.990690491092301e-07, 'regressor__regressor__model__n_layers': 11, 'regressor__regressor__model__n_units': 61, 'regressor__regressor__loss': 'msle'}. Best is trial 15 with value: 0.713745100510843.[0m
/usr/local/lib/python3.9/dist-packages/sklearn/model_selection/_validation.py:776: UserWarning: Scoring failed. The score on this train-test partition for these parameters will be set to nan. Details: 
Traceback (most recent call last):
  File "/usr/local/lib/python3.9/dist-packages/sklearn/model_selection/_validation.py", line 767, in _score
    scores = scorer(estimator, X_test, y_test)
  File "/usr/local/lib/python3.9/dist-packages/sklearn/metrics/_scorer.py", line 107, in __call__
    score = scorer._score(cached_call, estimator, *args, **kwargs)
  File "/usr/local/lib/python3.9/dist-packages/sklearn/metrics/_scorer.py", line 268, in _score
    return self._sign * self._score_func(y_true, y_pred, **self._kwargs)
  File "/usr/local/lib/python3.9/dist-packages/sklearn/metrics/_regression.py", line 911, in r2_score
    y_type, y_true, y_pred, multioutput = _check_reg_targets(
  File "/usr/local/lib/python3.9/dist-packages/sklearn/metrics/_regression.py", line 102, in _check_reg_targets
    y_pred = check_array(y_pred, ensure_2d=False, dtype=dtype)
  File "/usr/local/lib/python3.9/dist-packages/sklearn/utils/validation.py", line 919, in check_array
    _assert_all_finite(
  File "/usr/local/lib/python3.9/dist-packages/sklearn/utils/validation.py", line 161, in _assert_all_finite
    raise ValueError(msg_err)
ValueError: Input contains NaN.

  warnings.warn(
[33m[W 2022-12-24 17:21:39,943][0m Trial 61 failed because of the following error: The value nan is not acceptable.[0m
/usr/local/lib/python3.9/dist-packages/sklearn/model_selection/_validation.py:776: UserWarning: Scoring failed. The score on this train-test partition for these parameters will be set to nan. Details: 
Traceback (most recent call last):
  File "/usr/local/lib/python3.9/dist-packages/sklearn/model_selection/_validation.py", line 767, in _score
    scores = scorer(estimator, X_test, y_test)
  File "/usr/local/lib/python3.9/dist-packages/sklearn/metrics/_scorer.py", line 107, in __call__
    score = scorer._score(cached_call, estimator, *args, **kwargs)
  File "/usr/local/lib/python3.9/dist-packages/sklearn/metrics/_scorer.py", line 268, in _score
    return self._sign * self._score_func(y_true, y_pred, **self._kwargs)
  File "/usr/local/lib/python3.9/dist-packages/sklearn/metrics/_regression.py", line 911, in r2_score
    y_type, y_true, y_pred, multioutput = _check_reg_targets(
  File "/usr/local/lib/python3.9/dist-packages/sklearn/metrics/_regression.py", line 102, in _check_reg_targets
    y_pred = check_array(y_pred, ensure_2d=False, dtype=dtype)
  File "/usr/local/lib/python3.9/dist-packages/sklearn/utils/validation.py", line 919, in check_array
    _assert_all_finite(
  File "/usr/local/lib/python3.9/dist-packages/sklearn/utils/validation.py", line 161, in _assert_all_finite
    raise ValueError(msg_err)
ValueError: Input contains NaN.

  warnings.warn(
/usr/local/lib/python3.9/dist-packages/sklearn/model_selection/_validation.py:776: UserWarning: Scoring failed. The score on this train-test partition for these parameters will be set to nan. Details: 
Traceback (most recent call last):
  File "/usr/local/lib/python3.9/dist-packages/sklearn/model_selection/_validation.py", line 767, in _score
    scores = scorer(estimator, X_test, y_test)
  File "/usr/local/lib/python3.9/dist-packages/sklearn/metrics/_scorer.py", line 107, in __call__
    score = scorer._score(cached_call, estimator, *args, **kwargs)
  File "/usr/local/lib/python3.9/dist-packages/sklearn/metrics/_scorer.py", line 268, in _score
    return self._sign * self._score_func(y_true, y_pred, **self._kwargs)
  File "/usr/local/lib/python3.9/dist-packages/sklearn/metrics/_regression.py", line 911, in r2_score
    y_type, y_true, y_pred, multioutput = _check_reg_targets(
  File "/usr/local/lib/python3.9/dist-packages/sklearn/metrics/_regression.py", line 102, in _check_reg_targets
    y_pred = check_array(y_pred, ensure_2d=False, dtype=dtype)
  File "/usr/local/lib/python3.9/dist-packages/sklearn/utils/validation.py", line 919, in check_array
    _assert_all_finite(
  File "/usr/local/lib/python3.9/dist-packages/sklearn/utils/validation.py", line 161, in _assert_all_finite
    raise ValueError(msg_err)
ValueError: Input contains NaN.

  warnings.warn(
[32m[I 2022-12-24 17:22:32,743][0m Trial 60 finished with value: -11.732389358548792 and parameters: {'regressor__regressor__batch_size': 30, 'regressor__regressor__epochs': 110, 'regressor__regressor__optimizer': 'RMSprop', 'regressor__regressor__optimizer__learning_rate': 0.05772525278040555, 'regressor__regressor__model__init_mode': 'glorot_normal', 'regressor__regressor__model__activation': 'softsign', 'regressor__regressor__model__dropout_rate': 0.721658137773399, 'regressor__regressor__model__weight_constraint': 2.565358880628077, 'regressor__regressor__model__regu_L1': 0.0013822799034793009, 'regressor__regressor__model__regu_L2': 1.908873589791441e-07, 'regressor__regressor__model__n_layers': 9, 'regressor__regressor__model__n_units': 81, 'regressor__regressor__loss': 'msle'}. Best is trial 15 with value: 0.713745100510843.[0m
