[32m[I 2022-12-30 11:13:55,110][0m Trial 235 finished with value: 0.7720984339885485 and parameters: {'regressor__regressor__batch_size': 20, 'regressor__regressor__epochs': 370, 'regressor__regressor__optimizer': 'Nadam', 'regressor__regressor__optimizer__learning_rate': 0.00016248246759901908, 'regressor__regressor__model__init_mode': 'glorot_normal', 'regressor__regressor__model__activation': 'elu', 'regressor__regressor__model__dropout_rate': 0.031052356720195108, 'regressor__regressor__model__weight_constraint': 3.735977781571089, 'regressor__regressor__model__regu_L1': 1.8745953321310532e-06, 'regressor__regressor__model__regu_L2': 4.763457095639803e-06, 'regressor__regressor__model__n_layers': 7, 'regressor__regressor__model__n_units': 401, 'regressor__regressor__loss': 'mean_absolute_error'}. Best is trial 199 with value: 0.7759054127864374.[0m
2022-12-30 11:14:00.949422: W tensorflow/compiler/xla/stream_executor/platform/default/dso_loader.cc:64] Could not load dynamic library 'libcudart.so.11.0'; dlerror: libcudart.so.11.0: cannot open shared object file: No such file or directory; LD_LIBRARY_PATH: /.singularity.d/libs
2022-12-30 11:14:02.407677: W tensorflow/compiler/xla/stream_executor/platform/default/dso_loader.cc:64] Could not load dynamic library 'libnvinfer.so.7'; dlerror: libnvinfer.so.7: cannot open shared object file: No such file or directory; LD_LIBRARY_PATH: /.singularity.d/libs
2022-12-30 11:14:02.407839: W tensorflow/compiler/xla/stream_executor/platform/default/dso_loader.cc:64] Could not load dynamic library 'libnvinfer_plugin.so.7'; dlerror: libnvinfer_plugin.so.7: cannot open shared object file: No such file or directory; LD_LIBRARY_PATH: /.singularity.d/libs
2022-12-30 11:14:02.407884: W tensorflow/compiler/tf2tensorrt/utils/py_utils.cc:38] TF-TRT Warning: Cannot dlopen some TensorRT libraries. If you would like to use Nvidia GPU with TensorRT, please make sure the missing libraries mentioned above are installed properly.
2022-12-30 11:14:04.943373: W tensorflow/compiler/xla/stream_executor/platform/default/dso_loader.cc:64] Could not load dynamic library 'libcuda.so.1'; dlerror: libcuda.so.1: cannot open shared object file: No such file or directory; LD_LIBRARY_PATH: /.singularity.d/libs
2022-12-30 11:14:04.943493: W tensorflow/compiler/xla/stream_executor/cuda/cuda_driver.cc:265] failed call to cuInit: UNKNOWN ERROR (303)
[32m[I 2022-12-30 12:05:13,098][0m Trial 234 finished with value: 0.7713551442502181 and parameters: {'regressor__regressor__batch_size': 20, 'regressor__regressor__epochs': 390, 'regressor__regressor__optimizer': 'Nadam', 'regressor__regressor__optimizer__learning_rate': 0.0001474282436964835, 'regressor__regressor__model__init_mode': 'glorot_normal', 'regressor__regressor__model__activation': 'elu', 'regressor__regressor__model__dropout_rate': 0.029899337662122213, 'regressor__regressor__model__weight_constraint': 3.357720440732533, 'regressor__regressor__model__regu_L1': 1.7319043877553408e-06, 'regressor__regressor__model__regu_L2': 1.8384805473418716e-05, 'regressor__regressor__model__n_layers': 7, 'regressor__regressor__model__n_units': 401, 'regressor__regressor__loss': 'mean_absolute_error'}. Best is trial 199 with value: 0.7759054127864374.[0m
2022-12-30 12:05:19.161873: W tensorflow/compiler/xla/stream_executor/platform/default/dso_loader.cc:64] Could not load dynamic library 'libcudart.so.11.0'; dlerror: libcudart.so.11.0: cannot open shared object file: No such file or directory; LD_LIBRARY_PATH: /.singularity.d/libs
2022-12-30 12:05:21.368089: W tensorflow/compiler/xla/stream_executor/platform/default/dso_loader.cc:64] Could not load dynamic library 'libnvinfer.so.7'; dlerror: libnvinfer.so.7: cannot open shared object file: No such file or directory; LD_LIBRARY_PATH: /.singularity.d/libs
2022-12-30 12:05:21.369290: W tensorflow/compiler/xla/stream_executor/platform/default/dso_loader.cc:64] Could not load dynamic library 'libnvinfer_plugin.so.7'; dlerror: libnvinfer_plugin.so.7: cannot open shared object file: No such file or directory; LD_LIBRARY_PATH: /.singularity.d/libs
2022-12-30 12:05:21.369350: W tensorflow/compiler/tf2tensorrt/utils/py_utils.cc:38] TF-TRT Warning: Cannot dlopen some TensorRT libraries. If you would like to use Nvidia GPU with TensorRT, please make sure the missing libraries mentioned above are installed properly.
2022-12-30 12:05:25.027869: W tensorflow/compiler/xla/stream_executor/platform/default/dso_loader.cc:64] Could not load dynamic library 'libcuda.so.1'; dlerror: libcuda.so.1: cannot open shared object file: No such file or directory; LD_LIBRARY_PATH: /.singularity.d/libs
2022-12-30 12:05:25.027968: W tensorflow/compiler/xla/stream_executor/cuda/cuda_driver.cc:265] failed call to cuInit: UNKNOWN ERROR (303)
[32m[I 2022-12-30 15:39:37,784][0m Trial 236 finished with value: 0.7711332583269048 and parameters: {'regressor__regressor__batch_size': 20, 'regressor__regressor__epochs': 390, 'regressor__regressor__optimizer': 'Nadam', 'regressor__regressor__optimizer__learning_rate': 0.00016576041168660878, 'regressor__regressor__model__init_mode': 'glorot_normal', 'regressor__regressor__model__activation': 'elu', 'regressor__regressor__model__dropout_rate': 0.03283982484186152, 'regressor__regressor__model__weight_constraint': 3.7095018326484417, 'regressor__regressor__model__regu_L1': 1.1476627290586497e-06, 'regressor__regressor__model__regu_L2': 1.6888221902540334e-05, 'regressor__regressor__model__n_layers': 7, 'regressor__regressor__model__n_units': 401, 'regressor__regressor__loss': 'mean_absolute_error'}. Best is trial 199 with value: 0.7759054127864374.[0m
2022-12-30 15:39:42.038582: W tensorflow/compiler/xla/stream_executor/platform/default/dso_loader.cc:64] Could not load dynamic library 'libcudart.so.11.0'; dlerror: libcudart.so.11.0: cannot open shared object file: No such file or directory; LD_LIBRARY_PATH: /.singularity.d/libs
2022-12-30 15:39:43.278932: W tensorflow/compiler/xla/stream_executor/platform/default/dso_loader.cc:64] Could not load dynamic library 'libnvinfer.so.7'; dlerror: libnvinfer.so.7: cannot open shared object file: No such file or directory; LD_LIBRARY_PATH: /.singularity.d/libs
2022-12-30 15:39:43.280551: W tensorflow/compiler/xla/stream_executor/platform/default/dso_loader.cc:64] Could not load dynamic library 'libnvinfer_plugin.so.7'; dlerror: libnvinfer_plugin.so.7: cannot open shared object file: No such file or directory; LD_LIBRARY_PATH: /.singularity.d/libs
2022-12-30 15:39:43.280580: W tensorflow/compiler/tf2tensorrt/utils/py_utils.cc:38] TF-TRT Warning: Cannot dlopen some TensorRT libraries. If you would like to use Nvidia GPU with TensorRT, please make sure the missing libraries mentioned above are installed properly.
2022-12-30 15:39:44.843085: W tensorflow/compiler/xla/stream_executor/platform/default/dso_loader.cc:64] Could not load dynamic library 'libcuda.so.1'; dlerror: libcuda.so.1: cannot open shared object file: No such file or directory; LD_LIBRARY_PATH: /.singularity.d/libs
2022-12-30 15:39:44.843196: W tensorflow/compiler/xla/stream_executor/cuda/cuda_driver.cc:265] failed call to cuInit: UNKNOWN ERROR (303)
[32m[I 2022-12-30 15:51:45,161][0m Trial 237 finished with value: 0.7682183811831382 and parameters: {'regressor__regressor__batch_size': 20, 'regressor__regressor__epochs': 390, 'regressor__regressor__optimizer': 'Nadam', 'regressor__regressor__optimizer__learning_rate': 0.00015038540476292205, 'regressor__regressor__model__init_mode': 'glorot_normal', 'regressor__regressor__model__activation': 'elu', 'regressor__regressor__model__dropout_rate': 0.03006575589978104, 'regressor__regressor__model__weight_constraint': 3.706363044026318, 'regressor__regressor__model__regu_L1': 1.4181689604186173e-06, 'regressor__regressor__model__regu_L2': 1.8279545632766947e-05, 'regressor__regressor__model__n_layers': 7, 'regressor__regressor__model__n_units': 401, 'regressor__regressor__loss': 'mean_absolute_error'}. Best is trial 199 with value: 0.7759054127864374.[0m
2022-12-30 15:51:49.599746: W tensorflow/compiler/xla/stream_executor/platform/default/dso_loader.cc:64] Could not load dynamic library 'libcudart.so.11.0'; dlerror: libcudart.so.11.0: cannot open shared object file: No such file or directory; LD_LIBRARY_PATH: /.singularity.d/libs
2022-12-30 15:51:50.950761: W tensorflow/compiler/xla/stream_executor/platform/default/dso_loader.cc:64] Could not load dynamic library 'libnvinfer.so.7'; dlerror: libnvinfer.so.7: cannot open shared object file: No such file or directory; LD_LIBRARY_PATH: /.singularity.d/libs
2022-12-30 15:51:50.950952: W tensorflow/compiler/xla/stream_executor/platform/default/dso_loader.cc:64] Could not load dynamic library 'libnvinfer_plugin.so.7'; dlerror: libnvinfer_plugin.so.7: cannot open shared object file: No such file or directory; LD_LIBRARY_PATH: /.singularity.d/libs
2022-12-30 15:51:50.950988: W tensorflow/compiler/tf2tensorrt/utils/py_utils.cc:38] TF-TRT Warning: Cannot dlopen some TensorRT libraries. If you would like to use Nvidia GPU with TensorRT, please make sure the missing libraries mentioned above are installed properly.
2022-12-30 15:51:53.077880: W tensorflow/compiler/xla/stream_executor/platform/default/dso_loader.cc:64] Could not load dynamic library 'libcuda.so.1'; dlerror: libcuda.so.1: cannot open shared object file: No such file or directory; LD_LIBRARY_PATH: /.singularity.d/libs
2022-12-30 15:51:53.077982: W tensorflow/compiler/xla/stream_executor/cuda/cuda_driver.cc:265] failed call to cuInit: UNKNOWN ERROR (303)
[32m[I 2022-12-30 16:14:41,193][0m Trial 238 finished with value: 0.7712989453449238 and parameters: {'regressor__regressor__batch_size': 20, 'regressor__regressor__epochs': 410, 'regressor__regressor__optimizer': 'Nadam', 'regressor__regressor__optimizer__learning_rate': 0.00015863304715174194, 'regressor__regressor__model__init_mode': 'glorot_normal', 'regressor__regressor__model__activation': 'elu', 'regressor__regressor__model__dropout_rate': 0.029665863202665177, 'regressor__regressor__model__weight_constraint': 3.721952579131106, 'regressor__regressor__model__regu_L1': 1.3412395863267023e-06, 'regressor__regressor__model__regu_L2': 5.659930998944048e-06, 'regressor__regressor__model__n_layers': 7, 'regressor__regressor__model__n_units': 361, 'regressor__regressor__loss': 'mean_absolute_error'}. Best is trial 199 with value: 0.7759054127864374.[0m
2022-12-30 16:14:46.284879: W tensorflow/compiler/xla/stream_executor/platform/default/dso_loader.cc:64] Could not load dynamic library 'libcudart.so.11.0'; dlerror: libcudart.so.11.0: cannot open shared object file: No such file or directory; LD_LIBRARY_PATH: /.singularity.d/libs
2022-12-30 16:14:47.453162: W tensorflow/compiler/xla/stream_executor/platform/default/dso_loader.cc:64] Could not load dynamic library 'libnvinfer.so.7'; dlerror: libnvinfer.so.7: cannot open shared object file: No such file or directory; LD_LIBRARY_PATH: /.singularity.d/libs
2022-12-30 16:14:47.453306: W tensorflow/compiler/xla/stream_executor/platform/default/dso_loader.cc:64] Could not load dynamic library 'libnvinfer_plugin.so.7'; dlerror: libnvinfer_plugin.so.7: cannot open shared object file: No such file or directory; LD_LIBRARY_PATH: /.singularity.d/libs
2022-12-30 16:14:47.453344: W tensorflow/compiler/tf2tensorrt/utils/py_utils.cc:38] TF-TRT Warning: Cannot dlopen some TensorRT libraries. If you would like to use Nvidia GPU with TensorRT, please make sure the missing libraries mentioned above are installed properly.
2022-12-30 16:14:49.157628: W tensorflow/compiler/xla/stream_executor/platform/default/dso_loader.cc:64] Could not load dynamic library 'libcuda.so.1'; dlerror: libcuda.so.1: cannot open shared object file: No such file or directory; LD_LIBRARY_PATH: /.singularity.d/libs
2022-12-30 16:14:49.157726: W tensorflow/compiler/xla/stream_executor/cuda/cuda_driver.cc:265] failed call to cuInit: UNKNOWN ERROR (303)
[32m[I 2022-12-30 18:04:05,327][0m Trial 239 finished with value: 0.777033467707341 and parameters: {'regressor__regressor__batch_size': 20, 'regressor__regressor__epochs': 370, 'regressor__regressor__optimizer': 'Nadam', 'regressor__regressor__optimizer__learning_rate': 0.00015546796771747035, 'regressor__regressor__model__init_mode': 'glorot_normal', 'regressor__regressor__model__activation': 'elu', 'regressor__regressor__model__dropout_rate': 0.034308163964742094, 'regressor__regressor__model__weight_constraint': 3.7391574017653646, 'regressor__regressor__model__regu_L1': 1.3345492634353006e-06, 'regressor__regressor__model__regu_L2': 4.981423957475293e-06, 'regressor__regressor__model__n_layers': 7, 'regressor__regressor__model__n_units': 361, 'regressor__regressor__loss': 'mean_absolute_error'}. Best is trial 239 with value: 0.777033467707341.[0m
2022-12-30 18:04:10.536141: W tensorflow/compiler/xla/stream_executor/platform/default/dso_loader.cc:64] Could not load dynamic library 'libcudart.so.11.0'; dlerror: libcudart.so.11.0: cannot open shared object file: No such file or directory; LD_LIBRARY_PATH: /.singularity.d/libs
2022-12-30 18:04:12.049958: W tensorflow/compiler/xla/stream_executor/platform/default/dso_loader.cc:64] Could not load dynamic library 'libnvinfer.so.7'; dlerror: libnvinfer.so.7: cannot open shared object file: No such file or directory; LD_LIBRARY_PATH: /.singularity.d/libs
2022-12-30 18:04:12.050094: W tensorflow/compiler/xla/stream_executor/platform/default/dso_loader.cc:64] Could not load dynamic library 'libnvinfer_plugin.so.7'; dlerror: libnvinfer_plugin.so.7: cannot open shared object file: No such file or directory; LD_LIBRARY_PATH: /.singularity.d/libs
2022-12-30 18:04:12.050127: W tensorflow/compiler/tf2tensorrt/utils/py_utils.cc:38] TF-TRT Warning: Cannot dlopen some TensorRT libraries. If you would like to use Nvidia GPU with TensorRT, please make sure the missing libraries mentioned above are installed properly.
2022-12-30 18:04:14.123541: W tensorflow/compiler/xla/stream_executor/platform/default/dso_loader.cc:64] Could not load dynamic library 'libcuda.so.1'; dlerror: libcuda.so.1: cannot open shared object file: No such file or directory; LD_LIBRARY_PATH: /.singularity.d/libs
2022-12-30 18:04:14.123667: W tensorflow/compiler/xla/stream_executor/cuda/cuda_driver.cc:265] failed call to cuInit: UNKNOWN ERROR (303)
[32m[I 2022-12-30 19:11:11,600][0m Trial 240 finished with value: 0.7650941588677787 and parameters: {'regressor__regressor__batch_size': 20, 'regressor__regressor__epochs': 370, 'regressor__regressor__optimizer': 'Nadam', 'regressor__regressor__optimizer__learning_rate': 0.00016056731223820195, 'regressor__regressor__model__init_mode': 'glorot_normal', 'regressor__regressor__model__activation': 'elu', 'regressor__regressor__model__dropout_rate': 0.033357776129201995, 'regressor__regressor__model__weight_constraint': 3.740967615285038, 'regressor__regressor__model__regu_L1': 1.6167600417675462e-06, 'regressor__regressor__model__regu_L2': 1.924258780324156e-05, 'regressor__regressor__model__n_layers': 7, 'regressor__regressor__model__n_units': 421, 'regressor__regressor__loss': 'mean_absolute_error'}. Best is trial 239 with value: 0.777033467707341.[0m
2022-12-30 19:11:16.108018: W tensorflow/compiler/xla/stream_executor/platform/default/dso_loader.cc:64] Could not load dynamic library 'libcudart.so.11.0'; dlerror: libcudart.so.11.0: cannot open shared object file: No such file or directory; LD_LIBRARY_PATH: /.singularity.d/libs
2022-12-30 19:11:17.347021: W tensorflow/compiler/xla/stream_executor/platform/default/dso_loader.cc:64] Could not load dynamic library 'libnvinfer.so.7'; dlerror: libnvinfer.so.7: cannot open shared object file: No such file or directory; LD_LIBRARY_PATH: /.singularity.d/libs
2022-12-30 19:11:17.347215: W tensorflow/compiler/xla/stream_executor/platform/default/dso_loader.cc:64] Could not load dynamic library 'libnvinfer_plugin.so.7'; dlerror: libnvinfer_plugin.so.7: cannot open shared object file: No such file or directory; LD_LIBRARY_PATH: /.singularity.d/libs
2022-12-30 19:11:17.347252: W tensorflow/compiler/tf2tensorrt/utils/py_utils.cc:38] TF-TRT Warning: Cannot dlopen some TensorRT libraries. If you would like to use Nvidia GPU with TensorRT, please make sure the missing libraries mentioned above are installed properly.
2022-12-30 19:11:18.986197: W tensorflow/compiler/xla/stream_executor/platform/default/dso_loader.cc:64] Could not load dynamic library 'libcuda.so.1'; dlerror: libcuda.so.1: cannot open shared object file: No such file or directory; LD_LIBRARY_PATH: /.singularity.d/libs
2022-12-30 19:11:18.986306: W tensorflow/compiler/xla/stream_executor/cuda/cuda_driver.cc:265] failed call to cuInit: UNKNOWN ERROR (303)
[32m[I 2022-12-30 21:52:24,017][0m Trial 241 finished with value: 0.7715705159936407 and parameters: {'regressor__regressor__batch_size': 20, 'regressor__regressor__epochs': 390, 'regressor__regressor__optimizer': 'Nadam', 'regressor__regressor__optimizer__learning_rate': 0.00015601072654665993, 'regressor__regressor__model__init_mode': 'glorot_normal', 'regressor__regressor__model__activation': 'elu', 'regressor__regressor__model__dropout_rate': 0.03643728005799543, 'regressor__regressor__model__weight_constraint': 3.70845241429127, 'regressor__regressor__model__regu_L1': 1.279064762555425e-06, 'regressor__regressor__model__regu_L2': 2.1231754511880468e-05, 'regressor__regressor__model__n_layers': 7, 'regressor__regressor__model__n_units': 361, 'regressor__regressor__loss': 'mean_absolute_error'}. Best is trial 239 with value: 0.777033467707341.[0m
2022-12-30 21:52:28.354562: W tensorflow/compiler/xla/stream_executor/platform/default/dso_loader.cc:64] Could not load dynamic library 'libcudart.so.11.0'; dlerror: libcudart.so.11.0: cannot open shared object file: No such file or directory; LD_LIBRARY_PATH: /.singularity.d/libs
2022-12-30 21:52:29.440325: W tensorflow/compiler/xla/stream_executor/platform/default/dso_loader.cc:64] Could not load dynamic library 'libnvinfer.so.7'; dlerror: libnvinfer.so.7: cannot open shared object file: No such file or directory; LD_LIBRARY_PATH: /.singularity.d/libs
2022-12-30 21:52:29.440441: W tensorflow/compiler/xla/stream_executor/platform/default/dso_loader.cc:64] Could not load dynamic library 'libnvinfer_plugin.so.7'; dlerror: libnvinfer_plugin.so.7: cannot open shared object file: No such file or directory; LD_LIBRARY_PATH: /.singularity.d/libs
2022-12-30 21:52:29.440468: W tensorflow/compiler/tf2tensorrt/utils/py_utils.cc:38] TF-TRT Warning: Cannot dlopen some TensorRT libraries. If you would like to use Nvidia GPU with TensorRT, please make sure the missing libraries mentioned above are installed properly.
2022-12-30 21:52:31.152537: W tensorflow/compiler/xla/stream_executor/platform/default/dso_loader.cc:64] Could not load dynamic library 'libcuda.so.1'; dlerror: libcuda.so.1: cannot open shared object file: No such file or directory; LD_LIBRARY_PATH: /.singularity.d/libs
2022-12-30 21:52:31.152682: W tensorflow/compiler/xla/stream_executor/cuda/cuda_driver.cc:265] failed call to cuInit: UNKNOWN ERROR (303)
[32m[I 2022-12-30 21:56:16,566][0m Trial 242 finished with value: 0.7717543595560339 and parameters: {'regressor__regressor__batch_size': 20, 'regressor__regressor__epochs': 370, 'regressor__regressor__optimizer': 'Nadam', 'regressor__regressor__optimizer__learning_rate': 0.00016471120654970413, 'regressor__regressor__model__init_mode': 'glorot_normal', 'regressor__regressor__model__activation': 'elu', 'regressor__regressor__model__dropout_rate': 0.03247290389623185, 'regressor__regressor__model__weight_constraint': 3.7110208900237156, 'regressor__regressor__model__regu_L1': 1.8163399020007492e-06, 'regressor__regressor__model__regu_L2': 1.6937096776910386e-05, 'regressor__regressor__model__n_layers': 7, 'regressor__regressor__model__n_units': 361, 'regressor__regressor__loss': 'mean_absolute_error'}. Best is trial 239 with value: 0.777033467707341.[0m
2022-12-30 21:56:20.890696: W tensorflow/compiler/xla/stream_executor/platform/default/dso_loader.cc:64] Could not load dynamic library 'libcudart.so.11.0'; dlerror: libcudart.so.11.0: cannot open shared object file: No such file or directory; LD_LIBRARY_PATH: /.singularity.d/libs
2022-12-30 21:56:22.373604: W tensorflow/compiler/xla/stream_executor/platform/default/dso_loader.cc:64] Could not load dynamic library 'libnvinfer.so.7'; dlerror: libnvinfer.so.7: cannot open shared object file: No such file or directory; LD_LIBRARY_PATH: /.singularity.d/libs
2022-12-30 21:56:22.373743: W tensorflow/compiler/xla/stream_executor/platform/default/dso_loader.cc:64] Could not load dynamic library 'libnvinfer_plugin.so.7'; dlerror: libnvinfer_plugin.so.7: cannot open shared object file: No such file or directory; LD_LIBRARY_PATH: /.singularity.d/libs
2022-12-30 21:56:22.373779: W tensorflow/compiler/tf2tensorrt/utils/py_utils.cc:38] TF-TRT Warning: Cannot dlopen some TensorRT libraries. If you would like to use Nvidia GPU with TensorRT, please make sure the missing libraries mentioned above are installed properly.
2022-12-30 21:56:24.473818: W tensorflow/compiler/xla/stream_executor/platform/default/dso_loader.cc:64] Could not load dynamic library 'libcuda.so.1'; dlerror: libcuda.so.1: cannot open shared object file: No such file or directory; LD_LIBRARY_PATH: /.singularity.d/libs
2022-12-30 21:56:24.473980: W tensorflow/compiler/xla/stream_executor/cuda/cuda_driver.cc:265] failed call to cuInit: UNKNOWN ERROR (303)
