[32m[I 2022-12-25 04:01:47,099][0m Trial 118 finished with value: 0.49870229451446085 and parameters: {'regressor__regressor__batch_size': 210, 'regressor__regressor__epochs': 270, 'regressor__regressor__optimizer': 'Adam', 'regressor__regressor__optimizer__learning_rate': 0.00030584620354877156, 'regressor__regressor__model__init_mode': 'glorot_uniform', 'regressor__regressor__model__activation': 'selu', 'regressor__regressor__model__dropout_rate': 0.19933493761015847, 'regressor__regressor__model__weight_constraint': 3.7426272010342005, 'regressor__regressor__model__regu_L1': 9.999842894710562e-07, 'regressor__regressor__model__regu_L2': 0.00015023565493162364, 'regressor__regressor__model__n_layers': 15, 'regressor__regressor__model__n_units': 161, 'regressor__regressor__loss': 'huber'}. Best is trial 15 with value: 0.713745100510843.[0m
/usr/local/lib/python3.9/dist-packages/sklearn/model_selection/_validation.py:776: UserWarning: Scoring failed. The score on this train-test partition for these parameters will be set to nan. Details: 
Traceback (most recent call last):
  File "/usr/local/lib/python3.9/dist-packages/sklearn/model_selection/_validation.py", line 767, in _score
    scores = scorer(estimator, X_test, y_test)
  File "/usr/local/lib/python3.9/dist-packages/sklearn/metrics/_scorer.py", line 107, in __call__
    score = scorer._score(cached_call, estimator, *args, **kwargs)
  File "/usr/local/lib/python3.9/dist-packages/sklearn/metrics/_scorer.py", line 268, in _score
    return self._sign * self._score_func(y_true, y_pred, **self._kwargs)
  File "/usr/local/lib/python3.9/dist-packages/sklearn/metrics/_regression.py", line 911, in r2_score
    y_type, y_true, y_pred, multioutput = _check_reg_targets(
  File "/usr/local/lib/python3.9/dist-packages/sklearn/metrics/_regression.py", line 102, in _check_reg_targets
    y_pred = check_array(y_pred, ensure_2d=False, dtype=dtype)
  File "/usr/local/lib/python3.9/dist-packages/sklearn/utils/validation.py", line 919, in check_array
    _assert_all_finite(
  File "/usr/local/lib/python3.9/dist-packages/sklearn/utils/validation.py", line 161, in _assert_all_finite
    raise ValueError(msg_err)
ValueError: Input contains NaN.

  warnings.warn(
[33m[W 2022-12-25 04:04:29,260][0m Trial 114 failed because of the following error: The value nan is not acceptable.[0m
2022-12-25 04:04:36.490231: W tensorflow/compiler/xla/stream_executor/platform/default/dso_loader.cc:64] Could not load dynamic library 'libcudart.so.11.0'; dlerror: libcudart.so.11.0: cannot open shared object file: No such file or directory; LD_LIBRARY_PATH: /.singularity.d/libs
2022-12-25 04:04:37.412299: W tensorflow/compiler/xla/stream_executor/platform/default/dso_loader.cc:64] Could not load dynamic library 'libnvinfer.so.7'; dlerror: libnvinfer.so.7: cannot open shared object file: No such file or directory; LD_LIBRARY_PATH: /.singularity.d/libs
2022-12-25 04:04:37.412551: W tensorflow/compiler/xla/stream_executor/platform/default/dso_loader.cc:64] Could not load dynamic library 'libnvinfer_plugin.so.7'; dlerror: libnvinfer_plugin.so.7: cannot open shared object file: No such file or directory; LD_LIBRARY_PATH: /.singularity.d/libs
2022-12-25 04:04:37.412572: W tensorflow/compiler/tf2tensorrt/utils/py_utils.cc:38] TF-TRT Warning: Cannot dlopen some TensorRT libraries. If you would like to use Nvidia GPU with TensorRT, please make sure the missing libraries mentioned above are installed properly.
2022-12-25 04:04:38.891575: W tensorflow/compiler/xla/stream_executor/platform/default/dso_loader.cc:64] Could not load dynamic library 'libcuda.so.1'; dlerror: libcuda.so.1: cannot open shared object file: No such file or directory; LD_LIBRARY_PATH: /.singularity.d/libs
2022-12-25 04:04:38.891681: W tensorflow/compiler/xla/stream_executor/cuda/cuda_driver.cc:265] failed call to cuInit: UNKNOWN ERROR (303)
[32m[I 2022-12-25 04:08:37,455][0m Trial 120 finished with value: 0.47523721951744397 and parameters: {'regressor__regressor__batch_size': 200, 'regressor__regressor__epochs': 270, 'regressor__regressor__optimizer': 'Adam', 'regressor__regressor__optimizer__learning_rate': 7.449573796635248e-05, 'regressor__regressor__model__init_mode': 'glorot_uniform', 'regressor__regressor__model__activation': 'selu', 'regressor__regressor__model__dropout_rate': 0.1500984506932456, 'regressor__regressor__model__weight_constraint': 3.7080803220111727, 'regressor__regressor__model__regu_L1': 1.1228626372170346e-06, 'regressor__regressor__model__regu_L2': 0.00015007105975665608, 'regressor__regressor__model__n_layers': 15, 'regressor__regressor__model__n_units': 161, 'regressor__regressor__loss': 'huber'}. Best is trial 15 with value: 0.713745100510843.[0m
[32m[I 2022-12-25 04:57:14,318][0m Trial 119 finished with value: 0.5095783520370841 and parameters: {'regressor__regressor__batch_size': 20, 'regressor__regressor__epochs': 270, 'regressor__regressor__optimizer': 'Adam', 'regressor__regressor__optimizer__learning_rate': 8.101569815537799e-05, 'regressor__regressor__model__init_mode': 'glorot_uniform', 'regressor__regressor__model__activation': 'selu', 'regressor__regressor__model__dropout_rate': 0.18839129046166525, 'regressor__regressor__model__weight_constraint': 5.5190496584020545, 'regressor__regressor__model__regu_L1': 1.5545875123917692e-07, 'regressor__regressor__model__regu_L2': 0.00014590379628437163, 'regressor__regressor__model__n_layers': 15, 'regressor__regressor__model__n_units': 161, 'regressor__regressor__loss': 'huber'}. Best is trial 15 with value: 0.713745100510843.[0m
[32m[I 2022-12-25 05:12:24,401][0m Trial 121 finished with value: 0.5054449287330018 and parameters: {'regressor__regressor__batch_size': 20, 'regressor__regressor__epochs': 190, 'regressor__regressor__optimizer': 'Adam', 'regressor__regressor__optimizer__learning_rate': 7.666667782587171e-05, 'regressor__regressor__model__init_mode': 'variance_scaling', 'regressor__regressor__model__activation': 'selu', 'regressor__regressor__model__dropout_rate': 0.14396724215450074, 'regressor__regressor__model__weight_constraint': 1.4423135044736561, 'regressor__regressor__model__regu_L1': 5.312056537413743e-07, 'regressor__regressor__model__regu_L2': 0.000327079458880582, 'regressor__regressor__model__n_layers': 15, 'regressor__regressor__model__n_units': 181, 'regressor__regressor__loss': 'huber'}. Best is trial 15 with value: 0.713745100510843.[0m
2022-12-25 05:12:33.536838: W tensorflow/compiler/xla/stream_executor/platform/default/dso_loader.cc:64] Could not load dynamic library 'libcudart.so.11.0'; dlerror: libcudart.so.11.0: cannot open shared object file: No such file or directory; LD_LIBRARY_PATH: /.singularity.d/libs
2022-12-25 05:12:35.119600: W tensorflow/compiler/xla/stream_executor/platform/default/dso_loader.cc:64] Could not load dynamic library 'libnvinfer.so.7'; dlerror: libnvinfer.so.7: cannot open shared object file: No such file or directory; LD_LIBRARY_PATH: /.singularity.d/libs
2022-12-25 05:12:35.119754: W tensorflow/compiler/xla/stream_executor/platform/default/dso_loader.cc:64] Could not load dynamic library 'libnvinfer_plugin.so.7'; dlerror: libnvinfer_plugin.so.7: cannot open shared object file: No such file or directory; LD_LIBRARY_PATH: /.singularity.d/libs
2022-12-25 05:12:35.119778: W tensorflow/compiler/tf2tensorrt/utils/py_utils.cc:38] TF-TRT Warning: Cannot dlopen some TensorRT libraries. If you would like to use Nvidia GPU with TensorRT, please make sure the missing libraries mentioned above are installed properly.
2022-12-25 05:12:37.603745: W tensorflow/compiler/xla/stream_executor/platform/default/dso_loader.cc:64] Could not load dynamic library 'libcuda.so.1'; dlerror: libcuda.so.1: cannot open shared object file: No such file or directory; LD_LIBRARY_PATH: /.singularity.d/libs
2022-12-25 05:12:37.603995: W tensorflow/compiler/xla/stream_executor/cuda/cuda_driver.cc:265] failed call to cuInit: UNKNOWN ERROR (303)
[32m[I 2022-12-25 05:19:54,519][0m Trial 123 finished with value: 0.5695106022569364 and parameters: {'regressor__regressor__batch_size': 20, 'regressor__regressor__epochs': 190, 'regressor__regressor__optimizer': 'Adam', 'regressor__regressor__optimizer__learning_rate': 0.00011698014125859451, 'regressor__regressor__model__init_mode': 'lecun_uniform', 'regressor__regressor__model__activation': 'selu', 'regressor__regressor__model__dropout_rate': 0.17556385495234805, 'regressor__regressor__model__weight_constraint': 5.486811822075125, 'regressor__regressor__model__regu_L1': 6.29952451099667e-07, 'regressor__regressor__model__regu_L2': 6.909906709712768e-05, 'regressor__regressor__model__n_layers': 15, 'regressor__regressor__model__n_units': 181, 'regressor__regressor__loss': 'log_cosh'}. Best is trial 15 with value: 0.713745100510843.[0m
[32m[I 2022-12-25 05:56:04,614][0m Trial 122 finished with value: 0.5864364727387679 and parameters: {'regressor__regressor__batch_size': 20, 'regressor__regressor__epochs': 270, 'regressor__regressor__optimizer': 'Adam', 'regressor__regressor__optimizer__learning_rate': 0.00012262719688899877, 'regressor__regressor__model__init_mode': 'variance_scaling', 'regressor__regressor__model__activation': 'selu', 'regressor__regressor__model__dropout_rate': 0.17836634291730957, 'regressor__regressor__model__weight_constraint': 2.0978300515368775, 'regressor__regressor__model__regu_L1': 1.4513986584438174e-07, 'regressor__regressor__model__regu_L2': 6.865704905739869e-05, 'regressor__regressor__model__n_layers': 15, 'regressor__regressor__model__n_units': 181, 'regressor__regressor__loss': 'log_cosh'}. Best is trial 15 with value: 0.713745100510843.[0m
[32m[I 2022-12-25 07:13:28,085][0m Trial 115 finished with value: -0.000993060610164509 and parameters: {'regressor__regressor__batch_size': 20, 'regressor__regressor__epochs': 290, 'regressor__regressor__optimizer': 'Ftrl', 'regressor__regressor__optimizer__learning_rate': 0.0001968818646916948, 'regressor__regressor__model__init_mode': 'constant', 'regressor__regressor__model__activation': 'exponential', 'regressor__regressor__model__dropout_rate': 0.08721695026866914, 'regressor__regressor__model__weight_constraint': 5.554320483045599, 'regressor__regressor__model__regu_L1': 7.306821532453962e-05, 'regressor__regressor__model__regu_L2': 9.532935715257686e-07, 'regressor__regressor__model__n_layers': 9, 'regressor__regressor__model__n_units': 481, 'regressor__regressor__loss': 'mse'}. Best is trial 15 with value: 0.713745100510843.[0m
2022-12-25 07:13:35.499923: W tensorflow/compiler/xla/stream_executor/platform/default/dso_loader.cc:64] Could not load dynamic library 'libcudart.so.11.0'; dlerror: libcudart.so.11.0: cannot open shared object file: No such file or directory; LD_LIBRARY_PATH: /.singularity.d/libs
2022-12-25 07:13:37.245042: W tensorflow/compiler/xla/stream_executor/platform/default/dso_loader.cc:64] Could not load dynamic library 'libnvinfer.so.7'; dlerror: libnvinfer.so.7: cannot open shared object file: No such file or directory; LD_LIBRARY_PATH: /.singularity.d/libs
2022-12-25 07:13:37.248907: W tensorflow/compiler/xla/stream_executor/platform/default/dso_loader.cc:64] Could not load dynamic library 'libnvinfer_plugin.so.7'; dlerror: libnvinfer_plugin.so.7: cannot open shared object file: No such file or directory; LD_LIBRARY_PATH: /.singularity.d/libs
2022-12-25 07:13:37.250568: W tensorflow/compiler/tf2tensorrt/utils/py_utils.cc:38] TF-TRT Warning: Cannot dlopen some TensorRT libraries. If you would like to use Nvidia GPU with TensorRT, please make sure the missing libraries mentioned above are installed properly.
2022-12-25 07:13:39.133865: W tensorflow/compiler/xla/stream_executor/platform/default/dso_loader.cc:64] Could not load dynamic library 'libcuda.so.1'; dlerror: libcuda.so.1: cannot open shared object file: No such file or directory; LD_LIBRARY_PATH: /.singularity.d/libs
2022-12-25 07:13:39.134014: W tensorflow/compiler/xla/stream_executor/cuda/cuda_driver.cc:265] failed call to cuInit: UNKNOWN ERROR (303)
[32m[I 2022-12-25 07:26:48,302][0m Trial 124 finished with value: 0.6354483154108024 and parameters: {'regressor__regressor__batch_size': 40, 'regressor__regressor__epochs': 170, 'regressor__regressor__optimizer': 'Adam', 'regressor__regressor__optimizer__learning_rate': 0.00011880980443889041, 'regressor__regressor__model__init_mode': 'variance_scaling', 'regressor__regressor__model__activation': 'selu', 'regressor__regressor__model__dropout_rate': 0.17511068173939587, 'regressor__regressor__model__weight_constraint': 1.4707262501049647, 'regressor__regressor__model__regu_L1': 6.455423899096393e-07, 'regressor__regressor__model__regu_L2': 2.1392310647330086e-06, 'regressor__regressor__model__n_layers': 13, 'regressor__regressor__model__n_units': 481, 'regressor__regressor__loss': 'log_cosh'}. Best is trial 15 with value: 0.713745100510843.[0m
[32m[I 2022-12-25 08:09:41,437][0m Trial 128 finished with value: 0.6043559746514546 and parameters: {'regressor__regressor__batch_size': 40, 'regressor__regressor__epochs': 170, 'regressor__regressor__optimizer': 'Adam', 'regressor__regressor__optimizer__learning_rate': 0.00012445629021704959, 'regressor__regressor__model__init_mode': 'variance_scaling', 'regressor__regressor__model__activation': 'LeakyReLU', 'regressor__regressor__model__dropout_rate': 0.025080481927997472, 'regressor__regressor__model__weight_constraint': 3.4171853816437054, 'regressor__regressor__model__regu_L1': 7.304247978505148e-07, 'regressor__regressor__model__regu_L2': 3.7267041118852e-05, 'regressor__regressor__model__n_layers': 13, 'regressor__regressor__model__n_units': 221, 'regressor__regressor__loss': 'log_cosh'}. Best is trial 15 with value: 0.713745100510843.[0m
[32m[I 2022-12-25 08:56:30,589][0m Trial 130 finished with value: 0.6232433576933207 and parameters: {'regressor__regressor__batch_size': 50, 'regressor__regressor__epochs': 170, 'regressor__regressor__optimizer': 'Adam', 'regressor__regressor__optimizer__learning_rate': 0.00013596544067677222, 'regressor__regressor__model__init_mode': 'variance_scaling', 'regressor__regressor__model__activation': 'LeakyReLU', 'regressor__regressor__model__dropout_rate': 0.025421001707895904, 'regressor__regressor__model__weight_constraint': 2.779717438774394, 'regressor__regressor__model__regu_L1': 2.739103744604612e-07, 'regressor__regressor__model__regu_L2': 1.8214390911673081e-06, 'regressor__regressor__model__n_layers': 11, 'regressor__regressor__model__n_units': 241, 'regressor__regressor__loss': 'log_cosh'}. Best is trial 15 with value: 0.713745100510843.[0m
[32m[I 2022-12-25 09:41:27,666][0m Trial 131 finished with value: 0.6158809896328853 and parameters: {'regressor__regressor__batch_size': 50, 'regressor__regressor__epochs': 170, 'regressor__regressor__optimizer': 'Adam', 'regressor__regressor__optimizer__learning_rate': 0.00011458679111910438, 'regressor__regressor__model__init_mode': 'variance_scaling', 'regressor__regressor__model__activation': 'LeakyReLU', 'regressor__regressor__model__dropout_rate': 0.024588386778546575, 'regressor__regressor__model__weight_constraint': 3.4313652332415616, 'regressor__regressor__model__regu_L1': 2.7681803536956564e-07, 'regressor__regressor__model__regu_L2': 2.3052710310270176e-06, 'regressor__regressor__model__n_layers': 11, 'regressor__regressor__model__n_units': 241, 'regressor__regressor__loss': 'log_cosh'}. Best is trial 15 with value: 0.713745100510843.[0m
[32m[I 2022-12-25 10:29:19,079][0m Trial 132 finished with value: 0.6216769715154369 and parameters: {'regressor__regressor__batch_size': 50, 'regressor__regressor__epochs': 170, 'regressor__regressor__optimizer': 'Adam', 'regressor__regressor__optimizer__learning_rate': 0.00011712361415032646, 'regressor__regressor__model__init_mode': 'variance_scaling', 'regressor__regressor__model__activation': 'LeakyReLU', 'regressor__regressor__model__dropout_rate': 0.03631504532968344, 'regressor__regressor__model__weight_constraint': 2.792723065364235, 'regressor__regressor__model__regu_L1': 3.031178190940095e-07, 'regressor__regressor__model__regu_L2': 2.0067853297434053e-06, 'regressor__regressor__model__n_layers': 11, 'regressor__regressor__model__n_units': 241, 'regressor__regressor__loss': 'log_cosh'}. Best is trial 15 with value: 0.713745100510843.[0m
[32m[I 2022-12-25 11:14:02,864][0m Trial 133 finished with value: 0.600435661520724 and parameters: {'regressor__regressor__batch_size': 50, 'regressor__regressor__epochs': 170, 'regressor__regressor__optimizer': 'Adam', 'regressor__regressor__optimizer__learning_rate': 5.9765249717582334e-05, 'regressor__regressor__model__init_mode': 'variance_scaling', 'regressor__regressor__model__activation': 'LeakyReLU', 'regressor__regressor__model__dropout_rate': 0.02416571006376461, 'regressor__regressor__model__weight_constraint': 3.4076174276739652, 'regressor__regressor__model__regu_L1': 2.6963879732714165e-07, 'regressor__regressor__model__regu_L2': 2.1941297571220775e-06, 'regressor__regressor__model__n_layers': 11, 'regressor__regressor__model__n_units': 241, 'regressor__regressor__loss': 'log_cosh'}. Best is trial 15 with value: 0.713745100510843.[0m
[32m[I 2022-12-25 12:01:14,517][0m Trial 134 finished with value: 0.5846507531844258 and parameters: {'regressor__regressor__batch_size': 50, 'regressor__regressor__epochs': 170, 'regressor__regressor__optimizer': 'Adam', 'regressor__regressor__optimizer__learning_rate': 3.6185612091833565e-05, 'regressor__regressor__model__init_mode': 'variance_scaling', 'regressor__regressor__model__activation': 'LeakyReLU', 'regressor__regressor__model__dropout_rate': 0.02368857946557799, 'regressor__regressor__model__weight_constraint': 3.297805009990622, 'regressor__regressor__model__regu_L1': 1.4176366248090223e-07, 'regressor__regressor__model__regu_L2': 2.1868800717718355e-06, 'regressor__regressor__model__n_layers': 11, 'regressor__regressor__model__n_units': 241, 'regressor__regressor__loss': 'log_cosh'}. Best is trial 15 with value: 0.713745100510843.[0m
[32m[I 2022-12-25 12:02:44,248][0m Trial 127 finished with value: 0.607363117913829 and parameters: {'regressor__regressor__batch_size': 20, 'regressor__regressor__epochs': 610, 'regressor__regressor__optimizer': 'Adam', 'regressor__regressor__optimizer__learning_rate': 0.00012047734421086193, 'regressor__regressor__model__init_mode': 'variance_scaling', 'regressor__regressor__model__activation': 'LeakyReLU', 'regressor__regressor__model__dropout_rate': 0.2662335480151984, 'regressor__regressor__model__weight_constraint': 5.997139633209916, 'regressor__regressor__model__regu_L1': 5.954788283631003e-07, 'regressor__regressor__model__regu_L2': 2.114896190441037e-06, 'regressor__regressor__model__n_layers': 13, 'regressor__regressor__model__n_units': 241, 'regressor__regressor__loss': 'log_cosh'}. Best is trial 15 with value: 0.713745100510843.[0m
[32m[I 2022-12-25 12:39:39,024][0m Trial 135 finished with value: 0.5895896181195085 and parameters: {'regressor__regressor__batch_size': 70, 'regressor__regressor__epochs': 110, 'regressor__regressor__optimizer': 'Adam', 'regressor__regressor__optimizer__learning_rate': 3.72900763764058e-05, 'regressor__regressor__model__init_mode': 'variance_scaling', 'regressor__regressor__model__activation': 'LeakyReLU', 'regressor__regressor__model__dropout_rate': 0.02675213674439362, 'regressor__regressor__model__weight_constraint': 3.3215608794837745, 'regressor__regressor__model__regu_L1': 2.876494173053512e-07, 'regressor__regressor__model__regu_L2': 2.466642160553541e-06, 'regressor__regressor__model__n_layers': 11, 'regressor__regressor__model__n_units': 301, 'regressor__regressor__loss': 'log_cosh'}. Best is trial 15 with value: 0.713745100510843.[0m
