[32m[I 2022-12-30 22:10:45,416][0m Trial 243 finished with value: 0.7687883126582195 and parameters: {'regressor__regressor__batch_size': 20, 'regressor__regressor__epochs': 370, 'regressor__regressor__optimizer': 'Nadam', 'regressor__regressor__optimizer__learning_rate': 0.00016489940430893373, 'regressor__regressor__model__init_mode': 'glorot_normal', 'regressor__regressor__model__activation': 'elu', 'regressor__regressor__model__dropout_rate': 0.03288006859810157, 'regressor__regressor__model__weight_constraint': 3.7015607707321747, 'regressor__regressor__model__regu_L1': 1.3878677661451715e-06, 'regressor__regressor__model__regu_L2': 1.94332877131111e-05, 'regressor__regressor__model__n_layers': 7, 'regressor__regressor__model__n_units': 361, 'regressor__regressor__loss': 'mean_absolute_error'}. Best is trial 239 with value: 0.777033467707341.[0m
2022-12-30 22:10:50.000835: W tensorflow/compiler/xla/stream_executor/platform/default/dso_loader.cc:64] Could not load dynamic library 'libcudart.so.11.0'; dlerror: libcudart.so.11.0: cannot open shared object file: No such file or directory; LD_LIBRARY_PATH: /.singularity.d/libs
2022-12-30 22:10:51.371013: W tensorflow/compiler/xla/stream_executor/platform/default/dso_loader.cc:64] Could not load dynamic library 'libnvinfer.so.7'; dlerror: libnvinfer.so.7: cannot open shared object file: No such file or directory; LD_LIBRARY_PATH: /.singularity.d/libs
2022-12-30 22:10:51.371152: W tensorflow/compiler/xla/stream_executor/platform/default/dso_loader.cc:64] Could not load dynamic library 'libnvinfer_plugin.so.7'; dlerror: libnvinfer_plugin.so.7: cannot open shared object file: No such file or directory; LD_LIBRARY_PATH: /.singularity.d/libs
2022-12-30 22:10:51.371176: W tensorflow/compiler/tf2tensorrt/utils/py_utils.cc:38] TF-TRT Warning: Cannot dlopen some TensorRT libraries. If you would like to use Nvidia GPU with TensorRT, please make sure the missing libraries mentioned above are installed properly.
2022-12-30 22:10:53.328506: W tensorflow/compiler/xla/stream_executor/platform/default/dso_loader.cc:64] Could not load dynamic library 'libcuda.so.1'; dlerror: libcuda.so.1: cannot open shared object file: No such file or directory; LD_LIBRARY_PATH: /.singularity.d/libs
2022-12-30 22:10:53.328618: W tensorflow/compiler/xla/stream_executor/cuda/cuda_driver.cc:265] failed call to cuInit: UNKNOWN ERROR (303)
[32m[I 2022-12-30 23:52:14,696][0m Trial 244 finished with value: 0.7673275162275657 and parameters: {'regressor__regressor__batch_size': 20, 'regressor__regressor__epochs': 370, 'regressor__regressor__optimizer': 'Nadam', 'regressor__regressor__optimizer__learning_rate': 0.00016225811927329066, 'regressor__regressor__model__init_mode': 'glorot_normal', 'regressor__regressor__model__activation': 'elu', 'regressor__regressor__model__dropout_rate': 0.03509407066967472, 'regressor__regressor__model__weight_constraint': 3.733388354009669, 'regressor__regressor__model__regu_L1': 1.8658199938280734e-06, 'regressor__regressor__model__regu_L2': 8.979755653929287e-06, 'regressor__regressor__model__n_layers': 7, 'regressor__regressor__model__n_units': 361, 'regressor__regressor__loss': 'mean_absolute_error'}. Best is trial 239 with value: 0.777033467707341.[0m
2022-12-30 23:52:18.909590: W tensorflow/compiler/xla/stream_executor/platform/default/dso_loader.cc:64] Could not load dynamic library 'libcudart.so.11.0'; dlerror: libcudart.so.11.0: cannot open shared object file: No such file or directory; LD_LIBRARY_PATH: /.singularity.d/libs
2022-12-30 23:52:20.538699: W tensorflow/compiler/xla/stream_executor/platform/default/dso_loader.cc:64] Could not load dynamic library 'libnvinfer.so.7'; dlerror: libnvinfer.so.7: cannot open shared object file: No such file or directory; LD_LIBRARY_PATH: /.singularity.d/libs
2022-12-30 23:52:20.538919: W tensorflow/compiler/xla/stream_executor/platform/default/dso_loader.cc:64] Could not load dynamic library 'libnvinfer_plugin.so.7'; dlerror: libnvinfer_plugin.so.7: cannot open shared object file: No such file or directory; LD_LIBRARY_PATH: /.singularity.d/libs
2022-12-30 23:52:20.538962: W tensorflow/compiler/tf2tensorrt/utils/py_utils.cc:38] TF-TRT Warning: Cannot dlopen some TensorRT libraries. If you would like to use Nvidia GPU with TensorRT, please make sure the missing libraries mentioned above are installed properly.
2022-12-30 23:52:22.955945: W tensorflow/compiler/xla/stream_executor/platform/default/dso_loader.cc:64] Could not load dynamic library 'libcuda.so.1'; dlerror: libcuda.so.1: cannot open shared object file: No such file or directory; LD_LIBRARY_PATH: /.singularity.d/libs
2022-12-30 23:52:22.956160: W tensorflow/compiler/xla/stream_executor/cuda/cuda_driver.cc:265] failed call to cuInit: UNKNOWN ERROR (303)
[32m[I 2022-12-31 01:16:35,486][0m Trial 245 finished with value: 0.7500157761937991 and parameters: {'regressor__regressor__batch_size': 20, 'regressor__regressor__epochs': 370, 'regressor__regressor__optimizer': 'Nadam', 'regressor__regressor__optimizer__learning_rate': 0.00020005136815996952, 'regressor__regressor__model__init_mode': 'glorot_normal', 'regressor__regressor__model__activation': 'elu', 'regressor__regressor__model__dropout_rate': 0.03695426900636744, 'regressor__regressor__model__weight_constraint': 3.7347426364222467, 'regressor__regressor__model__regu_L1': 1.8888302055941845e-06, 'regressor__regressor__model__regu_L2': 1.9118876266842753e-05, 'regressor__regressor__model__n_layers': 7, 'regressor__regressor__model__n_units': 421, 'regressor__regressor__loss': 'mean_absolute_error'}. Best is trial 239 with value: 0.777033467707341.[0m
2022-12-31 01:16:39.709457: W tensorflow/compiler/xla/stream_executor/platform/default/dso_loader.cc:64] Could not load dynamic library 'libcudart.so.11.0'; dlerror: libcudart.so.11.0: cannot open shared object file: No such file or directory; LD_LIBRARY_PATH: /.singularity.d/libs
2022-12-31 01:16:41.061604: W tensorflow/compiler/xla/stream_executor/platform/default/dso_loader.cc:64] Could not load dynamic library 'libnvinfer.so.7'; dlerror: libnvinfer.so.7: cannot open shared object file: No such file or directory; LD_LIBRARY_PATH: /.singularity.d/libs
2022-12-31 01:16:41.061848: W tensorflow/compiler/xla/stream_executor/platform/default/dso_loader.cc:64] Could not load dynamic library 'libnvinfer_plugin.so.7'; dlerror: libnvinfer_plugin.so.7: cannot open shared object file: No such file or directory; LD_LIBRARY_PATH: /.singularity.d/libs
2022-12-31 01:16:41.061891: W tensorflow/compiler/tf2tensorrt/utils/py_utils.cc:38] TF-TRT Warning: Cannot dlopen some TensorRT libraries. If you would like to use Nvidia GPU with TensorRT, please make sure the missing libraries mentioned above are installed properly.
2022-12-31 01:16:43.090948: W tensorflow/compiler/xla/stream_executor/platform/default/dso_loader.cc:64] Could not load dynamic library 'libcuda.so.1'; dlerror: libcuda.so.1: cannot open shared object file: No such file or directory; LD_LIBRARY_PATH: /.singularity.d/libs
2022-12-31 01:16:43.091068: W tensorflow/compiler/xla/stream_executor/cuda/cuda_driver.cc:265] failed call to cuInit: UNKNOWN ERROR (303)
[32m[I 2022-12-31 03:08:29,563][0m Trial 248 finished with value: 0.7667656842154887 and parameters: {'regressor__regressor__batch_size': 20, 'regressor__regressor__epochs': 370, 'regressor__regressor__optimizer': 'Nadam', 'regressor__regressor__optimizer__learning_rate': 0.00015681538408722834, 'regressor__regressor__model__init_mode': 'glorot_normal', 'regressor__regressor__model__activation': 'elu', 'regressor__regressor__model__dropout_rate': 0.036763797140105484, 'regressor__regressor__model__weight_constraint': 3.709392222626101, 'regressor__regressor__model__regu_L1': 2.042521643364328e-06, 'regressor__regressor__model__regu_L2': 2.2093228682540813e-05, 'regressor__regressor__model__n_layers': 7, 'regressor__regressor__model__n_units': 341, 'regressor__regressor__loss': 'mean_absolute_error'}. Best is trial 239 with value: 0.777033467707341.[0m
2022-12-31 03:08:32.961491: W tensorflow/compiler/xla/stream_executor/platform/default/dso_loader.cc:64] Could not load dynamic library 'libcudart.so.11.0'; dlerror: libcudart.so.11.0: cannot open shared object file: No such file or directory; LD_LIBRARY_PATH: /.singularity.d/libs
2022-12-31 03:08:33.814891: W tensorflow/compiler/xla/stream_executor/platform/default/dso_loader.cc:64] Could not load dynamic library 'libnvinfer.so.7'; dlerror: libnvinfer.so.7: cannot open shared object file: No such file or directory; LD_LIBRARY_PATH: /.singularity.d/libs
2022-12-31 03:08:33.815066: W tensorflow/compiler/xla/stream_executor/platform/default/dso_loader.cc:64] Could not load dynamic library 'libnvinfer_plugin.so.7'; dlerror: libnvinfer_plugin.so.7: cannot open shared object file: No such file or directory; LD_LIBRARY_PATH: /.singularity.d/libs
2022-12-31 03:08:33.815093: W tensorflow/compiler/tf2tensorrt/utils/py_utils.cc:38] TF-TRT Warning: Cannot dlopen some TensorRT libraries. If you would like to use Nvidia GPU with TensorRT, please make sure the missing libraries mentioned above are installed properly.
2022-12-31 03:08:34.881377: W tensorflow/compiler/xla/stream_executor/platform/default/dso_loader.cc:64] Could not load dynamic library 'libcuda.so.1'; dlerror: libcuda.so.1: cannot open shared object file: No such file or directory; LD_LIBRARY_PATH: /.singularity.d/libs
2022-12-31 03:08:34.881496: W tensorflow/compiler/xla/stream_executor/cuda/cuda_driver.cc:265] failed call to cuInit: UNKNOWN ERROR (303)
[32m[I 2022-12-31 03:10:07,466][0m Trial 247 finished with value: 0.7682952934896077 and parameters: {'regressor__regressor__batch_size': 20, 'regressor__regressor__epochs': 370, 'regressor__regressor__optimizer': 'Nadam', 'regressor__regressor__optimizer__learning_rate': 0.00015873892813019947, 'regressor__regressor__model__init_mode': 'glorot_normal', 'regressor__regressor__model__activation': 'elu', 'regressor__regressor__model__dropout_rate': 0.0352685844933534, 'regressor__regressor__model__weight_constraint': 3.73744150394865, 'regressor__regressor__model__regu_L1': 1.936144188235453e-06, 'regressor__regressor__model__regu_L2': 1.8068093094900184e-05, 'regressor__regressor__model__n_layers': 7, 'regressor__regressor__model__n_units': 361, 'regressor__regressor__loss': 'mean_absolute_error'}. Best is trial 239 with value: 0.777033467707341.[0m
[32m[I 2022-12-31 03:25:58,825][0m Trial 246 finished with value: 0.7672495420772499 and parameters: {'regressor__regressor__batch_size': 20, 'regressor__regressor__epochs': 370, 'regressor__regressor__optimizer': 'Nadam', 'regressor__regressor__optimizer__learning_rate': 0.00014966567609064739, 'regressor__regressor__model__init_mode': 'glorot_normal', 'regressor__regressor__model__activation': 'elu', 'regressor__regressor__model__dropout_rate': 0.03543258911470774, 'regressor__regressor__model__weight_constraint': 3.7134537144916826, 'regressor__regressor__model__regu_L1': 1.9598944251498076e-06, 'regressor__regressor__model__regu_L2': 1.9469922018483162e-05, 'regressor__regressor__model__n_layers': 7, 'regressor__regressor__model__n_units': 361, 'regressor__regressor__loss': 'mean_absolute_error'}. Best is trial 239 with value: 0.777033467707341.[0m
2022-12-31 03:26:03.174952: W tensorflow/compiler/xla/stream_executor/platform/default/dso_loader.cc:64] Could not load dynamic library 'libcudart.so.11.0'; dlerror: libcudart.so.11.0: cannot open shared object file: No such file or directory; LD_LIBRARY_PATH: /.singularity.d/libs
2022-12-31 03:26:04.331107: W tensorflow/compiler/xla/stream_executor/platform/default/dso_loader.cc:64] Could not load dynamic library 'libnvinfer.so.7'; dlerror: libnvinfer.so.7: cannot open shared object file: No such file or directory; LD_LIBRARY_PATH: /.singularity.d/libs
2022-12-31 03:26:04.331369: W tensorflow/compiler/xla/stream_executor/platform/default/dso_loader.cc:64] Could not load dynamic library 'libnvinfer_plugin.so.7'; dlerror: libnvinfer_plugin.so.7: cannot open shared object file: No such file or directory; LD_LIBRARY_PATH: /.singularity.d/libs
2022-12-31 03:26:04.331406: W tensorflow/compiler/tf2tensorrt/utils/py_utils.cc:38] TF-TRT Warning: Cannot dlopen some TensorRT libraries. If you would like to use Nvidia GPU with TensorRT, please make sure the missing libraries mentioned above are installed properly.
2022-12-31 03:26:06.043373: W tensorflow/compiler/xla/stream_executor/platform/default/dso_loader.cc:64] Could not load dynamic library 'libcuda.so.1'; dlerror: libcuda.so.1: cannot open shared object file: No such file or directory; LD_LIBRARY_PATH: /.singularity.d/libs
2022-12-31 03:26:06.043488: W tensorflow/compiler/xla/stream_executor/cuda/cuda_driver.cc:265] failed call to cuInit: UNKNOWN ERROR (303)
[32m[I 2022-12-31 10:38:56,132][0m Trial 250 finished with value: 0.7514293750898167 and parameters: {'regressor__regressor__batch_size': 10, 'regressor__regressor__epochs': 350, 'regressor__regressor__optimizer': 'Nadam', 'regressor__regressor__optimizer__learning_rate': 0.00015634314648665433, 'regressor__regressor__model__init_mode': 'glorot_normal', 'regressor__regressor__model__activation': 'elu', 'regressor__regressor__model__dropout_rate': 0.03933041938223217, 'regressor__regressor__model__weight_constraint': 3.7462671629295277, 'regressor__regressor__model__regu_L1': 1.403168594195463e-06, 'regressor__regressor__model__regu_L2': 1.761846944270972e-05, 'regressor__regressor__model__n_layers': 7, 'regressor__regressor__model__n_units': 361, 'regressor__regressor__loss': 'mean_absolute_error'}. Best is trial 239 with value: 0.777033467707341.[0m
[32m[I 2022-12-31 11:02:47,532][0m Trial 249 finished with value: 0.7171209753879794 and parameters: {'regressor__regressor__batch_size': 10, 'regressor__regressor__epochs': 370, 'regressor__regressor__optimizer': 'Nadam', 'regressor__regressor__optimizer__learning_rate': 0.00022079785222058672, 'regressor__regressor__model__init_mode': 'glorot_normal', 'regressor__regressor__model__activation': 'elu', 'regressor__regressor__model__dropout_rate': 0.03771682709564374, 'regressor__regressor__model__weight_constraint': 3.7400139342852428, 'regressor__regressor__model__regu_L1': 1.8324738427898957e-06, 'regressor__regressor__model__regu_L2': 2.2160895341045137e-05, 'regressor__regressor__model__n_layers': 7, 'regressor__regressor__model__n_units': 341, 'regressor__regressor__loss': 'mean_absolute_error'}. Best is trial 239 with value: 0.777033467707341.[0m
2022-12-31 11:02:51.680115: W tensorflow/compiler/xla/stream_executor/platform/default/dso_loader.cc:64] Could not load dynamic library 'libcudart.so.11.0'; dlerror: libcudart.so.11.0: cannot open shared object file: No such file or directory; LD_LIBRARY_PATH: /.singularity.d/libs
2022-12-31 11:02:52.878172: W tensorflow/compiler/xla/stream_executor/platform/default/dso_loader.cc:64] Could not load dynamic library 'libnvinfer.so.7'; dlerror: libnvinfer.so.7: cannot open shared object file: No such file or directory; LD_LIBRARY_PATH: /.singularity.d/libs
2022-12-31 11:02:52.878694: W tensorflow/compiler/xla/stream_executor/platform/default/dso_loader.cc:64] Could not load dynamic library 'libnvinfer_plugin.so.7'; dlerror: libnvinfer_plugin.so.7: cannot open shared object file: No such file or directory; LD_LIBRARY_PATH: /.singularity.d/libs
2022-12-31 11:02:52.878824: W tensorflow/compiler/tf2tensorrt/utils/py_utils.cc:38] TF-TRT Warning: Cannot dlopen some TensorRT libraries. If you would like to use Nvidia GPU with TensorRT, please make sure the missing libraries mentioned above are installed properly.
2022-12-31 11:02:54.508248: W tensorflow/compiler/xla/stream_executor/platform/default/dso_loader.cc:64] Could not load dynamic library 'libcuda.so.1'; dlerror: libcuda.so.1: cannot open shared object file: No such file or directory; LD_LIBRARY_PATH: /.singularity.d/libs
2022-12-31 11:02:54.508385: W tensorflow/compiler/xla/stream_executor/cuda/cuda_driver.cc:265] failed call to cuInit: UNKNOWN ERROR (303)
[32m[I 2022-12-31 14:09:27,258][0m Trial 251 finished with value: 0.752474018922673 and parameters: {'regressor__regressor__batch_size': 10, 'regressor__regressor__epochs': 350, 'regressor__regressor__optimizer': 'Nadam', 'regressor__regressor__optimizer__learning_rate': 0.00015481036295325007, 'regressor__regressor__model__init_mode': 'glorot_normal', 'regressor__regressor__model__activation': 'elu', 'regressor__regressor__model__dropout_rate': 0.03632857691265603, 'regressor__regressor__model__weight_constraint': 3.732851268983406, 'regressor__regressor__model__regu_L1': 1.4525248595279585e-06, 'regressor__regressor__model__regu_L2': 1.8620266861991053e-05, 'regressor__regressor__model__n_layers': 7, 'regressor__regressor__model__n_units': 361, 'regressor__regressor__loss': 'mean_absolute_error'}. Best is trial 239 with value: 0.777033467707341.[0m
2022-12-31 14:09:31.441094: W tensorflow/compiler/xla/stream_executor/platform/default/dso_loader.cc:64] Could not load dynamic library 'libcudart.so.11.0'; dlerror: libcudart.so.11.0: cannot open shared object file: No such file or directory; LD_LIBRARY_PATH: /.singularity.d/libs
2022-12-31 14:09:32.705810: W tensorflow/compiler/xla/stream_executor/platform/default/dso_loader.cc:64] Could not load dynamic library 'libnvinfer.so.7'; dlerror: libnvinfer.so.7: cannot open shared object file: No such file or directory; LD_LIBRARY_PATH: /.singularity.d/libs
2022-12-31 14:09:32.705946: W tensorflow/compiler/xla/stream_executor/platform/default/dso_loader.cc:64] Could not load dynamic library 'libnvinfer_plugin.so.7'; dlerror: libnvinfer_plugin.so.7: cannot open shared object file: No such file or directory; LD_LIBRARY_PATH: /.singularity.d/libs
2022-12-31 14:09:32.705975: W tensorflow/compiler/tf2tensorrt/utils/py_utils.cc:38] TF-TRT Warning: Cannot dlopen some TensorRT libraries. If you would like to use Nvidia GPU with TensorRT, please make sure the missing libraries mentioned above are installed properly.
2022-12-31 14:09:34.609002: W tensorflow/compiler/xla/stream_executor/platform/default/dso_loader.cc:64] Could not load dynamic library 'libcuda.so.1'; dlerror: libcuda.so.1: cannot open shared object file: No such file or directory; LD_LIBRARY_PATH: /.singularity.d/libs
2022-12-31 14:09:34.609254: W tensorflow/compiler/xla/stream_executor/cuda/cuda_driver.cc:265] failed call to cuInit: UNKNOWN ERROR (303)
[32m[I 2022-12-31 14:53:21,328][0m Trial 253 finished with value: 0.7576981315152388 and parameters: {'regressor__regressor__batch_size': 10, 'regressor__regressor__epochs': 350, 'regressor__regressor__optimizer': 'Nadam', 'regressor__regressor__optimizer__learning_rate': 0.00015960617248052413, 'regressor__regressor__model__init_mode': 'glorot_normal', 'regressor__regressor__model__activation': 'elu', 'regressor__regressor__model__dropout_rate': 0.03689835527211906, 'regressor__regressor__model__weight_constraint': 3.7119361098417136, 'regressor__regressor__model__regu_L1': 1.4068898982521367e-06, 'regressor__regressor__model__regu_L2': 2.1462725871111802e-05, 'regressor__regressor__model__n_layers': 7, 'regressor__regressor__model__n_units': 341, 'regressor__regressor__loss': 'mean_absolute_error'}. Best is trial 239 with value: 0.777033467707341.[0m
2022-12-31 14:53:25.186314: W tensorflow/compiler/xla/stream_executor/platform/default/dso_loader.cc:64] Could not load dynamic library 'libcudart.so.11.0'; dlerror: libcudart.so.11.0: cannot open shared object file: No such file or directory; LD_LIBRARY_PATH: /.singularity.d/libs
2022-12-31 14:53:26.280771: W tensorflow/compiler/xla/stream_executor/platform/default/dso_loader.cc:64] Could not load dynamic library 'libnvinfer.so.7'; dlerror: libnvinfer.so.7: cannot open shared object file: No such file or directory; LD_LIBRARY_PATH: /.singularity.d/libs
2022-12-31 14:53:26.282477: W tensorflow/compiler/xla/stream_executor/platform/default/dso_loader.cc:64] Could not load dynamic library 'libnvinfer_plugin.so.7'; dlerror: libnvinfer_plugin.so.7: cannot open shared object file: No such file or directory; LD_LIBRARY_PATH: /.singularity.d/libs
2022-12-31 14:53:26.282640: W tensorflow/compiler/tf2tensorrt/utils/py_utils.cc:38] TF-TRT Warning: Cannot dlopen some TensorRT libraries. If you would like to use Nvidia GPU with TensorRT, please make sure the missing libraries mentioned above are installed properly.
2022-12-31 14:53:27.815309: W tensorflow/compiler/xla/stream_executor/platform/default/dso_loader.cc:64] Could not load dynamic library 'libcuda.so.1'; dlerror: libcuda.so.1: cannot open shared object file: No such file or directory; LD_LIBRARY_PATH: /.singularity.d/libs
2022-12-31 14:53:27.815445: W tensorflow/compiler/xla/stream_executor/cuda/cuda_driver.cc:265] failed call to cuInit: UNKNOWN ERROR (303)
