[32m[I 2022-12-25 13:04:01,589][0m Trial 125 finished with value: 0.6054704497624882 and parameters: {'regressor__regressor__batch_size': 40, 'regressor__regressor__epochs': 610, 'regressor__regressor__optimizer': 'Adam', 'regressor__regressor__optimizer__learning_rate': 0.00013696396451432196, 'regressor__regressor__model__init_mode': 'lecun_uniform', 'regressor__regressor__model__activation': 'LeakyReLU', 'regressor__regressor__model__dropout_rate': 0.09708670664118456, 'regressor__regressor__model__weight_constraint': 2.228986622452382, 'regressor__regressor__model__regu_L1': 2.069450980881418e-05, 'regressor__regressor__model__regu_L2': 2.0306143182751033e-06, 'regressor__regressor__model__n_layers': 13, 'regressor__regressor__model__n_units': 461, 'regressor__regressor__loss': 'log_cosh'}. Best is trial 15 with value: 0.713745100510843.[0m
2022-12-25 13:04:09.074104: W tensorflow/compiler/xla/stream_executor/platform/default/dso_loader.cc:64] Could not load dynamic library 'libcudart.so.11.0'; dlerror: libcudart.so.11.0: cannot open shared object file: No such file or directory; LD_LIBRARY_PATH: /.singularity.d/libs
2022-12-25 13:04:10.358200: W tensorflow/compiler/xla/stream_executor/platform/default/dso_loader.cc:64] Could not load dynamic library 'libnvinfer.so.7'; dlerror: libnvinfer.so.7: cannot open shared object file: No such file or directory; LD_LIBRARY_PATH: /.singularity.d/libs
2022-12-25 13:04:10.358566: W tensorflow/compiler/xla/stream_executor/platform/default/dso_loader.cc:64] Could not load dynamic library 'libnvinfer_plugin.so.7'; dlerror: libnvinfer_plugin.so.7: cannot open shared object file: No such file or directory; LD_LIBRARY_PATH: /.singularity.d/libs
2022-12-25 13:04:10.358595: W tensorflow/compiler/tf2tensorrt/utils/py_utils.cc:38] TF-TRT Warning: Cannot dlopen some TensorRT libraries. If you would like to use Nvidia GPU with TensorRT, please make sure the missing libraries mentioned above are installed properly.
2022-12-25 13:04:12.272316: W tensorflow/compiler/xla/stream_executor/platform/default/dso_loader.cc:64] Could not load dynamic library 'libcuda.so.1'; dlerror: libcuda.so.1: cannot open shared object file: No such file or directory; LD_LIBRARY_PATH: /.singularity.d/libs
2022-12-25 13:04:12.272549: W tensorflow/compiler/xla/stream_executor/cuda/cuda_driver.cc:265] failed call to cuInit: UNKNOWN ERROR (303)
[32m[I 2022-12-25 13:33:54,862][0m Trial 137 finished with value: 0.595880684090268 and parameters: {'regressor__regressor__batch_size': 70, 'regressor__regressor__epochs': 110, 'regressor__regressor__optimizer': 'Adam', 'regressor__regressor__optimizer__learning_rate': 6.307593624912897e-05, 'regressor__regressor__model__init_mode': 'variance_scaling', 'regressor__regressor__model__activation': 'LeakyReLU', 'regressor__regressor__model__dropout_rate': 0.025285083314977145, 'regressor__regressor__model__weight_constraint': 3.58573175840762, 'regressor__regressor__model__regu_L1': 2.717062017856883e-07, 'regressor__regressor__model__regu_L2': 1.6555755494879653e-06, 'regressor__regressor__model__n_layers': 11, 'regressor__regressor__model__n_units': 421, 'regressor__regressor__loss': 'log_cosh'}. Best is trial 15 with value: 0.713745100510843.[0m
2022-12-25 13:34:02.173959: W tensorflow/compiler/xla/stream_executor/platform/default/dso_loader.cc:64] Could not load dynamic library 'libcudart.so.11.0'; dlerror: libcudart.so.11.0: cannot open shared object file: No such file or directory; LD_LIBRARY_PATH: /.singularity.d/libs
2022-12-25 13:34:03.919194: W tensorflow/compiler/xla/stream_executor/platform/default/dso_loader.cc:64] Could not load dynamic library 'libnvinfer.so.7'; dlerror: libnvinfer.so.7: cannot open shared object file: No such file or directory; LD_LIBRARY_PATH: /.singularity.d/libs
2022-12-25 13:34:03.919356: W tensorflow/compiler/xla/stream_executor/platform/default/dso_loader.cc:64] Could not load dynamic library 'libnvinfer_plugin.so.7'; dlerror: libnvinfer_plugin.so.7: cannot open shared object file: No such file or directory; LD_LIBRARY_PATH: /.singularity.d/libs
2022-12-25 13:34:03.919379: W tensorflow/compiler/tf2tensorrt/utils/py_utils.cc:38] TF-TRT Warning: Cannot dlopen some TensorRT libraries. If you would like to use Nvidia GPU with TensorRT, please make sure the missing libraries mentioned above are installed properly.
2022-12-25 13:34:06.334131: W tensorflow/compiler/xla/stream_executor/platform/default/dso_loader.cc:64] Could not load dynamic library 'libcuda.so.1'; dlerror: libcuda.so.1: cannot open shared object file: No such file or directory; LD_LIBRARY_PATH: /.singularity.d/libs
2022-12-25 13:34:06.334242: W tensorflow/compiler/xla/stream_executor/cuda/cuda_driver.cc:265] failed call to cuInit: UNKNOWN ERROR (303)
[32m[I 2022-12-25 14:42:23,663][0m Trial 129 finished with value: -0.0315277603309553 and parameters: {'regressor__regressor__batch_size': 40, 'regressor__regressor__epochs': 610, 'regressor__regressor__optimizer': 'Adam', 'regressor__regressor__optimizer__learning_rate': 0.00012791804459311377, 'regressor__regressor__model__init_mode': 'variance_scaling', 'regressor__regressor__model__activation': 'softmax', 'regressor__regressor__model__dropout_rate': 0.023255433678610694, 'regressor__regressor__model__weight_constraint': 5.787532028245767, 'regressor__regressor__model__regu_L1': 7.042604983751414e-07, 'regressor__regressor__model__regu_L2': 1.7006087326112475e-06, 'regressor__regressor__model__n_layers': 13, 'regressor__regressor__model__n_units': 441, 'regressor__regressor__loss': 'log_cosh'}. Best is trial 15 with value: 0.713745100510843.[0m
2022-12-25 14:42:30.824334: W tensorflow/compiler/xla/stream_executor/platform/default/dso_loader.cc:64] Could not load dynamic library 'libcudart.so.11.0'; dlerror: libcudart.so.11.0: cannot open shared object file: No such file or directory; LD_LIBRARY_PATH: /.singularity.d/libs
2022-12-25 14:42:32.256565: W tensorflow/compiler/xla/stream_executor/platform/default/dso_loader.cc:64] Could not load dynamic library 'libnvinfer.so.7'; dlerror: libnvinfer.so.7: cannot open shared object file: No such file or directory; LD_LIBRARY_PATH: /.singularity.d/libs
2022-12-25 14:42:32.257510: W tensorflow/compiler/xla/stream_executor/platform/default/dso_loader.cc:64] Could not load dynamic library 'libnvinfer_plugin.so.7'; dlerror: libnvinfer_plugin.so.7: cannot open shared object file: No such file or directory; LD_LIBRARY_PATH: /.singularity.d/libs
2022-12-25 14:42:32.257557: W tensorflow/compiler/tf2tensorrt/utils/py_utils.cc:38] TF-TRT Warning: Cannot dlopen some TensorRT libraries. If you would like to use Nvidia GPU with TensorRT, please make sure the missing libraries mentioned above are installed properly.
2022-12-25 14:42:34.601303: W tensorflow/compiler/xla/stream_executor/platform/default/dso_loader.cc:64] Could not load dynamic library 'libcuda.so.1'; dlerror: libcuda.so.1: cannot open shared object file: No such file or directory; LD_LIBRARY_PATH: /.singularity.d/libs
2022-12-25 14:42:34.601485: W tensorflow/compiler/xla/stream_executor/cuda/cuda_driver.cc:265] failed call to cuInit: UNKNOWN ERROR (303)
[32m[I 2022-12-25 15:21:53,176][0m Trial 136 finished with value: 0.6419397615845479 and parameters: {'regressor__regressor__batch_size': 70, 'regressor__regressor__epochs': 610, 'regressor__regressor__optimizer': 'Adam', 'regressor__regressor__optimizer__learning_rate': 4.244944030740345e-05, 'regressor__regressor__model__init_mode': 'variance_scaling', 'regressor__regressor__model__activation': 'LeakyReLU', 'regressor__regressor__model__dropout_rate': 0.025348907371544032, 'regressor__regressor__model__weight_constraint': 3.2245574028333173, 'regressor__regressor__model__regu_L1': 2.734682995132063e-07, 'regressor__regressor__model__regu_L2': 1.9576146795251936e-06, 'regressor__regressor__model__n_layers': 11, 'regressor__regressor__model__n_units': 301, 'regressor__regressor__loss': 'log_cosh'}. Best is trial 15 with value: 0.713745100510843.[0m
[32m[I 2022-12-25 16:03:37,508][0m Trial 140 finished with value: 0.6243592787338595 and parameters: {'regressor__regressor__batch_size': 50, 'regressor__regressor__epochs': 130, 'regressor__regressor__optimizer': 'Adam', 'regressor__regressor__optimizer__learning_rate': 6.610803298784532e-05, 'regressor__regressor__model__init_mode': 'variance_scaling', 'regressor__regressor__model__activation': 'LeakyReLU', 'regressor__regressor__model__dropout_rate': 0.03783078287076476, 'regressor__regressor__model__weight_constraint': 3.4573325218091226, 'regressor__regressor__model__regu_L1': 2.943803210997464e-07, 'regressor__regressor__model__regu_L2': 3.009417087313336e-07, 'regressor__regressor__model__n_layers': 11, 'regressor__regressor__model__n_units': 461, 'regressor__regressor__loss': 'log_cosh'}. Best is trial 15 with value: 0.713745100510843.[0m
2022-12-25 16:03:41.985561: W tensorflow/compiler/xla/stream_executor/platform/default/dso_loader.cc:64] Could not load dynamic library 'libcudart.so.11.0'; dlerror: libcudart.so.11.0: cannot open shared object file: No such file or directory; LD_LIBRARY_PATH: /.singularity.d/libs
2022-12-25 16:03:43.501090: W tensorflow/compiler/xla/stream_executor/platform/default/dso_loader.cc:64] Could not load dynamic library 'libnvinfer.so.7'; dlerror: libnvinfer.so.7: cannot open shared object file: No such file or directory; LD_LIBRARY_PATH: /.singularity.d/libs
2022-12-25 16:03:43.501218: W tensorflow/compiler/xla/stream_executor/platform/default/dso_loader.cc:64] Could not load dynamic library 'libnvinfer_plugin.so.7'; dlerror: libnvinfer_plugin.so.7: cannot open shared object file: No such file or directory; LD_LIBRARY_PATH: /.singularity.d/libs
2022-12-25 16:03:43.501284: W tensorflow/compiler/tf2tensorrt/utils/py_utils.cc:38] TF-TRT Warning: Cannot dlopen some TensorRT libraries. If you would like to use Nvidia GPU with TensorRT, please make sure the missing libraries mentioned above are installed properly.
2022-12-25 16:03:45.515379: W tensorflow/compiler/xla/stream_executor/platform/default/dso_loader.cc:64] Could not load dynamic library 'libcuda.so.1'; dlerror: libcuda.so.1: cannot open shared object file: No such file or directory; LD_LIBRARY_PATH: /.singularity.d/libs
2022-12-25 16:03:45.515639: W tensorflow/compiler/xla/stream_executor/cuda/cuda_driver.cc:265] failed call to cuInit: UNKNOWN ERROR (303)
[32m[I 2022-12-25 16:06:23,512][0m Trial 126 finished with value: 0.5812079789476697 and parameters: {'regressor__regressor__batch_size': 10, 'regressor__regressor__epochs': 590, 'regressor__regressor__optimizer': 'Adam', 'regressor__regressor__optimizer__learning_rate': 0.00012340110051474714, 'regressor__regressor__model__init_mode': 'lecun_uniform', 'regressor__regressor__model__activation': 'LeakyReLU', 'regressor__regressor__model__dropout_rate': 0.2659428444152111, 'regressor__regressor__model__weight_constraint': 5.949269801477363, 'regressor__regressor__model__regu_L1': 7.577109892806719e-06, 'regressor__regressor__model__regu_L2': 6.45656852757778e-05, 'regressor__regressor__model__n_layers': 13, 'regressor__regressor__model__n_units': 241, 'regressor__regressor__loss': 'log_cosh'}. Best is trial 15 with value: 0.713745100510843.[0m
2022-12-25 16:06:29.269892: W tensorflow/compiler/xla/stream_executor/platform/default/dso_loader.cc:64] Could not load dynamic library 'libcudart.so.11.0'; dlerror: libcudart.so.11.0: cannot open shared object file: No such file or directory; LD_LIBRARY_PATH: /.singularity.d/libs
2022-12-25 16:06:31.163458: W tensorflow/compiler/xla/stream_executor/platform/default/dso_loader.cc:64] Could not load dynamic library 'libnvinfer.so.7'; dlerror: libnvinfer.so.7: cannot open shared object file: No such file or directory; LD_LIBRARY_PATH: /.singularity.d/libs
2022-12-25 16:06:31.165700: W tensorflow/compiler/xla/stream_executor/platform/default/dso_loader.cc:64] Could not load dynamic library 'libnvinfer_plugin.so.7'; dlerror: libnvinfer_plugin.so.7: cannot open shared object file: No such file or directory; LD_LIBRARY_PATH: /.singularity.d/libs
2022-12-25 16:06:31.165740: W tensorflow/compiler/tf2tensorrt/utils/py_utils.cc:38] TF-TRT Warning: Cannot dlopen some TensorRT libraries. If you would like to use Nvidia GPU with TensorRT, please make sure the missing libraries mentioned above are installed properly.
2022-12-25 16:06:33.990222: W tensorflow/compiler/xla/stream_executor/platform/default/dso_loader.cc:64] Could not load dynamic library 'libcuda.so.1'; dlerror: libcuda.so.1: cannot open shared object file: No such file or directory; LD_LIBRARY_PATH: /.singularity.d/libs
2022-12-25 16:06:33.990331: W tensorflow/compiler/xla/stream_executor/cuda/cuda_driver.cc:265] failed call to cuInit: UNKNOWN ERROR (303)
[32m[I 2022-12-25 17:56:05,004][0m Trial 139 finished with value: 0.4587916424997259 and parameters: {'regressor__regressor__batch_size': 70, 'regressor__regressor__epochs': 590, 'regressor__regressor__optimizer': 'SGD', 'regressor__regressor__optimizer__learning_rate': 6.690592669250128e-05, 'regressor__regressor__model__init_mode': 'variance_scaling', 'regressor__regressor__model__activation': 'LeakyReLU', 'regressor__regressor__model__dropout_rate': 0.019238331562584608, 'regressor__regressor__model__weight_constraint': 2.894318167520951, 'regressor__regressor__model__regu_L1': 2.361821710465762e-07, 'regressor__regressor__model__regu_L2': 3.1951364107560103e-07, 'regressor__regressor__model__n_layers': 11, 'regressor__regressor__model__n_units': 441, 'regressor__regressor__loss': 'log_cosh'}. Best is trial 15 with value: 0.713745100510843.[0m
2022-12-25 17:56:09.289272: W tensorflow/compiler/xla/stream_executor/platform/default/dso_loader.cc:64] Could not load dynamic library 'libcudart.so.11.0'; dlerror: libcudart.so.11.0: cannot open shared object file: No such file or directory; LD_LIBRARY_PATH: /.singularity.d/libs
2022-12-25 17:56:10.567381: W tensorflow/compiler/xla/stream_executor/platform/default/dso_loader.cc:64] Could not load dynamic library 'libnvinfer.so.7'; dlerror: libnvinfer.so.7: cannot open shared object file: No such file or directory; LD_LIBRARY_PATH: /.singularity.d/libs
2022-12-25 17:56:10.567595: W tensorflow/compiler/xla/stream_executor/platform/default/dso_loader.cc:64] Could not load dynamic library 'libnvinfer_plugin.so.7'; dlerror: libnvinfer_plugin.so.7: cannot open shared object file: No such file or directory; LD_LIBRARY_PATH: /.singularity.d/libs
2022-12-25 17:56:10.567628: W tensorflow/compiler/tf2tensorrt/utils/py_utils.cc:38] TF-TRT Warning: Cannot dlopen some TensorRT libraries. If you would like to use Nvidia GPU with TensorRT, please make sure the missing libraries mentioned above are installed properly.
2022-12-25 17:56:12.628819: W tensorflow/compiler/xla/stream_executor/platform/default/dso_loader.cc:64] Could not load dynamic library 'libcuda.so.1'; dlerror: libcuda.so.1: cannot open shared object file: No such file or directory; LD_LIBRARY_PATH: /.singularity.d/libs
2022-12-25 17:56:12.628927: W tensorflow/compiler/xla/stream_executor/cuda/cuda_driver.cc:265] failed call to cuInit: UNKNOWN ERROR (303)
[32m[I 2022-12-25 17:57:22,841][0m Trial 138 finished with value: 0.6144203997930269 and parameters: {'regressor__regressor__batch_size': 70, 'regressor__regressor__epochs': 590, 'regressor__regressor__optimizer': 'Adam', 'regressor__regressor__optimizer__learning_rate': 1.3154211637708397e-05, 'regressor__regressor__model__init_mode': 'variance_scaling', 'regressor__regressor__model__activation': 'LeakyReLU', 'regressor__regressor__model__dropout_rate': 0.02440250871522041, 'regressor__regressor__model__weight_constraint': 3.4716480604112507, 'regressor__regressor__model__regu_L1': 3.07670122571175e-07, 'regressor__regressor__model__regu_L2': 1.6931819080245565e-06, 'regressor__regressor__model__n_layers': 11, 'regressor__regressor__model__n_units': 441, 'regressor__regressor__loss': 'log_cosh'}. Best is trial 15 with value: 0.713745100510843.[0m
2022-12-25 17:57:28.113142: W tensorflow/compiler/xla/stream_executor/platform/default/dso_loader.cc:64] Could not load dynamic library 'libcudart.so.11.0'; dlerror: libcudart.so.11.0: cannot open shared object file: No such file or directory; LD_LIBRARY_PATH: /.singularity.d/libs
2022-12-25 17:57:29.535815: W tensorflow/compiler/xla/stream_executor/platform/default/dso_loader.cc:64] Could not load dynamic library 'libnvinfer.so.7'; dlerror: libnvinfer.so.7: cannot open shared object file: No such file or directory; LD_LIBRARY_PATH: /.singularity.d/libs
2022-12-25 17:57:29.536611: W tensorflow/compiler/xla/stream_executor/platform/default/dso_loader.cc:64] Could not load dynamic library 'libnvinfer_plugin.so.7'; dlerror: libnvinfer_plugin.so.7: cannot open shared object file: No such file or directory; LD_LIBRARY_PATH: /.singularity.d/libs
2022-12-25 17:57:29.536650: W tensorflow/compiler/tf2tensorrt/utils/py_utils.cc:38] TF-TRT Warning: Cannot dlopen some TensorRT libraries. If you would like to use Nvidia GPU with TensorRT, please make sure the missing libraries mentioned above are installed properly.
2022-12-25 17:57:31.696590: W tensorflow/compiler/xla/stream_executor/platform/default/dso_loader.cc:64] Could not load dynamic library 'libcuda.so.1'; dlerror: libcuda.so.1: cannot open shared object file: No such file or directory; LD_LIBRARY_PATH: /.singularity.d/libs
2022-12-25 17:57:31.697069: W tensorflow/compiler/xla/stream_executor/cuda/cuda_driver.cc:265] failed call to cuInit: UNKNOWN ERROR (303)
[32m[I 2022-12-25 21:53:58,345][0m Trial 141 finished with value: 0.6495961548391749 and parameters: {'regressor__regressor__batch_size': 50, 'regressor__regressor__epochs': 590, 'regressor__regressor__optimizer': 'Adam', 'regressor__regressor__optimizer__learning_rate': 6.33101952471904e-05, 'regressor__regressor__model__init_mode': 'variance_scaling', 'regressor__regressor__model__activation': 'LeakyReLU', 'regressor__regressor__model__dropout_rate': 0.0003658648008119936, 'regressor__regressor__model__weight_constraint': 3.5247915377827197, 'regressor__regressor__model__regu_L1': 2.453190776973912e-07, 'regressor__regressor__model__regu_L2': 3.505487970686211e-07, 'regressor__regressor__model__n_layers': 11, 'regressor__regressor__model__n_units': 461, 'regressor__regressor__loss': 'log_cosh'}. Best is trial 15 with value: 0.713745100510843.[0m
2022-12-25 21:54:07.000315: W tensorflow/compiler/xla/stream_executor/platform/default/dso_loader.cc:64] Could not load dynamic library 'libcudart.so.11.0'; dlerror: libcudart.so.11.0: cannot open shared object file: No such file or directory; LD_LIBRARY_PATH: /.singularity.d/libs
2022-12-25 21:54:09.277781: W tensorflow/compiler/xla/stream_executor/platform/default/dso_loader.cc:64] Could not load dynamic library 'libnvinfer.so.7'; dlerror: libnvinfer.so.7: cannot open shared object file: No such file or directory; LD_LIBRARY_PATH: /.singularity.d/libs
2022-12-25 21:54:09.277900: W tensorflow/compiler/xla/stream_executor/platform/default/dso_loader.cc:64] Could not load dynamic library 'libnvinfer_plugin.so.7'; dlerror: libnvinfer_plugin.so.7: cannot open shared object file: No such file or directory; LD_LIBRARY_PATH: /.singularity.d/libs
2022-12-25 21:54:09.277922: W tensorflow/compiler/tf2tensorrt/utils/py_utils.cc:38] TF-TRT Warning: Cannot dlopen some TensorRT libraries. If you would like to use Nvidia GPU with TensorRT, please make sure the missing libraries mentioned above are installed properly.
2022-12-25 21:54:12.543857: W tensorflow/compiler/xla/stream_executor/platform/default/dso_loader.cc:64] Could not load dynamic library 'libcuda.so.1'; dlerror: libcuda.so.1: cannot open shared object file: No such file or directory; LD_LIBRARY_PATH: /.singularity.d/libs
2022-12-25 21:54:12.544038: W tensorflow/compiler/xla/stream_executor/cuda/cuda_driver.cc:265] failed call to cuInit: UNKNOWN ERROR (303)
[32m[I 2022-12-25 22:06:57,219][0m Trial 143 finished with value: 0.4511853634725888 and parameters: {'regressor__regressor__batch_size': 50, 'regressor__regressor__epochs': 570, 'regressor__regressor__optimizer': 'SGD', 'regressor__regressor__optimizer__learning_rate': 2.8081105498631265e-05, 'regressor__regressor__model__init_mode': 'variance_scaling', 'regressor__regressor__model__activation': 'LeakyReLU', 'regressor__regressor__model__dropout_rate': 0.0024882184756764153, 'regressor__regressor__model__weight_constraint': 2.960003830536658, 'regressor__regressor__model__regu_L1': 4.6415759964246207e-07, 'regressor__regressor__model__regu_L2': 2.72604757163807e-07, 'regressor__regressor__model__n_layers': 11, 'regressor__regressor__model__n_units': 441, 'regressor__regressor__loss': 'log_cosh'}. Best is trial 15 with value: 0.713745100510843.[0m
