[32m[I 2022-12-24 16:02:18,410][0m Trial 34 finished with value: 0.43739027824528104 and parameters: {'regressor__regressor__batch_size': 50, 'regressor__regressor__epochs': 350, 'regressor__regressor__optimizer': 'Adam', 'regressor__regressor__optimizer__learning_rate': 0.0017612257528725023, 'regressor__regressor__model__init_mode': 'lecun_uniform', 'regressor__regressor__model__activation': 'linear', 'regressor__regressor__model__dropout_rate': 0.014134540865849539, 'regressor__regressor__model__weight_constraint': 4.548136744250552, 'regressor__regressor__model__regu_L1': 2.0983014514614777e-06, 'regressor__regressor__model__regu_L2': 7.591377573978182e-05, 'regressor__regressor__model__n_layers': 7, 'regressor__regressor__model__n_units': 201, 'regressor__regressor__loss': 'mse'}. Best is trial 15 with value: 0.713745100510843.[0m
[32m[I 2022-12-24 16:07:25,216][0m Trial 36 finished with value: -0.002154400114872268 and parameters: {'regressor__regressor__batch_size': 140, 'regressor__regressor__epochs': 250, 'regressor__regressor__optimizer': 'Adadelta', 'regressor__regressor__optimizer__learning_rate': 0.00036697313711511905, 'regressor__regressor__model__init_mode': 'zero', 'regressor__regressor__model__activation': 'exponential', 'regressor__regressor__model__dropout_rate': 0.6096803292385765, 'regressor__regressor__model__weight_constraint': 1.050135358796, 'regressor__regressor__model__regu_L1': 2.1644349764197745e-06, 'regressor__regressor__model__regu_L2': 1.9930671620366318e-06, 'regressor__regressor__model__n_layers': 5, 'regressor__regressor__model__n_units': 101, 'regressor__regressor__loss': 'mse'}. Best is trial 15 with value: 0.713745100510843.[0m
[32m[I 2022-12-24 16:15:10,474][0m Trial 37 finished with value: -0.03533179096686856 and parameters: {'regressor__regressor__batch_size': 50, 'regressor__regressor__epochs': 250, 'regressor__regressor__optimizer': 'SGD', 'regressor__regressor__optimizer__learning_rate': 0.1668527480986333, 'regressor__regressor__model__init_mode': 'constant', 'regressor__regressor__model__activation': 'tanh', 'regressor__regressor__model__dropout_rate': 0.548618673384738, 'regressor__regressor__model__weight_constraint': 6.9633758526116, 'regressor__regressor__model__regu_L1': 6.714444485182792e-07, 'regressor__regressor__model__regu_L2': 1.0289161243089764e-07, 'regressor__regressor__model__n_layers': 7, 'regressor__regressor__model__n_units': 101, 'regressor__regressor__loss': 'huber'}. Best is trial 15 with value: 0.713745100510843.[0m
[32m[I 2022-12-24 16:18:03,315][0m Trial 35 finished with value: 0.21103094106706957 and parameters: {'regressor__regressor__batch_size': 60, 'regressor__regressor__epochs': 290, 'regressor__regressor__optimizer': 'Adadelta', 'regressor__regressor__optimizer__learning_rate': 0.0004875212196858329, 'regressor__regressor__model__init_mode': 'normal', 'regressor__regressor__model__activation': 'tanh', 'regressor__regressor__model__dropout_rate': 0.5916836502508361, 'regressor__regressor__model__weight_constraint': 6.871697730260481, 'regressor__regressor__model__regu_L1': 1.6133910593697406e-06, 'regressor__regressor__model__regu_L2': 1.9818704422869474e-06, 'regressor__regressor__model__n_layers': 7, 'regressor__regressor__model__n_units': 221, 'regressor__regressor__loss': 'mse'}. Best is trial 15 with value: 0.713745100510843.[0m
[32m[I 2022-12-24 16:20:32,421][0m Trial 39 finished with value: -0.5518616635962971 and parameters: {'regressor__regressor__batch_size': 150, 'regressor__regressor__epochs': 450, 'regressor__regressor__optimizer': 'Adam', 'regressor__regressor__optimizer__learning_rate': 7.07283665394062e-05, 'regressor__regressor__model__init_mode': 'ones', 'regressor__regressor__model__activation': 'softplus', 'regressor__regressor__model__dropout_rate': 0.1092053801669096, 'regressor__regressor__model__weight_constraint': 4.481849328602284, 'regressor__regressor__model__regu_L1': 2.2183695987579997e-07, 'regressor__regressor__model__regu_L2': 7.95109482456896e-05, 'regressor__regressor__model__n_layers': 1, 'regressor__regressor__model__n_units': 141, 'regressor__regressor__loss': 'msle'}. Best is trial 15 with value: 0.713745100510843.[0m
[32m[I 2022-12-24 16:36:10,696][0m Trial 40 finished with value: -0.0025519903273355515 and parameters: {'regressor__regressor__batch_size': 130, 'regressor__regressor__epochs': 190, 'regressor__regressor__optimizer': 'Ftrl', 'regressor__regressor__optimizer__learning_rate': 0.004597022986734886, 'regressor__regressor__model__init_mode': 'orthogonal', 'regressor__regressor__model__activation': 'hard_sigmoid', 'regressor__regressor__model__dropout_rate': 0.38302668952094227, 'regressor__regressor__model__weight_constraint': 2.613401127113688, 'regressor__regressor__model__regu_L1': 6.674071625562622e-06, 'regressor__regressor__model__regu_L2': 0.00043667951256653694, 'regressor__regressor__model__n_layers': 9, 'regressor__regressor__model__n_units': 241, 'regressor__regressor__loss': 'mape'}. Best is trial 15 with value: 0.713745100510843.[0m
[32m[I 2022-12-24 16:40:21,015][0m Trial 31 finished with value: -0.16816848639286577 and parameters: {'regressor__regressor__batch_size': 10, 'regressor__regressor__epochs': 410, 'regressor__regressor__optimizer': 'Adam', 'regressor__regressor__optimizer__learning_rate': 0.0022363359377921767, 'regressor__regressor__model__init_mode': 'lecun_uniform', 'regressor__regressor__model__activation': 'selu', 'regressor__regressor__model__dropout_rate': 0.03083765240464164, 'regressor__regressor__model__weight_constraint': 4.193465997043969, 'regressor__regressor__model__regu_L1': 2.5638197685680093e-06, 'regressor__regressor__model__regu_L2': 3.802538472988058e-05, 'regressor__regressor__model__n_layers': 19, 'regressor__regressor__model__n_units': 181, 'regressor__regressor__loss': 'huber'}. Best is trial 15 with value: 0.713745100510843.[0m
[32m[I 2022-12-24 16:40:50,531][0m Trial 41 finished with value: 0.3995305955807059 and parameters: {'regressor__regressor__batch_size': 80, 'regressor__regressor__epochs': 390, 'regressor__regressor__optimizer': 'Ftrl', 'regressor__regressor__optimizer__learning_rate': 0.23944578616766438, 'regressor__regressor__model__init_mode': 'truncated_normal', 'regressor__regressor__model__activation': 'LeakyReLU', 'regressor__regressor__model__dropout_rate': 0.22313764405471828, 'regressor__regressor__model__weight_constraint': 6.21966200510941, 'regressor__regressor__model__regu_L1': 1.057150211804428e-07, 'regressor__regressor__model__regu_L2': 0.05191087870000579, 'regressor__regressor__model__n_layers': 1, 'regressor__regressor__model__n_units': 361, 'regressor__regressor__loss': 'mae'}. Best is trial 15 with value: 0.713745100510843.[0m
[32m[I 2022-12-24 16:44:41,785][0m Trial 42 finished with value: 0.39281764177275275 and parameters: {'regressor__regressor__batch_size': 80, 'regressor__regressor__epochs': 350, 'regressor__regressor__optimizer': 'Ftrl', 'regressor__regressor__optimizer__learning_rate': 0.21396825438172534, 'regressor__regressor__model__init_mode': 'truncated_normal', 'regressor__regressor__model__activation': 'LeakyReLU', 'regressor__regressor__model__dropout_rate': 0.23497778569213223, 'regressor__regressor__model__weight_constraint': 6.302099136534471, 'regressor__regressor__model__regu_L1': 1.095298214001477e-07, 'regressor__regressor__model__regu_L2': 0.08038483084946633, 'regressor__regressor__model__n_layers': 1, 'regressor__regressor__model__n_units': 321, 'regressor__regressor__loss': 'mae'}. Best is trial 15 with value: 0.713745100510843.[0m
[32m[I 2022-12-24 17:00:31,224][0m Trial 38 finished with value: -0.0017554715687169375 and parameters: {'regressor__regressor__batch_size': 60, 'regressor__regressor__epochs': 450, 'regressor__regressor__optimizer': 'Adam', 'regressor__regressor__optimizer__learning_rate': 0.00013866603397380393, 'regressor__regressor__model__init_mode': 'normal', 'regressor__regressor__model__activation': 'hard_sigmoid', 'regressor__regressor__model__dropout_rate': 0.5228565904149627, 'regressor__regressor__model__weight_constraint': 4.611176025507069, 'regressor__regressor__model__regu_L1': 1.0445081809203762e-07, 'regressor__regressor__model__regu_L2': 0.00020331302697360938, 'regressor__regressor__model__n_layers': 9, 'regressor__regressor__model__n_units': 221, 'regressor__regressor__loss': 'mse'}. Best is trial 15 with value: 0.713745100510843.[0m
[32m[I 2022-12-24 17:06:31,548][0m Trial 43 finished with value: -0.0029926389606523608 and parameters: {'regressor__regressor__batch_size': 80, 'regressor__regressor__epochs': 330, 'regressor__regressor__optimizer': 'Ftrl', 'regressor__regressor__optimizer__learning_rate': 0.00013278902191464078, 'regressor__regressor__model__init_mode': 'truncated_normal', 'regressor__regressor__model__activation': 'LeakyReLU', 'regressor__regressor__model__dropout_rate': 0.11494514006934949, 'regressor__regressor__model__weight_constraint': 6.354542690882306, 'regressor__regressor__model__regu_L1': 4.926333192274419e-07, 'regressor__regressor__model__regu_L2': 0.00028644787390051457, 'regressor__regressor__model__n_layers': 5, 'regressor__regressor__model__n_units': 281, 'regressor__regressor__loss': 'mae'}. Best is trial 15 with value: 0.713745100510843.[0m
[32m[I 2022-12-24 17:08:44,470][0m Trial 44 finished with value: -0.18661123569510085 and parameters: {'regressor__regressor__batch_size': 170, 'regressor__regressor__epochs': 470, 'regressor__regressor__optimizer': 'Nadam', 'regressor__regressor__optimizer__learning_rate': 0.007562531236377729, 'regressor__regressor__model__init_mode': 'truncated_normal', 'regressor__regressor__model__activation': 'hard_sigmoid', 'regressor__regressor__model__dropout_rate': 0.10494231692920536, 'regressor__regressor__model__weight_constraint': 4.867857373932365, 'regressor__regressor__model__regu_L1': 5.339283132766598e-07, 'regressor__regressor__model__regu_L2': 1.0736970708885292e-05, 'regressor__regressor__model__n_layers': 5, 'regressor__regressor__model__n_units': 261, 'regressor__regressor__loss': 'mean_absolute_error'}. Best is trial 15 with value: 0.713745100510843.[0m
[32m[I 2022-12-24 17:09:38,655][0m Trial 47 finished with value: 0.45935997195251776 and parameters: {'regressor__regressor__batch_size': 100, 'regressor__regressor__epochs': 10, 'regressor__regressor__optimizer': 'Adagrad', 'regressor__regressor__optimizer__learning_rate': 0.0009424445424496239, 'regressor__regressor__model__init_mode': 'orthogonal', 'regressor__regressor__model__activation': 'elu', 'regressor__regressor__model__dropout_rate': 0.3293521359427143, 'regressor__regressor__model__weight_constraint': 5.244585529704769, 'regressor__regressor__model__regu_L1': 5.427302380924071e-06, 'regressor__regressor__model__regu_L2': 0.002303302251856226, 'regressor__regressor__model__n_layers': 3, 'regressor__regressor__model__n_units': 381, 'regressor__regressor__loss': 'mse'}. Best is trial 15 with value: 0.713745100510843.[0m
[32m[I 2022-12-24 17:10:52,770][0m Trial 48 finished with value: 0.46089812081011033 and parameters: {'regressor__regressor__batch_size': 110, 'regressor__regressor__epochs': 50, 'regressor__regressor__optimizer': 'Adagrad', 'regressor__regressor__optimizer__learning_rate': 0.0014343242401559945, 'regressor__regressor__model__init_mode': 'orthogonal', 'regressor__regressor__model__activation': 'elu', 'regressor__regressor__model__dropout_rate': 0.3605767371368506, 'regressor__regressor__model__weight_constraint': 5.296240634316544, 'regressor__regressor__model__regu_L1': 5.607620730010251e-06, 'regressor__regressor__model__regu_L2': 5.2846141209246616e-06, 'regressor__regressor__model__n_layers': 3, 'regressor__regressor__model__n_units': 141, 'regressor__regressor__loss': 'mse'}. Best is trial 15 with value: 0.713745100510843.[0m
[32m[I 2022-12-24 17:11:47,501][0m Trial 49 finished with value: 0.417521458680965 and parameters: {'regressor__regressor__batch_size': 200, 'regressor__regressor__epochs': 70, 'regressor__regressor__optimizer': 'Adagrad', 'regressor__regressor__optimizer__learning_rate': 0.0008997889291890169, 'regressor__regressor__model__init_mode': 'orthogonal', 'regressor__regressor__model__activation': 'elu', 'regressor__regressor__model__dropout_rate': 0.48409625958285885, 'regressor__regressor__model__weight_constraint': 6.028243343608609, 'regressor__regressor__model__regu_L1': 6.25621556429742e-05, 'regressor__regressor__model__regu_L2': 5.865958849465205e-06, 'regressor__regressor__model__n_layers': 5, 'regressor__regressor__model__n_units': 61, 'regressor__regressor__loss': 'mse'}. Best is trial 15 with value: 0.713745100510843.[0m
[32m[I 2022-12-24 17:12:45,468][0m Trial 46 finished with value: 0.34881585589801967 and parameters: {'regressor__regressor__batch_size': 170, 'regressor__regressor__epochs': 70, 'regressor__regressor__optimizer': 'Nadam', 'regressor__regressor__optimizer__learning_rate': 0.009660339163390975, 'regressor__regressor__model__init_mode': 'orthogonal', 'regressor__regressor__model__activation': 'softplus', 'regressor__regressor__model__dropout_rate': 0.3451547426969482, 'regressor__regressor__model__weight_constraint': 5.042438739571069, 'regressor__regressor__model__regu_L1': 7.147603935611345e-06, 'regressor__regressor__model__regu_L2': 8.285736152020396e-06, 'regressor__regressor__model__n_layers': 5, 'regressor__regressor__model__n_units': 381, 'regressor__regressor__loss': 'mean_absolute_error'}. Best is trial 15 with value: 0.713745100510843.[0m
[32m[I 2022-12-24 17:13:03,736][0m Trial 51 finished with value: 0.4550861129220974 and parameters: {'regressor__regressor__batch_size': 120, 'regressor__regressor__epochs': 10, 'regressor__regressor__optimizer': 'Adagrad', 'regressor__regressor__optimizer__learning_rate': 0.0009803301285632397, 'regressor__regressor__model__init_mode': 'orthogonal', 'regressor__regressor__model__activation': 'elu', 'regressor__regressor__model__dropout_rate': 0.36167651443118753, 'regressor__regressor__model__weight_constraint': 5.04493504372034, 'regressor__regressor__model__regu_L1': 7.40288819812169e-06, 'regressor__regressor__model__regu_L2': 8.175230262990478e-07, 'regressor__regressor__model__n_layers': 3, 'regressor__regressor__model__n_units': 141, 'regressor__regressor__loss': 'mse'}. Best is trial 15 with value: 0.713745100510843.[0m
[32m[I 2022-12-24 17:13:25,613][0m Trial 45 finished with value: -0.1661616279169188 and parameters: {'regressor__regressor__batch_size': 170, 'regressor__regressor__epochs': 330, 'regressor__regressor__optimizer': 'SGD', 'regressor__regressor__optimizer__learning_rate': 0.0008817124665598409, 'regressor__regressor__model__init_mode': 'orthogonal', 'regressor__regressor__model__activation': 'sigmoid', 'regressor__regressor__model__dropout_rate': 0.09734055834411522, 'regressor__regressor__model__weight_constraint': 5.025589234400498, 'regressor__regressor__model__regu_L1': 3.8555629563061473e-07, 'regressor__regressor__model__regu_L2': 8.102092471890264e-06, 'regressor__regressor__model__n_layers': 5, 'regressor__regressor__model__n_units': 261, 'regressor__regressor__loss': 'mean_absolute_error'}. Best is trial 15 with value: 0.713745100510843.[0m
[32m[I 2022-12-24 17:13:57,801][0m Trial 53 finished with value: -0.00016115000136442958 and parameters: {'regressor__regressor__batch_size': 110, 'regressor__regressor__epochs': 70, 'regressor__regressor__optimizer': 'Adagrad', 'regressor__regressor__optimizer__learning_rate': 0.0002589141122955232, 'regressor__regressor__model__init_mode': 'orthogonal', 'regressor__regressor__model__activation': 'elu', 'regressor__regressor__model__dropout_rate': 0.2949489024135988, 'regressor__regressor__model__weight_constraint': 6.516358805417346, 'regressor__regressor__model__regu_L1': 2.474214290341837e-05, 'regressor__regressor__model__regu_L2': 0.0017104847072343385, 'regressor__regressor__model__n_layers': 3, 'regressor__regressor__model__n_units': 1, 'regressor__regressor__loss': 'mse'}. Best is trial 15 with value: 0.713745100510843.[0m
[32m[I 2022-12-24 17:14:08,126][0m Trial 52 finished with value: 0.460723905126892 and parameters: {'regressor__regressor__batch_size': 110, 'regressor__regressor__epochs': 70, 'regressor__regressor__optimizer': 'Adagrad', 'regressor__regressor__optimizer__learning_rate': 0.0009175309400794414, 'regressor__regressor__model__init_mode': 'orthogonal', 'regressor__regressor__model__activation': 'elu', 'regressor__regressor__model__dropout_rate': 0.289034899189458, 'regressor__regressor__model__weight_constraint': 5.260660337244402, 'regressor__regressor__model__regu_L1': 2.8644837725343232e-05, 'regressor__regressor__model__regu_L2': 3.0677549372426173e-06, 'regressor__regressor__model__n_layers': 3, 'regressor__regressor__model__n_units': 121, 'regressor__regressor__loss': 'mse'}. Best is trial 15 with value: 0.713745100510843.[0m
[32m[I 2022-12-24 17:14:25,322][0m Trial 50 finished with value: 0.4642452856624467 and parameters: {'regressor__regressor__batch_size': 120, 'regressor__regressor__epochs': 190, 'regressor__regressor__optimizer': 'SGD', 'regressor__regressor__optimizer__learning_rate': 0.00936209840801496, 'regressor__regressor__model__init_mode': 'orthogonal', 'regressor__regressor__model__activation': 'softsign', 'regressor__regressor__model__dropout_rate': 0.30015035100851206, 'regressor__regressor__model__weight_constraint': 3.050135519182712, 'regressor__regressor__model__regu_L1': 6.605679667186255e-06, 'regressor__regressor__model__regu_L2': 4.489742432283488e-07, 'regressor__regressor__model__n_layers': 3, 'regressor__regressor__model__n_units': 141, 'regressor__regressor__loss': 'mse'}. Best is trial 15 with value: 0.713745100510843.[0m
[32m[I 2022-12-24 17:15:37,971][0m Trial 54 finished with value: 0.5045981860780472 and parameters: {'regressor__regressor__batch_size': 100, 'regressor__regressor__epochs': 190, 'regressor__regressor__optimizer': 'RMSprop', 'regressor__regressor__optimizer__learning_rate': 0.0007383058328885382, 'regressor__regressor__model__init_mode': 'orthogonal', 'regressor__regressor__model__activation': 'elu', 'regressor__regressor__model__dropout_rate': 0.2965774167518165, 'regressor__regressor__model__weight_constraint': 3.3767728037097986, 'regressor__regressor__model__regu_L1': 4.770297047426773e-06, 'regressor__regressor__model__regu_L2': 5.678486612550174e-07, 'regressor__regressor__model__n_layers': 3, 'regressor__regressor__model__n_units': 61, 'regressor__regressor__loss': 'mse'}. Best is trial 15 with value: 0.713745100510843.[0m
[32m[I 2022-12-24 17:15:46,363][0m Trial 55 finished with value: -0.02897585830740055 and parameters: {'regressor__regressor__batch_size': 150, 'regressor__regressor__epochs': 170, 'regressor__regressor__optimizer': 'RMSprop', 'regressor__regressor__optimizer__learning_rate': 0.003936881693356336, 'regressor__regressor__model__init_mode': 'ones', 'regressor__regressor__model__activation': 'softmax', 'regressor__regressor__model__dropout_rate': 0.26785188650609887, 'regressor__regressor__model__weight_constraint': 5.893978787297496, 'regressor__regressor__model__regu_L1': 0.0005140779198636566, 'regressor__regressor__model__regu_L2': 7.909890455398493e-07, 'regressor__regressor__model__n_layers': 7, 'regressor__regressor__model__n_units': 41, 'regressor__regressor__loss': 'log_cosh'}. Best is trial 15 with value: 0.713745100510843.[0m
[32m[I 2022-12-24 17:16:36,548][0m Trial 56 finished with value: 0.32948660974451516 and parameters: {'regressor__regressor__batch_size': 140, 'regressor__regressor__epochs': 190, 'regressor__regressor__optimizer': 'RMSprop', 'regressor__regressor__optimizer__learning_rate': 0.012769742212827437, 'regressor__regressor__model__init_mode': 'variance_scaling', 'regressor__regressor__model__activation': 'softsign', 'regressor__regressor__model__dropout_rate': 0.4106244390856455, 'regressor__regressor__model__weight_constraint': 3.357884514058107, 'regressor__regressor__model__regu_L1': 0.0002933154283418488, 'regressor__regressor__model__regu_L2': 5.371200385957832e-07, 'regressor__regressor__model__n_layers': 7, 'regressor__regressor__model__n_units': 61, 'regressor__regressor__loss': 'log_cosh'}. Best is trial 15 with value: 0.713745100510843.[0m
[32m[I 2022-12-24 17:17:37,896][0m Trial 57 finished with value: 0.43992757442334474 and parameters: {'regressor__regressor__batch_size': 140, 'regressor__regressor__epochs': 170, 'regressor__regressor__optimizer': 'RMSprop', 'regressor__regressor__optimizer__learning_rate': 0.012637001128184194, 'regressor__regressor__model__init_mode': 'variance_scaling', 'regressor__regressor__model__activation': 'softsign', 'regressor__regressor__model__dropout_rate': 0.4178052598852423, 'regressor__regressor__model__weight_constraint': 3.095232527429557, 'regressor__regressor__model__regu_L1': 9.459121299005976e-07, 'regressor__regressor__model__regu_L2': 6.299712512872404e-07, 'regressor__regressor__model__n_layers': 7, 'regressor__regressor__model__n_units': 61, 'regressor__regressor__loss': 'log_cosh'}. Best is trial 15 with value: 0.713745100510843.[0m
