[32m[I 2022-12-29 10:08:01,479][0m Trial 214 finished with value: 0.7562365060021963 and parameters: {'regressor__regressor__batch_size': 30, 'regressor__regressor__epochs': 410, 'regressor__regressor__optimizer': 'Nadam', 'regressor__regressor__optimizer__learning_rate': 8.740355989292705e-05, 'regressor__regressor__model__init_mode': 'glorot_normal', 'regressor__regressor__model__activation': 'elu', 'regressor__regressor__model__dropout_rate': 0.014305580263322803, 'regressor__regressor__model__weight_constraint': 3.508158233716755, 'regressor__regressor__model__regu_L1': 5.694277911431855e-07, 'regressor__regressor__model__regu_L2': 5.9786894769995814e-06, 'regressor__regressor__model__n_layers': 7, 'regressor__regressor__model__n_units': 421, 'regressor__regressor__loss': 'mean_absolute_error'}. Best is trial 199 with value: 0.7759054127864374.[0m
2022-12-29 10:08:08.457700: W tensorflow/compiler/xla/stream_executor/platform/default/dso_loader.cc:64] Could not load dynamic library 'libcudart.so.11.0'; dlerror: libcudart.so.11.0: cannot open shared object file: No such file or directory; LD_LIBRARY_PATH: /.singularity.d/libs
2022-12-29 10:08:11.519318: W tensorflow/compiler/xla/stream_executor/platform/default/dso_loader.cc:64] Could not load dynamic library 'libnvinfer.so.7'; dlerror: libnvinfer.so.7: cannot open shared object file: No such file or directory; LD_LIBRARY_PATH: /.singularity.d/libs
2022-12-29 10:08:11.519602: W tensorflow/compiler/xla/stream_executor/platform/default/dso_loader.cc:64] Could not load dynamic library 'libnvinfer_plugin.so.7'; dlerror: libnvinfer_plugin.so.7: cannot open shared object file: No such file or directory; LD_LIBRARY_PATH: /.singularity.d/libs
2022-12-29 10:08:11.519682: W tensorflow/compiler/tf2tensorrt/utils/py_utils.cc:38] TF-TRT Warning: Cannot dlopen some TensorRT libraries. If you would like to use Nvidia GPU with TensorRT, please make sure the missing libraries mentioned above are installed properly.
2022-12-29 10:08:15.249117: W tensorflow/compiler/xla/stream_executor/platform/default/dso_loader.cc:64] Could not load dynamic library 'libcuda.so.1'; dlerror: libcuda.so.1: cannot open shared object file: No such file or directory; LD_LIBRARY_PATH: /.singularity.d/libs
2022-12-29 10:08:15.249380: W tensorflow/compiler/xla/stream_executor/cuda/cuda_driver.cc:265] failed call to cuInit: UNKNOWN ERROR (303)
[32m[I 2022-12-29 13:26:53,697][0m Trial 216 finished with value: 0.7559366702989256 and parameters: {'regressor__regressor__batch_size': 30, 'regressor__regressor__epochs': 410, 'regressor__regressor__optimizer': 'Nadam', 'regressor__regressor__optimizer__learning_rate': 8.9300556665683e-05, 'regressor__regressor__model__init_mode': 'glorot_normal', 'regressor__regressor__model__activation': 'elu', 'regressor__regressor__model__dropout_rate': 0.012161246647648906, 'regressor__regressor__model__weight_constraint': 3.5061382307627484, 'regressor__regressor__model__regu_L1': 6.030932516006982e-07, 'regressor__regressor__model__regu_L2': 7.730913521001951e-06, 'regressor__regressor__model__n_layers': 7, 'regressor__regressor__model__n_units': 401, 'regressor__regressor__loss': 'mean_absolute_error'}. Best is trial 199 with value: 0.7759054127864374.[0m
[32m[I 2022-12-29 13:50:04,533][0m Trial 215 finished with value: 0.758042212590509 and parameters: {'regressor__regressor__batch_size': 20, 'regressor__regressor__epochs': 410, 'regressor__regressor__optimizer': 'Nadam', 'regressor__regressor__optimizer__learning_rate': 8.486852062830391e-05, 'regressor__regressor__model__init_mode': 'glorot_normal', 'regressor__regressor__model__activation': 'elu', 'regressor__regressor__model__dropout_rate': 0.00289413591811057, 'regressor__regressor__model__weight_constraint': 3.4894640279538742, 'regressor__regressor__model__regu_L1': 5.794378327831241e-07, 'regressor__regressor__model__regu_L2': 7.184666684372932e-06, 'regressor__regressor__model__n_layers': 7, 'regressor__regressor__model__n_units': 401, 'regressor__regressor__loss': 'mean_absolute_error'}. Best is trial 199 with value: 0.7759054127864374.[0m
2022-12-29 13:50:10.083977: W tensorflow/compiler/xla/stream_executor/platform/default/dso_loader.cc:64] Could not load dynamic library 'libcudart.so.11.0'; dlerror: libcudart.so.11.0: cannot open shared object file: No such file or directory; LD_LIBRARY_PATH: /.singularity.d/libs
2022-12-29 13:50:11.870507: W tensorflow/compiler/xla/stream_executor/platform/default/dso_loader.cc:64] Could not load dynamic library 'libnvinfer.so.7'; dlerror: libnvinfer.so.7: cannot open shared object file: No such file or directory; LD_LIBRARY_PATH: /.singularity.d/libs
2022-12-29 13:50:11.870669: W tensorflow/compiler/xla/stream_executor/platform/default/dso_loader.cc:64] Could not load dynamic library 'libnvinfer_plugin.so.7'; dlerror: libnvinfer_plugin.so.7: cannot open shared object file: No such file or directory; LD_LIBRARY_PATH: /.singularity.d/libs
2022-12-29 13:50:11.870695: W tensorflow/compiler/tf2tensorrt/utils/py_utils.cc:38] TF-TRT Warning: Cannot dlopen some TensorRT libraries. If you would like to use Nvidia GPU with TensorRT, please make sure the missing libraries mentioned above are installed properly.
2022-12-29 13:50:14.374248: W tensorflow/compiler/xla/stream_executor/platform/default/dso_loader.cc:64] Could not load dynamic library 'libcuda.so.1'; dlerror: libcuda.so.1: cannot open shared object file: No such file or directory; LD_LIBRARY_PATH: /.singularity.d/libs
2022-12-29 13:50:14.374354: W tensorflow/compiler/xla/stream_executor/cuda/cuda_driver.cc:265] failed call to cuInit: UNKNOWN ERROR (303)
[32m[I 2022-12-29 16:04:31,276][0m Trial 218 finished with value: 0.7615617017687368 and parameters: {'regressor__regressor__batch_size': 30, 'regressor__regressor__epochs': 430, 'regressor__regressor__optimizer': 'Nadam', 'regressor__regressor__optimizer__learning_rate': 8.446703107102304e-05, 'regressor__regressor__model__init_mode': 'glorot_normal', 'regressor__regressor__model__activation': 'elu', 'regressor__regressor__model__dropout_rate': 0.01707568471410071, 'regressor__regressor__model__weight_constraint': 3.4914128757258673, 'regressor__regressor__model__regu_L1': 7.365476783189218e-07, 'regressor__regressor__model__regu_L2': 7.1149300537880285e-06, 'regressor__regressor__model__n_layers': 7, 'regressor__regressor__model__n_units': 401, 'regressor__regressor__loss': 'mean_absolute_error'}. Best is trial 199 with value: 0.7759054127864374.[0m
2022-12-29 16:04:36.391508: W tensorflow/compiler/xla/stream_executor/platform/default/dso_loader.cc:64] Could not load dynamic library 'libcudart.so.11.0'; dlerror: libcudart.so.11.0: cannot open shared object file: No such file or directory; LD_LIBRARY_PATH: /.singularity.d/libs
2022-12-29 16:04:38.039399: W tensorflow/compiler/xla/stream_executor/platform/default/dso_loader.cc:64] Could not load dynamic library 'libnvinfer.so.7'; dlerror: libnvinfer.so.7: cannot open shared object file: No such file or directory; LD_LIBRARY_PATH: /.singularity.d/libs
2022-12-29 16:04:38.039579: W tensorflow/compiler/xla/stream_executor/platform/default/dso_loader.cc:64] Could not load dynamic library 'libnvinfer_plugin.so.7'; dlerror: libnvinfer_plugin.so.7: cannot open shared object file: No such file or directory; LD_LIBRARY_PATH: /.singularity.d/libs
2022-12-29 16:04:38.039621: W tensorflow/compiler/tf2tensorrt/utils/py_utils.cc:38] TF-TRT Warning: Cannot dlopen some TensorRT libraries. If you would like to use Nvidia GPU with TensorRT, please make sure the missing libraries mentioned above are installed properly.
2022-12-29 16:04:40.619648: W tensorflow/compiler/xla/stream_executor/platform/default/dso_loader.cc:64] Could not load dynamic library 'libcuda.so.1'; dlerror: libcuda.so.1: cannot open shared object file: No such file or directory; LD_LIBRARY_PATH: /.singularity.d/libs
2022-12-29 16:04:40.619734: W tensorflow/compiler/xla/stream_executor/cuda/cuda_driver.cc:265] failed call to cuInit: UNKNOWN ERROR (303)
[32m[I 2022-12-29 16:11:56,520][0m Trial 219 finished with value: 0.7611372461334891 and parameters: {'regressor__regressor__batch_size': 30, 'regressor__regressor__epochs': 410, 'regressor__regressor__optimizer': 'Nadam', 'regressor__regressor__optimizer__learning_rate': 9.0411563769452e-05, 'regressor__regressor__model__init_mode': 'glorot_normal', 'regressor__regressor__model__activation': 'elu', 'regressor__regressor__model__dropout_rate': 0.015339079555857227, 'regressor__regressor__model__weight_constraint': 3.4951600994530416, 'regressor__regressor__model__regu_L1': 5.977406542285729e-07, 'regressor__regressor__model__regu_L2': 6.807463963602999e-06, 'regressor__regressor__model__n_layers': 7, 'regressor__regressor__model__n_units': 401, 'regressor__regressor__loss': 'mean_absolute_error'}. Best is trial 199 with value: 0.7759054127864374.[0m
2022-12-29 16:12:02.377792: W tensorflow/compiler/xla/stream_executor/platform/default/dso_loader.cc:64] Could not load dynamic library 'libcudart.so.11.0'; dlerror: libcudart.so.11.0: cannot open shared object file: No such file or directory; LD_LIBRARY_PATH: /.singularity.d/libs
2022-12-29 16:12:04.152700: W tensorflow/compiler/xla/stream_executor/platform/default/dso_loader.cc:64] Could not load dynamic library 'libnvinfer.so.7'; dlerror: libnvinfer.so.7: cannot open shared object file: No such file or directory; LD_LIBRARY_PATH: /.singularity.d/libs
2022-12-29 16:12:04.152843: W tensorflow/compiler/xla/stream_executor/platform/default/dso_loader.cc:64] Could not load dynamic library 'libnvinfer_plugin.so.7'; dlerror: libnvinfer_plugin.so.7: cannot open shared object file: No such file or directory; LD_LIBRARY_PATH: /.singularity.d/libs
2022-12-29 16:12:04.152870: W tensorflow/compiler/tf2tensorrt/utils/py_utils.cc:38] TF-TRT Warning: Cannot dlopen some TensorRT libraries. If you would like to use Nvidia GPU with TensorRT, please make sure the missing libraries mentioned above are installed properly.
2022-12-29 16:12:06.583194: W tensorflow/compiler/xla/stream_executor/platform/default/dso_loader.cc:64] Could not load dynamic library 'libcuda.so.1'; dlerror: libcuda.so.1: cannot open shared object file: No such file or directory; LD_LIBRARY_PATH: /.singularity.d/libs
2022-12-29 16:12:06.583296: W tensorflow/compiler/xla/stream_executor/cuda/cuda_driver.cc:265] failed call to cuInit: UNKNOWN ERROR (303)
[32m[I 2022-12-29 16:17:09,467][0m Trial 217 finished with value: 0.7601425628335 and parameters: {'regressor__regressor__batch_size': 30, 'regressor__regressor__epochs': 410, 'regressor__regressor__optimizer': 'Nadam', 'regressor__regressor__optimizer__learning_rate': 8.882417036040423e-05, 'regressor__regressor__model__init_mode': 'glorot_normal', 'regressor__regressor__model__activation': 'elu', 'regressor__regressor__model__dropout_rate': 0.014302536704534841, 'regressor__regressor__model__weight_constraint': 3.49861349580389, 'regressor__regressor__model__regu_L1': 6.478582497252701e-07, 'regressor__regressor__model__regu_L2': 1.2291755197530484e-05, 'regressor__regressor__model__n_layers': 7, 'regressor__regressor__model__n_units': 401, 'regressor__regressor__loss': 'mean_absolute_error'}. Best is trial 199 with value: 0.7759054127864374.[0m
2022-12-29 16:17:16.267695: W tensorflow/compiler/xla/stream_executor/platform/default/dso_loader.cc:64] Could not load dynamic library 'libcudart.so.11.0'; dlerror: libcudart.so.11.0: cannot open shared object file: No such file or directory; LD_LIBRARY_PATH: /.singularity.d/libs
2022-12-29 16:17:18.537715: W tensorflow/compiler/xla/stream_executor/platform/default/dso_loader.cc:64] Could not load dynamic library 'libnvinfer.so.7'; dlerror: libnvinfer.so.7: cannot open shared object file: No such file or directory; LD_LIBRARY_PATH: /.singularity.d/libs
2022-12-29 16:17:18.538023: W tensorflow/compiler/xla/stream_executor/platform/default/dso_loader.cc:64] Could not load dynamic library 'libnvinfer_plugin.so.7'; dlerror: libnvinfer_plugin.so.7: cannot open shared object file: No such file or directory; LD_LIBRARY_PATH: /.singularity.d/libs
2022-12-29 16:17:18.538066: W tensorflow/compiler/tf2tensorrt/utils/py_utils.cc:38] TF-TRT Warning: Cannot dlopen some TensorRT libraries. If you would like to use Nvidia GPU with TensorRT, please make sure the missing libraries mentioned above are installed properly.
2022-12-29 16:17:22.476120: W tensorflow/compiler/xla/stream_executor/platform/default/dso_loader.cc:64] Could not load dynamic library 'libcuda.so.1'; dlerror: libcuda.so.1: cannot open shared object file: No such file or directory; LD_LIBRARY_PATH: /.singularity.d/libs
2022-12-29 16:17:22.476211: W tensorflow/compiler/xla/stream_executor/cuda/cuda_driver.cc:265] failed call to cuInit: UNKNOWN ERROR (303)
[32m[I 2022-12-29 18:50:44,290][0m Trial 220 finished with value: 0.7593885729637098 and parameters: {'regressor__regressor__batch_size': 30, 'regressor__regressor__epochs': 410, 'regressor__regressor__optimizer': 'Nadam', 'regressor__regressor__optimizer__learning_rate': 9.256372606198751e-05, 'regressor__regressor__model__init_mode': 'glorot_normal', 'regressor__regressor__model__activation': 'elu', 'regressor__regressor__model__dropout_rate': 0.015302778168403256, 'regressor__regressor__model__weight_constraint': 3.431847118004466, 'regressor__regressor__model__regu_L1': 6.144725081624706e-07, 'regressor__regressor__model__regu_L2': 6.738635313935507e-06, 'regressor__regressor__model__n_layers': 7, 'regressor__regressor__model__n_units': 421, 'regressor__regressor__loss': 'mean_absolute_error'}. Best is trial 199 with value: 0.7759054127864374.[0m
2022-12-29 18:50:50.150222: W tensorflow/compiler/xla/stream_executor/platform/default/dso_loader.cc:64] Could not load dynamic library 'libcudart.so.11.0'; dlerror: libcudart.so.11.0: cannot open shared object file: No such file or directory; LD_LIBRARY_PATH: /.singularity.d/libs
2022-12-29 18:50:52.054722: W tensorflow/compiler/xla/stream_executor/platform/default/dso_loader.cc:64] Could not load dynamic library 'libnvinfer.so.7'; dlerror: libnvinfer.so.7: cannot open shared object file: No such file or directory; LD_LIBRARY_PATH: /.singularity.d/libs
2022-12-29 18:50:52.054924: W tensorflow/compiler/xla/stream_executor/platform/default/dso_loader.cc:64] Could not load dynamic library 'libnvinfer_plugin.so.7'; dlerror: libnvinfer_plugin.so.7: cannot open shared object file: No such file or directory; LD_LIBRARY_PATH: /.singularity.d/libs
2022-12-29 18:50:52.054984: W tensorflow/compiler/tf2tensorrt/utils/py_utils.cc:38] TF-TRT Warning: Cannot dlopen some TensorRT libraries. If you would like to use Nvidia GPU with TensorRT, please make sure the missing libraries mentioned above are installed properly.
2022-12-29 18:50:54.812885: W tensorflow/compiler/xla/stream_executor/platform/default/dso_loader.cc:64] Could not load dynamic library 'libcuda.so.1'; dlerror: libcuda.so.1: cannot open shared object file: No such file or directory; LD_LIBRARY_PATH: /.singularity.d/libs
2022-12-29 18:50:54.813440: W tensorflow/compiler/xla/stream_executor/cuda/cuda_driver.cc:265] failed call to cuInit: UNKNOWN ERROR (303)
[32m[I 2022-12-29 19:58:56,416][0m Trial 221 finished with value: 0.7597819372031911 and parameters: {'regressor__regressor__batch_size': 30, 'regressor__regressor__epochs': 410, 'regressor__regressor__optimizer': 'Nadam', 'regressor__regressor__optimizer__learning_rate': 8.974476127123869e-05, 'regressor__regressor__model__init_mode': 'glorot_normal', 'regressor__regressor__model__activation': 'elu', 'regressor__regressor__model__dropout_rate': 0.019439833087901814, 'regressor__regressor__model__weight_constraint': 3.4705319110662676, 'regressor__regressor__model__regu_L1': 5.516577152803961e-07, 'regressor__regressor__model__regu_L2': 6.457711574882571e-06, 'regressor__regressor__model__n_layers': 7, 'regressor__regressor__model__n_units': 401, 'regressor__regressor__loss': 'mean_absolute_error'}. Best is trial 199 with value: 0.7759054127864374.[0m
2022-12-29 19:59:03.222495: W tensorflow/compiler/xla/stream_executor/platform/default/dso_loader.cc:64] Could not load dynamic library 'libcudart.so.11.0'; dlerror: libcudart.so.11.0: cannot open shared object file: No such file or directory; LD_LIBRARY_PATH: /.singularity.d/libs
2022-12-29 19:59:05.130171: W tensorflow/compiler/xla/stream_executor/platform/default/dso_loader.cc:64] Could not load dynamic library 'libnvinfer.so.7'; dlerror: libnvinfer.so.7: cannot open shared object file: No such file or directory; LD_LIBRARY_PATH: /.singularity.d/libs
2022-12-29 19:59:05.130446: W tensorflow/compiler/xla/stream_executor/platform/default/dso_loader.cc:64] Could not load dynamic library 'libnvinfer_plugin.so.7'; dlerror: libnvinfer_plugin.so.7: cannot open shared object file: No such file or directory; LD_LIBRARY_PATH: /.singularity.d/libs
2022-12-29 19:59:05.130480: W tensorflow/compiler/tf2tensorrt/utils/py_utils.cc:38] TF-TRT Warning: Cannot dlopen some TensorRT libraries. If you would like to use Nvidia GPU with TensorRT, please make sure the missing libraries mentioned above are installed properly.
2022-12-29 19:59:07.859712: W tensorflow/compiler/xla/stream_executor/platform/default/dso_loader.cc:64] Could not load dynamic library 'libcuda.so.1'; dlerror: libcuda.so.1: cannot open shared object file: No such file or directory; LD_LIBRARY_PATH: /.singularity.d/libs
2022-12-29 19:59:07.859817: W tensorflow/compiler/xla/stream_executor/cuda/cuda_driver.cc:265] failed call to cuInit: UNKNOWN ERROR (303)
[32m[I 2022-12-29 21:41:49,486][0m Trial 222 finished with value: 0.7607957214709924 and parameters: {'regressor__regressor__batch_size': 30, 'regressor__regressor__epochs': 410, 'regressor__regressor__optimizer': 'Nadam', 'regressor__regressor__optimizer__learning_rate': 9.112425340532797e-05, 'regressor__regressor__model__init_mode': 'glorot_normal', 'regressor__regressor__model__activation': 'elu', 'regressor__regressor__model__dropout_rate': 0.01731818335908526, 'regressor__regressor__model__weight_constraint': 3.4665671296946785, 'regressor__regressor__model__regu_L1': 6.776958033192776e-07, 'regressor__regressor__model__regu_L2': 7.075809261196663e-06, 'regressor__regressor__model__n_layers': 7, 'regressor__regressor__model__n_units': 401, 'regressor__regressor__loss': 'mean_absolute_error'}. Best is trial 199 with value: 0.7759054127864374.[0m
2022-12-29 21:41:54.695362: W tensorflow/compiler/xla/stream_executor/platform/default/dso_loader.cc:64] Could not load dynamic library 'libcudart.so.11.0'; dlerror: libcudart.so.11.0: cannot open shared object file: No such file or directory; LD_LIBRARY_PATH: /.singularity.d/libs
2022-12-29 21:41:55.972326: W tensorflow/compiler/xla/stream_executor/platform/default/dso_loader.cc:64] Could not load dynamic library 'libnvinfer.so.7'; dlerror: libnvinfer.so.7: cannot open shared object file: No such file or directory; LD_LIBRARY_PATH: /.singularity.d/libs
2022-12-29 21:41:55.972466: W tensorflow/compiler/xla/stream_executor/platform/default/dso_loader.cc:64] Could not load dynamic library 'libnvinfer_plugin.so.7'; dlerror: libnvinfer_plugin.so.7: cannot open shared object file: No such file or directory; LD_LIBRARY_PATH: /.singularity.d/libs
2022-12-29 21:41:55.972491: W tensorflow/compiler/tf2tensorrt/utils/py_utils.cc:38] TF-TRT Warning: Cannot dlopen some TensorRT libraries. If you would like to use Nvidia GPU with TensorRT, please make sure the missing libraries mentioned above are installed properly.
2022-12-29 21:41:58.038493: W tensorflow/compiler/xla/stream_executor/platform/default/dso_loader.cc:64] Could not load dynamic library 'libcuda.so.1'; dlerror: libcuda.so.1: cannot open shared object file: No such file or directory; LD_LIBRARY_PATH: /.singularity.d/libs
2022-12-29 21:41:58.038605: W tensorflow/compiler/xla/stream_executor/cuda/cuda_driver.cc:265] failed call to cuInit: UNKNOWN ERROR (303)
