[32m[I 2022-12-24 19:01:09,411][0m Trial 78 finished with value: 0.5313101836765824 and parameters: {'regressor__regressor__batch_size': 40, 'regressor__regressor__epochs': 230, 'regressor__regressor__optimizer': 'Adam', 'regressor__regressor__optimizer__learning_rate': 7.609499457381718e-05, 'regressor__regressor__model__init_mode': 'glorot_uniform', 'regressor__regressor__model__activation': 'selu', 'regressor__regressor__model__dropout_rate': 0.1393040218874081, 'regressor__regressor__model__weight_constraint': 2.0256149399984147, 'regressor__regressor__model__regu_L1': 1.4495746924466137e-06, 'regressor__regressor__model__regu_L2': 0.00017639190149457942, 'regressor__regressor__model__n_layers': 15, 'regressor__regressor__model__n_units': 201, 'regressor__regressor__loss': 'huber'}. Best is trial 15 with value: 0.713745100510843.[0m
[32m[I 2022-12-24 19:04:25,832][0m Trial 79 finished with value: 0.5136769820345476 and parameters: {'regressor__regressor__batch_size': 50, 'regressor__regressor__epochs': 230, 'regressor__regressor__optimizer': 'Adamax', 'regressor__regressor__optimizer__learning_rate': 6.860886318657524e-05, 'regressor__regressor__model__init_mode': 'glorot_uniform', 'regressor__regressor__model__activation': 'selu', 'regressor__regressor__model__dropout_rate': 0.03999909169939074, 'regressor__regressor__model__weight_constraint': 1.9797539956875934, 'regressor__regressor__model__regu_L1': 0.00013699284430035191, 'regressor__regressor__model__regu_L2': 0.00015718586800751144, 'regressor__regressor__model__n_layers': 17, 'regressor__regressor__model__n_units': 201, 'regressor__regressor__loss': 'huber'}. Best is trial 15 with value: 0.713745100510843.[0m
[32m[I 2022-12-24 19:08:46,677][0m Trial 75 finished with value: 0.4712226198807996 and parameters: {'regressor__regressor__batch_size': 20, 'regressor__regressor__epochs': 230, 'regressor__regressor__optimizer': 'Adam', 'regressor__regressor__optimizer__learning_rate': 0.00014062047269223322, 'regressor__regressor__model__init_mode': 'glorot_uniform', 'regressor__regressor__model__activation': 'selu', 'regressor__regressor__model__dropout_rate': 0.14295895612292037, 'regressor__regressor__model__weight_constraint': 1.7016186225249328, 'regressor__regressor__model__regu_L1': 5.669059507523157e-05, 'regressor__regressor__model__regu_L2': 1.4070319158505728e-06, 'regressor__regressor__model__n_layers': 15, 'regressor__regressor__model__n_units': 201, 'regressor__regressor__loss': 'huber'}. Best is trial 15 with value: 0.713745100510843.[0m
[32m[I 2022-12-24 19:18:39,657][0m Trial 77 finished with value: 0.6598322470447052 and parameters: {'regressor__regressor__batch_size': 40, 'regressor__regressor__epochs': 310, 'regressor__regressor__optimizer': 'Adam', 'regressor__regressor__optimizer__learning_rate': 0.00017398226360294713, 'regressor__regressor__model__init_mode': 'lecun_uniform', 'regressor__regressor__model__activation': 'selu', 'regressor__regressor__model__dropout_rate': 0.0013969541546594594, 'regressor__regressor__model__weight_constraint': 2.030138133548341, 'regressor__regressor__model__regu_L1': 3.8115054436425084e-05, 'regressor__regressor__model__regu_L2': 0.00011799549452645831, 'regressor__regressor__model__n_layers': 15, 'regressor__regressor__model__n_units': 201, 'regressor__regressor__loss': 'huber'}. Best is trial 15 with value: 0.713745100510843.[0m
2022-12-24 19:18:45.371476: W tensorflow/compiler/xla/stream_executor/platform/default/dso_loader.cc:64] Could not load dynamic library 'libcudart.so.11.0'; dlerror: libcudart.so.11.0: cannot open shared object file: No such file or directory; LD_LIBRARY_PATH: /.singularity.d/libs
2022-12-24 19:18:46.180636: W tensorflow/compiler/xla/stream_executor/platform/default/dso_loader.cc:64] Could not load dynamic library 'libnvinfer.so.7'; dlerror: libnvinfer.so.7: cannot open shared object file: No such file or directory; LD_LIBRARY_PATH: /.singularity.d/libs
2022-12-24 19:18:46.180790: W tensorflow/compiler/xla/stream_executor/platform/default/dso_loader.cc:64] Could not load dynamic library 'libnvinfer_plugin.so.7'; dlerror: libnvinfer_plugin.so.7: cannot open shared object file: No such file or directory; LD_LIBRARY_PATH: /.singularity.d/libs
2022-12-24 19:18:46.180824: W tensorflow/compiler/tf2tensorrt/utils/py_utils.cc:38] TF-TRT Warning: Cannot dlopen some TensorRT libraries. If you would like to use Nvidia GPU with TensorRT, please make sure the missing libraries mentioned above are installed properly.
2022-12-24 19:18:47.336580: W tensorflow/compiler/xla/stream_executor/platform/default/dso_loader.cc:64] Could not load dynamic library 'libcuda.so.1'; dlerror: libcuda.so.1: cannot open shared object file: No such file or directory; LD_LIBRARY_PATH: /.singularity.d/libs
2022-12-24 19:18:47.336985: W tensorflow/compiler/xla/stream_executor/cuda/cuda_driver.cc:265] failed call to cuInit: UNKNOWN ERROR (303)
[32m[I 2022-12-24 19:37:31,928][0m Trial 80 finished with value: 0.5174536844637794 and parameters: {'regressor__regressor__batch_size': 50, 'regressor__regressor__epochs': 230, 'regressor__regressor__optimizer': 'Adam', 'regressor__regressor__optimizer__learning_rate': 7.660475803213787e-05, 'regressor__regressor__model__init_mode': 'lecun_uniform', 'regressor__regressor__model__activation': 'selu', 'regressor__regressor__model__dropout_rate': 0.033096462754938646, 'regressor__regressor__model__weight_constraint': 2.1022347268921857, 'regressor__regressor__model__regu_L1': 0.00011382702844583486, 'regressor__regressor__model__regu_L2': 3.3455615256262384e-05, 'regressor__regressor__model__n_layers': 15, 'regressor__regressor__model__n_units': 201, 'regressor__regressor__loss': 'huber'}. Best is trial 15 with value: 0.713745100510843.[0m
[32m[I 2022-12-24 19:45:24,247][0m Trial 81 finished with value: 0.25490718990830813 and parameters: {'regressor__regressor__batch_size': 60, 'regressor__regressor__epochs': 230, 'regressor__regressor__optimizer': 'Adam', 'regressor__regressor__optimizer__learning_rate': 0.00024538835897899196, 'regressor__regressor__model__init_mode': 'lecun_uniform', 'regressor__regressor__model__activation': 'relu', 'regressor__regressor__model__dropout_rate': 0.03442708804546456, 'regressor__regressor__model__weight_constraint': 2.358182486565542, 'regressor__regressor__model__regu_L1': 0.0001308735460109072, 'regressor__regressor__model__regu_L2': 2.4678570327021825e-05, 'regressor__regressor__model__n_layers': 17, 'regressor__regressor__model__n_units': 221, 'regressor__regressor__loss': 'huber'}. Best is trial 15 with value: 0.713745100510843.[0m
[32m[I 2022-12-24 19:59:18,652][0m Trial 82 finished with value: 0.4884022868295574 and parameters: {'regressor__regressor__batch_size': 60, 'regressor__regressor__epochs': 310, 'regressor__regressor__optimizer': 'Adam', 'regressor__regressor__optimizer__learning_rate': 0.000258840257859592, 'regressor__regressor__model__init_mode': 'lecun_uniform', 'regressor__regressor__model__activation': 'relu', 'regressor__regressor__model__dropout_rate': 0.010290666320687685, 'regressor__regressor__model__weight_constraint': 2.332800742333362, 'regressor__regressor__model__regu_L1': 1.920217814740073e-07, 'regressor__regressor__model__regu_L2': 2.324114076204892e-05, 'regressor__regressor__model__n_layers': 15, 'regressor__regressor__model__n_units': 221, 'regressor__regressor__loss': 'mape'}. Best is trial 15 with value: 0.713745100510843.[0m
[32m[I 2022-12-24 20:03:32,825][0m Trial 83 finished with value: 0.006883708877628958 and parameters: {'regressor__regressor__batch_size': 60, 'regressor__regressor__epochs': 310, 'regressor__regressor__optimizer': 'Adadelta', 'regressor__regressor__optimizer__learning_rate': 0.0002544086298729555, 'regressor__regressor__model__init_mode': 'lecun_uniform', 'regressor__regressor__model__activation': 'relu', 'regressor__regressor__model__dropout_rate': 0.0018029203256676452, 'regressor__regressor__model__weight_constraint': 4.395050502302767, 'regressor__regressor__model__regu_L1': 0.00010932830348924579, 'regressor__regressor__model__regu_L2': 3.3009089245851894e-05, 'regressor__regressor__model__n_layers': 13, 'regressor__regressor__model__n_units': 221, 'regressor__regressor__loss': 'mape'}. Best is trial 15 with value: 0.713745100510843.[0m
[32m[I 2022-12-24 20:22:29,548][0m Trial 84 finished with value: -0.0006204625450211831 and parameters: {'regressor__regressor__batch_size': 60, 'regressor__regressor__epochs': 310, 'regressor__regressor__optimizer': 'Adadelta', 'regressor__regressor__optimizer__learning_rate': 0.00022691317043926958, 'regressor__regressor__model__init_mode': 'lecun_uniform', 'regressor__regressor__model__activation': 'relu', 'regressor__regressor__model__dropout_rate': 0.8493818191925959, 'regressor__regressor__model__weight_constraint': 2.3907882032442753, 'regressor__regressor__model__regu_L1': 0.00013466378815755054, 'regressor__regressor__model__regu_L2': 2.474906550190669e-05, 'regressor__regressor__model__n_layers': 13, 'regressor__regressor__model__n_units': 241, 'regressor__regressor__loss': 'huber'}. Best is trial 15 with value: 0.713745100510843.[0m
[32m[I 2022-12-24 20:32:27,856][0m Trial 86 finished with value: 0.03425245562314026 and parameters: {'regressor__regressor__batch_size': 40, 'regressor__regressor__epochs': 310, 'regressor__regressor__optimizer': 'Adadelta', 'regressor__regressor__optimizer__learning_rate': 0.0005650922197332413, 'regressor__regressor__model__init_mode': 'lecun_uniform', 'regressor__regressor__model__activation': 'relu', 'regressor__regressor__model__dropout_rate': 0.006367370024837416, 'regressor__regressor__model__weight_constraint': 4.1929525454858165, 'regressor__regressor__model__regu_L1': 2.9898652294607496e-05, 'regressor__regressor__model__regu_L2': 0.0006243058059767347, 'regressor__regressor__model__n_layers': 13, 'regressor__regressor__model__n_units': 161, 'regressor__regressor__loss': 'mape'}. Best is trial 15 with value: 0.713745100510843.[0m
[32m[I 2022-12-24 20:43:09,810][0m Trial 87 finished with value: -0.032689039670398067 and parameters: {'regressor__regressor__batch_size': 40, 'regressor__regressor__epochs': 310, 'regressor__regressor__optimizer': 'Adadelta', 'regressor__regressor__optimizer__learning_rate': 0.0003659236468037748, 'regressor__regressor__model__init_mode': 'constant', 'regressor__regressor__model__activation': 'tanh', 'regressor__regressor__model__dropout_rate': 0.07841572615841383, 'regressor__regressor__model__weight_constraint': 4.268792253858601, 'regressor__regressor__model__regu_L1': 4.062344478178986e-05, 'regressor__regressor__model__regu_L2': 0.00011546752921519907, 'regressor__regressor__model__n_layers': 13, 'regressor__regressor__model__n_units': 161, 'regressor__regressor__loss': 'huber'}. Best is trial 15 with value: 0.713745100510843.[0m
[32m[I 2022-12-24 20:57:02,341][0m Trial 85 finished with value: 0.013676915840884974 and parameters: {'regressor__regressor__batch_size': 40, 'regressor__regressor__epochs': 310, 'regressor__regressor__optimizer': 'Adadelta', 'regressor__regressor__optimizer__learning_rate': 0.00025047483824274707, 'regressor__regressor__model__init_mode': 'lecun_uniform', 'regressor__regressor__model__activation': 'relu', 'regressor__regressor__model__dropout_rate': 0.006553023559933466, 'regressor__regressor__model__weight_constraint': 2.369083170795084, 'regressor__regressor__model__regu_L1': 3.6293467000904784e-05, 'regressor__regressor__model__regu_L2': 8.45268892306307e-05, 'regressor__regressor__model__n_layers': 13, 'regressor__regressor__model__n_units': 241, 'regressor__regressor__loss': 'mape'}. Best is trial 15 with value: 0.713745100510843.[0m
[32m[I 2022-12-24 21:21:39,468][0m Trial 88 finished with value: -0.035433081423129245 and parameters: {'regressor__regressor__batch_size': 40, 'regressor__regressor__epochs': 510, 'regressor__regressor__optimizer': 'Adam', 'regressor__regressor__optimizer__learning_rate': 0.0006003942137609826, 'regressor__regressor__model__init_mode': 'zero', 'regressor__regressor__model__activation': 'tanh', 'regressor__regressor__model__dropout_rate': 0.0756220111193326, 'regressor__regressor__model__weight_constraint': 1.373930550877447, 'regressor__regressor__model__regu_L1': 3.10265680413619e-05, 'regressor__regressor__model__regu_L2': 9.108801666079287e-05, 'regressor__regressor__model__n_layers': 19, 'regressor__regressor__model__n_units': 161, 'regressor__regressor__loss': 'huber'}. Best is trial 15 with value: 0.713745100510843.[0m
[32m[I 2022-12-24 21:29:47,757][0m Trial 89 finished with value: 0.43230719637615483 and parameters: {'regressor__regressor__batch_size': 40, 'regressor__regressor__epochs': 450, 'regressor__regressor__optimizer': 'Adam', 'regressor__regressor__optimizer__learning_rate': 0.0005137455744162764, 'regressor__regressor__model__init_mode': 'lecun_uniform', 'regressor__regressor__model__activation': 'tanh', 'regressor__regressor__model__dropout_rate': 0.2485492410770758, 'regressor__regressor__model__weight_constraint': 1.342361918859868, 'regressor__regressor__model__regu_L1': 3.522456736628438e-05, 'regressor__regressor__model__regu_L2': 0.00010326370381427619, 'regressor__regressor__model__n_layers': 19, 'regressor__regressor__model__n_units': 161, 'regressor__regressor__loss': 'huber'}. Best is trial 15 with value: 0.713745100510843.[0m
[32m[I 2022-12-24 22:39:48,233][0m Trial 90 finished with value: -0.03559054012396581 and parameters: {'regressor__regressor__batch_size': 10, 'regressor__regressor__epochs': 450, 'regressor__regressor__optimizer': 'Adam', 'regressor__regressor__optimizer__learning_rate': 5.453985289381233e-05, 'regressor__regressor__model__init_mode': 'zero', 'regressor__regressor__model__activation': 'tanh', 'regressor__regressor__model__dropout_rate': 0.088540825600559, 'regressor__regressor__model__weight_constraint': 1.282787626703008, 'regressor__regressor__model__regu_L1': 1.0235643263277505e-05, 'regressor__regressor__model__regu_L2': 0.00011344793865047447, 'regressor__regressor__model__n_layers': 19, 'regressor__regressor__model__n_units': 121, 'regressor__regressor__loss': 'huber'}. Best is trial 15 with value: 0.713745100510843.[0m
[32m[I 2022-12-24 22:53:51,549][0m Trial 91 finished with value: -0.03568408984727167 and parameters: {'regressor__regressor__batch_size': 10, 'regressor__regressor__epochs': 450, 'regressor__regressor__optimizer': 'Adam', 'regressor__regressor__optimizer__learning_rate': 1.785189379885758e-05, 'regressor__regressor__model__init_mode': 'zero', 'regressor__regressor__model__activation': 'selu', 'regressor__regressor__model__dropout_rate': 0.20784636503143944, 'regressor__regressor__model__weight_constraint': 1.3034354970627113, 'regressor__regressor__model__regu_L1': 1.4654908387399976e-05, 'regressor__regressor__model__regu_L2': 5.346251483276861e-05, 'regressor__regressor__model__n_layers': 19, 'regressor__regressor__model__n_units': 121, 'regressor__regressor__loss': 'huber'}. Best is trial 15 with value: 0.713745100510843.[0m
-0.0007101280211405881
2022-12-24 22:53:57.299566: W tensorflow/compiler/xla/stream_executor/platform/default/dso_loader.cc:64] Could not load dynamic library 'libcudart.so.11.0'; dlerror: libcudart.so.11.0: cannot open shared object file: No such file or directory; LD_LIBRARY_PATH: /.singularity.d/libs
2022-12-24 22:53:58.032586: W tensorflow/compiler/xla/stream_executor/platform/default/dso_loader.cc:64] Could not load dynamic library 'libnvinfer.so.7'; dlerror: libnvinfer.so.7: cannot open shared object file: No such file or directory; LD_LIBRARY_PATH: /.singularity.d/libs
2022-12-24 22:53:58.032685: W tensorflow/compiler/xla/stream_executor/platform/default/dso_loader.cc:64] Could not load dynamic library 'libnvinfer_plugin.so.7'; dlerror: libnvinfer_plugin.so.7: cannot open shared object file: No such file or directory; LD_LIBRARY_PATH: /.singularity.d/libs
2022-12-24 22:53:58.032705: W tensorflow/compiler/tf2tensorrt/utils/py_utils.cc:38] TF-TRT Warning: Cannot dlopen some TensorRT libraries. If you would like to use Nvidia GPU with TensorRT, please make sure the missing libraries mentioned above are installed properly.
2022-12-24 22:53:59.083459: W tensorflow/compiler/xla/stream_executor/platform/default/dso_loader.cc:64] Could not load dynamic library 'libcuda.so.1'; dlerror: libcuda.so.1: cannot open shared object file: No such file or directory; LD_LIBRARY_PATH: /.singularity.d/libs
2022-12-24 22:53:59.083536: W tensorflow/compiler/xla/stream_executor/cuda/cuda_driver.cc:265] failed call to cuInit: UNKNOWN ERROR (303)
[32m[I 2022-12-24 23:12:00,744][0m Trial 93 finished with value: -0.03998666355776821 and parameters: {'regressor__regressor__batch_size': 10, 'regressor__regressor__epochs': 430, 'regressor__regressor__optimizer': 'Adam', 'regressor__regressor__optimizer__learning_rate': 8.941844503012673e-05, 'regressor__regressor__model__init_mode': 'identity', 'regressor__regressor__model__activation': 'sigmoid', 'regressor__regressor__model__dropout_rate': 0.2409475170763986, 'regressor__regressor__model__weight_constraint': 3.675773588056733, 'regressor__regressor__model__regu_L1': 1.0928464133293464e-05, 'regressor__regressor__model__regu_L2': 5.768890259196017e-05, 'regressor__regressor__model__n_layers': 17, 'regressor__regressor__model__n_units': 121, 'regressor__regressor__loss': 'huber'}. Best is trial 15 with value: 0.713745100510843.[0m
[32m[I 2022-12-24 23:13:33,329][0m Trial 92 finished with value: -0.03582436862738856 and parameters: {'regressor__regressor__batch_size': 10, 'regressor__regressor__epochs': 450, 'regressor__regressor__optimizer': 'Adam', 'regressor__regressor__optimizer__learning_rate': 0.00010489729540755616, 'regressor__regressor__model__init_mode': 'zero', 'regressor__regressor__model__activation': 'softmax', 'regressor__regressor__model__dropout_rate': 0.21642704425154835, 'regressor__regressor__model__weight_constraint': 1.3243572219407016, 'regressor__regressor__model__regu_L1': 1.5248571589322821e-05, 'regressor__regressor__model__regu_L2': 9.513494384324927e-06, 'regressor__regressor__model__n_layers': 19, 'regressor__regressor__model__n_units': 121, 'regressor__regressor__loss': 'huber'}. Best is trial 15 with value: 0.713745100510843.[0m
[32m[I 2022-12-24 23:31:47,053][0m Trial 94 finished with value: -0.03644623133182414 and parameters: {'regressor__regressor__batch_size': 10, 'regressor__regressor__epochs': 390, 'regressor__regressor__optimizer': 'Nadam', 'regressor__regressor__optimizer__learning_rate': 4.953458451346979e-05, 'regressor__regressor__model__init_mode': 'uniform', 'regressor__regressor__model__activation': 'sigmoid', 'regressor__regressor__model__dropout_rate': 0.2166386369431228, 'regressor__regressor__model__weight_constraint': 1.8704335348262184, 'regressor__regressor__model__regu_L1': 1.0368049808213904e-05, 'regressor__regressor__model__regu_L2': 4.735228532915681e-05, 'regressor__regressor__model__n_layers': 17, 'regressor__regressor__model__n_units': 121, 'regressor__regressor__loss': 'huber'}. Best is trial 15 with value: 0.713745100510843.[0m
[32m[I 2022-12-24 23:43:01,582][0m Trial 97 finished with value: 0.49368175238252565 and parameters: {'regressor__regressor__batch_size': 70, 'regressor__regressor__epochs': 250, 'regressor__regressor__optimizer': 'Nadam', 'regressor__regressor__optimizer__learning_rate': 0.0001809563942960753, 'regressor__regressor__model__init_mode': 'glorot_uniform', 'regressor__regressor__model__activation': 'selu', 'regressor__regressor__model__dropout_rate': 0.13104410269631783, 'regressor__regressor__model__weight_constraint': 1.9411191794741294, 'regressor__regressor__model__regu_L1': 1.874922642449579e-05, 'regressor__regressor__model__regu_L2': 0.0007353092286923855, 'regressor__regressor__model__n_layers': 15, 'regressor__regressor__model__n_units': 181, 'regressor__regressor__loss': 'huber'}. Best is trial 15 with value: 0.713745100510843.[0m
[32m[I 2022-12-24 23:45:16,080][0m Trial 98 finished with value: 0.524138503795816 and parameters: {'regressor__regressor__batch_size': 70, 'regressor__regressor__epochs': 250, 'regressor__regressor__optimizer': 'Nadam', 'regressor__regressor__optimizer__learning_rate': 5.158063166960937e-05, 'regressor__regressor__model__init_mode': 'normal', 'regressor__regressor__model__activation': 'selu', 'regressor__regressor__model__dropout_rate': 0.10741428726703597, 'regressor__regressor__model__weight_constraint': 1.8544252622404171, 'regressor__regressor__model__regu_L1': 1.4801866298590874e-06, 'regressor__regressor__model__regu_L2': 0.00046805719890608466, 'regressor__regressor__model__n_layers': 15, 'regressor__regressor__model__n_units': 181, 'regressor__regressor__loss': 'huber'}. Best is trial 15 with value: 0.713745100510843.[0m
