[32m[I 2022-12-28 23:02:11,890][0m Trial 205 finished with value: 0.7277507462503703 and parameters: {'regressor__regressor__batch_size': 30, 'regressor__regressor__epochs': 490, 'regressor__regressor__optimizer': 'Nadam', 'regressor__regressor__optimizer__learning_rate': 9.64259732880747e-05, 'regressor__regressor__model__init_mode': 'glorot_normal', 'regressor__regressor__model__activation': 'softsign', 'regressor__regressor__model__dropout_rate': 0.013178740201182787, 'regressor__regressor__model__weight_constraint': 3.7383073592802516, 'regressor__regressor__model__regu_L1': 5.574246268772234e-07, 'regressor__regressor__model__regu_L2': 5.613145153022515e-07, 'regressor__regressor__model__n_layers': 7, 'regressor__regressor__model__n_units': 441, 'regressor__regressor__loss': 'mean_absolute_error'}. Best is trial 199 with value: 0.7759054127864374.[0m
2022-12-28 23:02:17.604692: W tensorflow/compiler/xla/stream_executor/platform/default/dso_loader.cc:64] Could not load dynamic library 'libcudart.so.11.0'; dlerror: libcudart.so.11.0: cannot open shared object file: No such file or directory; LD_LIBRARY_PATH: /.singularity.d/libs
2022-12-28 23:02:19.751690: W tensorflow/compiler/xla/stream_executor/platform/default/dso_loader.cc:64] Could not load dynamic library 'libnvinfer.so.7'; dlerror: libnvinfer.so.7: cannot open shared object file: No such file or directory; LD_LIBRARY_PATH: /.singularity.d/libs
2022-12-28 23:02:19.751799: W tensorflow/compiler/xla/stream_executor/platform/default/dso_loader.cc:64] Could not load dynamic library 'libnvinfer_plugin.so.7'; dlerror: libnvinfer_plugin.so.7: cannot open shared object file: No such file or directory; LD_LIBRARY_PATH: /.singularity.d/libs
2022-12-28 23:02:19.751828: W tensorflow/compiler/tf2tensorrt/utils/py_utils.cc:38] TF-TRT Warning: Cannot dlopen some TensorRT libraries. If you would like to use Nvidia GPU with TensorRT, please make sure the missing libraries mentioned above are installed properly.
2022-12-28 23:02:23.016135: W tensorflow/compiler/xla/stream_executor/platform/default/dso_loader.cc:64] Could not load dynamic library 'libcuda.so.1'; dlerror: libcuda.so.1: cannot open shared object file: No such file or directory; LD_LIBRARY_PATH: /.singularity.d/libs
2022-12-28 23:02:23.016316: W tensorflow/compiler/xla/stream_executor/cuda/cuda_driver.cc:265] failed call to cuInit: UNKNOWN ERROR (303)
[32m[I 2022-12-29 01:05:24,294][0m Trial 206 finished with value: 0.7757757963683181 and parameters: {'regressor__regressor__batch_size': 30, 'regressor__regressor__epochs': 490, 'regressor__regressor__optimizer': 'Nadam', 'regressor__regressor__optimizer__learning_rate': 8.161510903237796e-05, 'regressor__regressor__model__init_mode': 'glorot_normal', 'regressor__regressor__model__activation': 'elu', 'regressor__regressor__model__dropout_rate': 0.013582803120467413, 'regressor__regressor__model__weight_constraint': 3.5090424883065388, 'regressor__regressor__model__regu_L1': 5.476191960116701e-07, 'regressor__regressor__model__regu_L2': 5.653144531618133e-07, 'regressor__regressor__model__n_layers': 9, 'regressor__regressor__model__n_units': 441, 'regressor__regressor__loss': 'mean_absolute_error'}. Best is trial 199 with value: 0.7759054127864374.[0m
2022-12-29 01:05:30.462059: W tensorflow/compiler/xla/stream_executor/platform/default/dso_loader.cc:64] Could not load dynamic library 'libcudart.so.11.0'; dlerror: libcudart.so.11.0: cannot open shared object file: No such file or directory; LD_LIBRARY_PATH: /.singularity.d/libs
2022-12-29 01:05:31.991210: W tensorflow/compiler/xla/stream_executor/platform/default/dso_loader.cc:64] Could not load dynamic library 'libnvinfer.so.7'; dlerror: libnvinfer.so.7: cannot open shared object file: No such file or directory; LD_LIBRARY_PATH: /.singularity.d/libs
2022-12-29 01:05:31.991363: W tensorflow/compiler/xla/stream_executor/platform/default/dso_loader.cc:64] Could not load dynamic library 'libnvinfer_plugin.so.7'; dlerror: libnvinfer_plugin.so.7: cannot open shared object file: No such file or directory; LD_LIBRARY_PATH: /.singularity.d/libs
2022-12-29 01:05:31.991387: W tensorflow/compiler/tf2tensorrt/utils/py_utils.cc:38] TF-TRT Warning: Cannot dlopen some TensorRT libraries. If you would like to use Nvidia GPU with TensorRT, please make sure the missing libraries mentioned above are installed properly.
2022-12-29 01:05:34.147532: W tensorflow/compiler/xla/stream_executor/platform/default/dso_loader.cc:64] Could not load dynamic library 'libcuda.so.1'; dlerror: libcuda.so.1: cannot open shared object file: No such file or directory; LD_LIBRARY_PATH: /.singularity.d/libs
2022-12-29 01:05:34.147642: W tensorflow/compiler/xla/stream_executor/cuda/cuda_driver.cc:265] failed call to cuInit: UNKNOWN ERROR (303)
[32m[I 2022-12-29 01:24:09,001][0m Trial 207 finished with value: 0.7618993785969147 and parameters: {'regressor__regressor__batch_size': 30, 'regressor__regressor__epochs': 410, 'regressor__regressor__optimizer': 'Nadam', 'regressor__regressor__optimizer__learning_rate': 8.83125946200508e-05, 'regressor__regressor__model__init_mode': 'glorot_normal', 'regressor__regressor__model__activation': 'elu', 'regressor__regressor__model__dropout_rate': 0.02210580775122991, 'regressor__regressor__model__weight_constraint': 3.534248988959938, 'regressor__regressor__model__regu_L1': 6.211846769555332e-07, 'regressor__regressor__model__regu_L2': 5.991984241205297e-07, 'regressor__regressor__model__n_layers': 7, 'regressor__regressor__model__n_units': 441, 'regressor__regressor__loss': 'mean_absolute_error'}. Best is trial 199 with value: 0.7759054127864374.[0m
2022-12-29 01:24:14.473861: W tensorflow/compiler/xla/stream_executor/platform/default/dso_loader.cc:64] Could not load dynamic library 'libcudart.so.11.0'; dlerror: libcudart.so.11.0: cannot open shared object file: No such file or directory; LD_LIBRARY_PATH: /.singularity.d/libs
2022-12-29 01:24:16.153646: W tensorflow/compiler/xla/stream_executor/platform/default/dso_loader.cc:64] Could not load dynamic library 'libnvinfer.so.7'; dlerror: libnvinfer.so.7: cannot open shared object file: No such file or directory; LD_LIBRARY_PATH: /.singularity.d/libs
2022-12-29 01:24:16.153784: W tensorflow/compiler/xla/stream_executor/platform/default/dso_loader.cc:64] Could not load dynamic library 'libnvinfer_plugin.so.7'; dlerror: libnvinfer_plugin.so.7: cannot open shared object file: No such file or directory; LD_LIBRARY_PATH: /.singularity.d/libs
2022-12-29 01:24:16.153813: W tensorflow/compiler/tf2tensorrt/utils/py_utils.cc:38] TF-TRT Warning: Cannot dlopen some TensorRT libraries. If you would like to use Nvidia GPU with TensorRT, please make sure the missing libraries mentioned above are installed properly.
2022-12-29 01:24:19.083063: W tensorflow/compiler/xla/stream_executor/platform/default/dso_loader.cc:64] Could not load dynamic library 'libcuda.so.1'; dlerror: libcuda.so.1: cannot open shared object file: No such file or directory; LD_LIBRARY_PATH: /.singularity.d/libs
2022-12-29 01:24:19.083318: W tensorflow/compiler/xla/stream_executor/cuda/cuda_driver.cc:265] failed call to cuInit: UNKNOWN ERROR (303)
[32m[I 2022-12-29 01:46:45,774][0m Trial 208 finished with value: 0.7617905980277806 and parameters: {'regressor__regressor__batch_size': 30, 'regressor__regressor__epochs': 410, 'regressor__regressor__optimizer': 'Nadam', 'regressor__regressor__optimizer__learning_rate': 8.629316474445626e-05, 'regressor__regressor__model__init_mode': 'glorot_normal', 'regressor__regressor__model__activation': 'elu', 'regressor__regressor__model__dropout_rate': 0.017058843678350852, 'regressor__regressor__model__weight_constraint': 3.515059588982944, 'regressor__regressor__model__regu_L1': 5.691664306661138e-07, 'regressor__regressor__model__regu_L2': 6.028763894924294e-07, 'regressor__regressor__model__n_layers': 7, 'regressor__regressor__model__n_units': 441, 'regressor__regressor__loss': 'mean_absolute_error'}. Best is trial 199 with value: 0.7759054127864374.[0m
2022-12-29 01:46:51.646951: W tensorflow/compiler/xla/stream_executor/platform/default/dso_loader.cc:64] Could not load dynamic library 'libcudart.so.11.0'; dlerror: libcudart.so.11.0: cannot open shared object file: No such file or directory; LD_LIBRARY_PATH: /.singularity.d/libs
2022-12-29 01:46:53.774099: W tensorflow/compiler/xla/stream_executor/platform/default/dso_loader.cc:64] Could not load dynamic library 'libnvinfer.so.7'; dlerror: libnvinfer.so.7: cannot open shared object file: No such file or directory; LD_LIBRARY_PATH: /.singularity.d/libs
2022-12-29 01:46:53.774255: W tensorflow/compiler/xla/stream_executor/platform/default/dso_loader.cc:64] Could not load dynamic library 'libnvinfer_plugin.so.7'; dlerror: libnvinfer_plugin.so.7: cannot open shared object file: No such file or directory; LD_LIBRARY_PATH: /.singularity.d/libs
2022-12-29 01:46:53.774290: W tensorflow/compiler/tf2tensorrt/utils/py_utils.cc:38] TF-TRT Warning: Cannot dlopen some TensorRT libraries. If you would like to use Nvidia GPU with TensorRT, please make sure the missing libraries mentioned above are installed properly.
2022-12-29 01:46:57.338750: W tensorflow/compiler/xla/stream_executor/platform/default/dso_loader.cc:64] Could not load dynamic library 'libcuda.so.1'; dlerror: libcuda.so.1: cannot open shared object file: No such file or directory; LD_LIBRARY_PATH: /.singularity.d/libs
2022-12-29 01:46:57.339111: W tensorflow/compiler/xla/stream_executor/cuda/cuda_driver.cc:265] failed call to cuInit: UNKNOWN ERROR (303)
[32m[I 2022-12-29 03:38:37,668][0m Trial 209 finished with value: 0.7561467536922823 and parameters: {'regressor__regressor__batch_size': 30, 'regressor__regressor__epochs': 410, 'regressor__regressor__optimizer': 'Nadam', 'regressor__regressor__optimizer__learning_rate': 8.285263447371829e-05, 'regressor__regressor__model__init_mode': 'glorot_normal', 'regressor__regressor__model__activation': 'elu', 'regressor__regressor__model__dropout_rate': 0.017653157162358643, 'regressor__regressor__model__weight_constraint': 3.3973527732631825, 'regressor__regressor__model__regu_L1': 5.658874971252058e-07, 'regressor__regressor__model__regu_L2': 5.868717420452355e-06, 'regressor__regressor__model__n_layers': 7, 'regressor__regressor__model__n_units': 401, 'regressor__regressor__loss': 'mean_absolute_error'}. Best is trial 199 with value: 0.7759054127864374.[0m
2022-12-29 03:38:42.391236: W tensorflow/compiler/xla/stream_executor/platform/default/dso_loader.cc:64] Could not load dynamic library 'libcudart.so.11.0'; dlerror: libcudart.so.11.0: cannot open shared object file: No such file or directory; LD_LIBRARY_PATH: /.singularity.d/libs
2022-12-29 03:38:44.080085: W tensorflow/compiler/xla/stream_executor/platform/default/dso_loader.cc:64] Could not load dynamic library 'libnvinfer.so.7'; dlerror: libnvinfer.so.7: cannot open shared object file: No such file or directory; LD_LIBRARY_PATH: /.singularity.d/libs
2022-12-29 03:38:44.080276: W tensorflow/compiler/xla/stream_executor/platform/default/dso_loader.cc:64] Could not load dynamic library 'libnvinfer_plugin.so.7'; dlerror: libnvinfer_plugin.so.7: cannot open shared object file: No such file or directory; LD_LIBRARY_PATH: /.singularity.d/libs
2022-12-29 03:38:44.080305: W tensorflow/compiler/tf2tensorrt/utils/py_utils.cc:38] TF-TRT Warning: Cannot dlopen some TensorRT libraries. If you would like to use Nvidia GPU with TensorRT, please make sure the missing libraries mentioned above are installed properly.
2022-12-29 03:38:46.208754: W tensorflow/compiler/xla/stream_executor/platform/default/dso_loader.cc:64] Could not load dynamic library 'libcuda.so.1'; dlerror: libcuda.so.1: cannot open shared object file: No such file or directory; LD_LIBRARY_PATH: /.singularity.d/libs
2022-12-29 03:38:46.208852: W tensorflow/compiler/xla/stream_executor/cuda/cuda_driver.cc:265] failed call to cuInit: UNKNOWN ERROR (303)
[32m[I 2022-12-29 04:28:33,406][0m Trial 210 finished with value: 0.715017095021965 and parameters: {'regressor__regressor__batch_size': 30, 'regressor__regressor__epochs': 410, 'regressor__regressor__optimizer': 'Nadam', 'regressor__regressor__optimizer__learning_rate': 9.159898999539485e-05, 'regressor__regressor__model__init_mode': 'glorot_normal', 'regressor__regressor__model__activation': 'softsign', 'regressor__regressor__model__dropout_rate': 0.017395383021454575, 'regressor__regressor__model__weight_constraint': 3.518177072824364, 'regressor__regressor__model__regu_L1': 5.642836866123197e-07, 'regressor__regressor__model__regu_L2': 8.934766714462193e-06, 'regressor__regressor__model__n_layers': 7, 'regressor__regressor__model__n_units': 401, 'regressor__regressor__loss': 'mean_absolute_error'}. Best is trial 199 with value: 0.7759054127864374.[0m
2022-12-29 04:28:39.844030: W tensorflow/compiler/xla/stream_executor/platform/default/dso_loader.cc:64] Could not load dynamic library 'libcudart.so.11.0'; dlerror: libcudart.so.11.0: cannot open shared object file: No such file or directory; LD_LIBRARY_PATH: /.singularity.d/libs
2022-12-29 04:28:42.225861: W tensorflow/compiler/xla/stream_executor/platform/default/dso_loader.cc:64] Could not load dynamic library 'libnvinfer.so.7'; dlerror: libnvinfer.so.7: cannot open shared object file: No such file or directory; LD_LIBRARY_PATH: /.singularity.d/libs
2022-12-29 04:28:42.231667: W tensorflow/compiler/xla/stream_executor/platform/default/dso_loader.cc:64] Could not load dynamic library 'libnvinfer_plugin.so.7'; dlerror: libnvinfer_plugin.so.7: cannot open shared object file: No such file or directory; LD_LIBRARY_PATH: /.singularity.d/libs
2022-12-29 04:28:42.231744: W tensorflow/compiler/tf2tensorrt/utils/py_utils.cc:38] TF-TRT Warning: Cannot dlopen some TensorRT libraries. If you would like to use Nvidia GPU with TensorRT, please make sure the missing libraries mentioned above are installed properly.
2022-12-29 04:28:46.552824: W tensorflow/compiler/xla/stream_executor/platform/default/dso_loader.cc:64] Could not load dynamic library 'libcuda.so.1'; dlerror: libcuda.so.1: cannot open shared object file: No such file or directory; LD_LIBRARY_PATH: /.singularity.d/libs
2022-12-29 04:28:46.552926: W tensorflow/compiler/xla/stream_executor/cuda/cuda_driver.cc:265] failed call to cuInit: UNKNOWN ERROR (303)
[32m[I 2022-12-29 07:31:46,375][0m Trial 212 finished with value: 0.7607781333765191 and parameters: {'regressor__regressor__batch_size': 30, 'regressor__regressor__epochs': 410, 'regressor__regressor__optimizer': 'Nadam', 'regressor__regressor__optimizer__learning_rate': 8.828401704598786e-05, 'regressor__regressor__model__init_mode': 'glorot_normal', 'regressor__regressor__model__activation': 'elu', 'regressor__regressor__model__dropout_rate': 0.015659740262733486, 'regressor__regressor__model__weight_constraint': 3.4686187835342497, 'regressor__regressor__model__regu_L1': 5.230815323120757e-07, 'regressor__regressor__model__regu_L2': 6.179321880506243e-07, 'regressor__regressor__model__n_layers': 7, 'regressor__regressor__model__n_units': 421, 'regressor__regressor__loss': 'mean_absolute_error'}. Best is trial 199 with value: 0.7759054127864374.[0m
[32m[I 2022-12-29 09:16:11,591][0m Trial 211 finished with value: 0.761063718572213 and parameters: {'regressor__regressor__batch_size': 30, 'regressor__regressor__epochs': 470, 'regressor__regressor__optimizer': 'Nadam', 'regressor__regressor__optimizer__learning_rate': 8.955060393154511e-05, 'regressor__regressor__model__init_mode': 'glorot_normal', 'regressor__regressor__model__activation': 'elu', 'regressor__regressor__model__dropout_rate': 0.0099231874904268, 'regressor__regressor__model__weight_constraint': 3.4702953241386885, 'regressor__regressor__model__regu_L1': 5.668596864450692e-07, 'regressor__regressor__model__regu_L2': 7.818380619523816e-06, 'regressor__regressor__model__n_layers': 7, 'regressor__regressor__model__n_units': 401, 'regressor__regressor__loss': 'mean_absolute_error'}. Best is trial 199 with value: 0.7759054127864374.[0m
2022-12-29 09:16:17.668863: W tensorflow/compiler/xla/stream_executor/platform/default/dso_loader.cc:64] Could not load dynamic library 'libcudart.so.11.0'; dlerror: libcudart.so.11.0: cannot open shared object file: No such file or directory; LD_LIBRARY_PATH: /.singularity.d/libs
2022-12-29 09:16:18.714900: W tensorflow/compiler/xla/stream_executor/platform/default/dso_loader.cc:64] Could not load dynamic library 'libnvinfer.so.7'; dlerror: libnvinfer.so.7: cannot open shared object file: No such file or directory; LD_LIBRARY_PATH: /.singularity.d/libs
2022-12-29 09:16:18.715035: W tensorflow/compiler/xla/stream_executor/platform/default/dso_loader.cc:64] Could not load dynamic library 'libnvinfer_plugin.so.7'; dlerror: libnvinfer_plugin.so.7: cannot open shared object file: No such file or directory; LD_LIBRARY_PATH: /.singularity.d/libs
2022-12-29 09:16:18.715060: W tensorflow/compiler/tf2tensorrt/utils/py_utils.cc:38] TF-TRT Warning: Cannot dlopen some TensorRT libraries. If you would like to use Nvidia GPU with TensorRT, please make sure the missing libraries mentioned above are installed properly.
2022-12-29 09:16:20.435867: W tensorflow/compiler/xla/stream_executor/platform/default/dso_loader.cc:64] Could not load dynamic library 'libcuda.so.1'; dlerror: libcuda.so.1: cannot open shared object file: No such file or directory; LD_LIBRARY_PATH: /.singularity.d/libs
2022-12-29 09:16:20.435967: W tensorflow/compiler/xla/stream_executor/cuda/cuda_driver.cc:265] failed call to cuInit: UNKNOWN ERROR (303)
[32m[I 2022-12-29 09:21:29,297][0m Trial 213 finished with value: 0.7347074317042848 and parameters: {'regressor__regressor__batch_size': 30, 'regressor__regressor__epochs': 430, 'regressor__regressor__optimizer': 'Nadam', 'regressor__regressor__optimizer__learning_rate': 5.875943709636896e-05, 'regressor__regressor__model__init_mode': 'glorot_normal', 'regressor__regressor__model__activation': 'elu', 'regressor__regressor__model__dropout_rate': 0.0005766918259690751, 'regressor__regressor__model__weight_constraint': 3.5139463278394834, 'regressor__regressor__model__regu_L1': 5.369297241294888e-07, 'regressor__regressor__model__regu_L2': 6.3179966790003175e-06, 'regressor__regressor__model__n_layers': 7, 'regressor__regressor__model__n_units': 421, 'regressor__regressor__loss': 'mean_absolute_error'}. Best is trial 199 with value: 0.7759054127864374.[0m
2022-12-29 09:21:36.435479: W tensorflow/compiler/xla/stream_executor/platform/default/dso_loader.cc:64] Could not load dynamic library 'libcudart.so.11.0'; dlerror: libcudart.so.11.0: cannot open shared object file: No such file or directory; LD_LIBRARY_PATH: /.singularity.d/libs
2022-12-29 09:21:38.560291: W tensorflow/compiler/xla/stream_executor/platform/default/dso_loader.cc:64] Could not load dynamic library 'libnvinfer.so.7'; dlerror: libnvinfer.so.7: cannot open shared object file: No such file or directory; LD_LIBRARY_PATH: /.singularity.d/libs
2022-12-29 09:21:38.560481: W tensorflow/compiler/xla/stream_executor/platform/default/dso_loader.cc:64] Could not load dynamic library 'libnvinfer_plugin.so.7'; dlerror: libnvinfer_plugin.so.7: cannot open shared object file: No such file or directory; LD_LIBRARY_PATH: /.singularity.d/libs
2022-12-29 09:21:38.560520: W tensorflow/compiler/tf2tensorrt/utils/py_utils.cc:38] TF-TRT Warning: Cannot dlopen some TensorRT libraries. If you would like to use Nvidia GPU with TensorRT, please make sure the missing libraries mentioned above are installed properly.
2022-12-29 09:21:41.273337: W tensorflow/compiler/xla/stream_executor/platform/default/dso_loader.cc:64] Could not load dynamic library 'libcuda.so.1'; dlerror: libcuda.so.1: cannot open shared object file: No such file or directory; LD_LIBRARY_PATH: /.singularity.d/libs
2022-12-29 09:21:41.273822: W tensorflow/compiler/xla/stream_executor/cuda/cuda_driver.cc:265] failed call to cuInit: UNKNOWN ERROR (303)
