[32m[I 2022-12-31 15:07:06,901][0m Trial 252 finished with value: 0.7434906442875834 and parameters: {'regressor__regressor__batch_size': 10, 'regressor__regressor__epochs': 370, 'regressor__regressor__optimizer': 'Nadam', 'regressor__regressor__optimizer__learning_rate': 0.00016122645683802245, 'regressor__regressor__model__init_mode': 'glorot_normal', 'regressor__regressor__model__activation': 'elu', 'regressor__regressor__model__dropout_rate': 0.03786521321895438, 'regressor__regressor__model__weight_constraint': 3.6702715766642955, 'regressor__regressor__model__regu_L1': 1.9251841925055783e-06, 'regressor__regressor__model__regu_L2': 2.6152540023265275e-05, 'regressor__regressor__model__n_layers': 7, 'regressor__regressor__model__n_units': 341, 'regressor__regressor__loss': 'mean_absolute_error'}. Best is trial 239 with value: 0.777033467707341.[0m
2022-12-31 15:07:11.267588: W tensorflow/compiler/xla/stream_executor/platform/default/dso_loader.cc:64] Could not load dynamic library 'libcudart.so.11.0'; dlerror: libcudart.so.11.0: cannot open shared object file: No such file or directory; LD_LIBRARY_PATH: /.singularity.d/libs
2022-12-31 15:07:12.652256: W tensorflow/compiler/xla/stream_executor/platform/default/dso_loader.cc:64] Could not load dynamic library 'libnvinfer.so.7'; dlerror: libnvinfer.so.7: cannot open shared object file: No such file or directory; LD_LIBRARY_PATH: /.singularity.d/libs
2022-12-31 15:07:12.652358: W tensorflow/compiler/xla/stream_executor/platform/default/dso_loader.cc:64] Could not load dynamic library 'libnvinfer_plugin.so.7'; dlerror: libnvinfer_plugin.so.7: cannot open shared object file: No such file or directory; LD_LIBRARY_PATH: /.singularity.d/libs
2022-12-31 15:07:12.652382: W tensorflow/compiler/tf2tensorrt/utils/py_utils.cc:38] TF-TRT Warning: Cannot dlopen some TensorRT libraries. If you would like to use Nvidia GPU with TensorRT, please make sure the missing libraries mentioned above are installed properly.
2022-12-31 15:07:14.630168: W tensorflow/compiler/xla/stream_executor/platform/default/dso_loader.cc:64] Could not load dynamic library 'libcuda.so.1'; dlerror: libcuda.so.1: cannot open shared object file: No such file or directory; LD_LIBRARY_PATH: /.singularity.d/libs
2022-12-31 15:07:14.630588: W tensorflow/compiler/xla/stream_executor/cuda/cuda_driver.cc:265] failed call to cuInit: UNKNOWN ERROR (303)
[32m[I 2022-12-31 17:08:57,418][0m Trial 255 finished with value: 0.7202852488194126 and parameters: {'regressor__regressor__batch_size': 20, 'regressor__regressor__epochs': 370, 'regressor__regressor__optimizer': 'Nadam', 'regressor__regressor__optimizer__learning_rate': 0.00017399009637301702, 'regressor__regressor__model__init_mode': 'glorot_normal', 'regressor__regressor__model__activation': 'elu', 'regressor__regressor__model__dropout_rate': 0.041047342367098845, 'regressor__regressor__model__weight_constraint': 3.686656018272285, 'regressor__regressor__model__regu_L1': 3.7282318521108627e-06, 'regressor__regressor__model__regu_L2': 2.8078394441132623e-05, 'regressor__regressor__model__n_layers': 7, 'regressor__regressor__model__n_units': 361, 'regressor__regressor__loss': 'mean_absolute_error'}. Best is trial 239 with value: 0.777033467707341.[0m
2022-12-31 17:09:01.852278: W tensorflow/compiler/xla/stream_executor/platform/default/dso_loader.cc:64] Could not load dynamic library 'libcudart.so.11.0'; dlerror: libcudart.so.11.0: cannot open shared object file: No such file or directory; LD_LIBRARY_PATH: /.singularity.d/libs
2022-12-31 17:09:03.381198: W tensorflow/compiler/xla/stream_executor/platform/default/dso_loader.cc:64] Could not load dynamic library 'libnvinfer.so.7'; dlerror: libnvinfer.so.7: cannot open shared object file: No such file or directory; LD_LIBRARY_PATH: /.singularity.d/libs
2022-12-31 17:09:03.381648: W tensorflow/compiler/xla/stream_executor/platform/default/dso_loader.cc:64] Could not load dynamic library 'libnvinfer_plugin.so.7'; dlerror: libnvinfer_plugin.so.7: cannot open shared object file: No such file or directory; LD_LIBRARY_PATH: /.singularity.d/libs
2022-12-31 17:09:03.381846: W tensorflow/compiler/tf2tensorrt/utils/py_utils.cc:38] TF-TRT Warning: Cannot dlopen some TensorRT libraries. If you would like to use Nvidia GPU with TensorRT, please make sure the missing libraries mentioned above are installed properly.
2022-12-31 17:09:05.595986: W tensorflow/compiler/xla/stream_executor/platform/default/dso_loader.cc:64] Could not load dynamic library 'libcuda.so.1'; dlerror: libcuda.so.1: cannot open shared object file: No such file or directory; LD_LIBRARY_PATH: /.singularity.d/libs
2022-12-31 17:09:05.596115: W tensorflow/compiler/xla/stream_executor/cuda/cuda_driver.cc:265] failed call to cuInit: UNKNOWN ERROR (303)
[32m[I 2022-12-31 17:37:06,763][0m Trial 256 finished with value: -6.473396849262914 and parameters: {'regressor__regressor__batch_size': 20, 'regressor__regressor__epochs': 350, 'regressor__regressor__optimizer': 'Nadam', 'regressor__regressor__optimizer__learning_rate': 0.00027966808399110704, 'regressor__regressor__model__init_mode': 'glorot_normal', 'regressor__regressor__model__activation': 'elu', 'regressor__regressor__model__dropout_rate': 0.037985370869421775, 'regressor__regressor__model__weight_constraint': 3.6574347272682153, 'regressor__regressor__model__regu_L1': 3.529535961276471e-06, 'regressor__regressor__model__regu_L2': 2.8776385668694155e-05, 'regressor__regressor__model__n_layers': 5, 'regressor__regressor__model__n_units': 341, 'regressor__regressor__loss': 'mape'}. Best is trial 239 with value: 0.777033467707341.[0m
2022-12-31 17:37:11.293937: W tensorflow/compiler/xla/stream_executor/platform/default/dso_loader.cc:64] Could not load dynamic library 'libcudart.so.11.0'; dlerror: libcudart.so.11.0: cannot open shared object file: No such file or directory; LD_LIBRARY_PATH: /.singularity.d/libs
2022-12-31 17:37:12.536998: W tensorflow/compiler/xla/stream_executor/platform/default/dso_loader.cc:64] Could not load dynamic library 'libnvinfer.so.7'; dlerror: libnvinfer.so.7: cannot open shared object file: No such file or directory; LD_LIBRARY_PATH: /.singularity.d/libs
2022-12-31 17:37:12.537179: W tensorflow/compiler/xla/stream_executor/platform/default/dso_loader.cc:64] Could not load dynamic library 'libnvinfer_plugin.so.7'; dlerror: libnvinfer_plugin.so.7: cannot open shared object file: No such file or directory; LD_LIBRARY_PATH: /.singularity.d/libs
2022-12-31 17:37:12.537227: W tensorflow/compiler/tf2tensorrt/utils/py_utils.cc:38] TF-TRT Warning: Cannot dlopen some TensorRT libraries. If you would like to use Nvidia GPU with TensorRT, please make sure the missing libraries mentioned above are installed properly.
2022-12-31 17:37:14.570768: W tensorflow/compiler/xla/stream_executor/platform/default/dso_loader.cc:64] Could not load dynamic library 'libcuda.so.1'; dlerror: libcuda.so.1: cannot open shared object file: No such file or directory; LD_LIBRARY_PATH: /.singularity.d/libs
2022-12-31 17:37:14.570948: W tensorflow/compiler/xla/stream_executor/cuda/cuda_driver.cc:265] failed call to cuInit: UNKNOWN ERROR (303)
[32m[I 2022-12-31 20:11:26,032][0m Trial 257 finished with value: 0.71405570885469 and parameters: {'regressor__regressor__batch_size': 20, 'regressor__regressor__epochs': 370, 'regressor__regressor__optimizer': 'Nadam', 'regressor__regressor__optimizer__learning_rate': 0.00019080085312446742, 'regressor__regressor__model__init_mode': 'glorot_normal', 'regressor__regressor__model__activation': 'elu', 'regressor__regressor__model__dropout_rate': 0.046309935017321474, 'regressor__regressor__model__weight_constraint': 3.6741169440852484, 'regressor__regressor__model__regu_L1': 3.079063768343462e-06, 'regressor__regressor__model__regu_L2': 3.6539557234224363e-05, 'regressor__regressor__model__n_layers': 7, 'regressor__regressor__model__n_units': 361, 'regressor__regressor__loss': 'mean_absolute_error'}. Best is trial 239 with value: 0.777033467707341.[0m
2022-12-31 20:11:29.440236: W tensorflow/compiler/xla/stream_executor/platform/default/dso_loader.cc:64] Could not load dynamic library 'libcudart.so.11.0'; dlerror: libcudart.so.11.0: cannot open shared object file: No such file or directory; LD_LIBRARY_PATH: /.singularity.d/libs
2022-12-31 20:11:30.468251: W tensorflow/compiler/xla/stream_executor/platform/default/dso_loader.cc:64] Could not load dynamic library 'libnvinfer.so.7'; dlerror: libnvinfer.so.7: cannot open shared object file: No such file or directory; LD_LIBRARY_PATH: /.singularity.d/libs
2022-12-31 20:11:30.468693: W tensorflow/compiler/xla/stream_executor/platform/default/dso_loader.cc:64] Could not load dynamic library 'libnvinfer_plugin.so.7'; dlerror: libnvinfer_plugin.so.7: cannot open shared object file: No such file or directory; LD_LIBRARY_PATH: /.singularity.d/libs
2022-12-31 20:11:30.468739: W tensorflow/compiler/tf2tensorrt/utils/py_utils.cc:38] TF-TRT Warning: Cannot dlopen some TensorRT libraries. If you would like to use Nvidia GPU with TensorRT, please make sure the missing libraries mentioned above are installed properly.
2022-12-31 20:11:31.833681: W tensorflow/compiler/xla/stream_executor/platform/default/dso_loader.cc:64] Could not load dynamic library 'libcuda.so.1'; dlerror: libcuda.so.1: cannot open shared object file: No such file or directory; LD_LIBRARY_PATH: /.singularity.d/libs
2022-12-31 20:11:31.833826: W tensorflow/compiler/xla/stream_executor/cuda/cuda_driver.cc:265] failed call to cuInit: UNKNOWN ERROR (303)
[32m[I 2022-12-31 20:25:39,617][0m Trial 258 finished with value: 0.7026366319932388 and parameters: {'regressor__regressor__batch_size': 20, 'regressor__regressor__epochs': 370, 'regressor__regressor__optimizer': 'Nadam', 'regressor__regressor__optimizer__learning_rate': 0.00029701250514516624, 'regressor__regressor__model__init_mode': 'glorot_normal', 'regressor__regressor__model__activation': 'elu', 'regressor__regressor__model__dropout_rate': 0.050655085660102225, 'regressor__regressor__model__weight_constraint': 3.6388784421477083, 'regressor__regressor__model__regu_L1': 3.2731362426011283e-06, 'regressor__regressor__model__regu_L2': 1.4929076701245104e-05, 'regressor__regressor__model__n_layers': 7, 'regressor__regressor__model__n_units': 361, 'regressor__regressor__loss': 'mean_absolute_error'}. Best is trial 239 with value: 0.777033467707341.[0m
2022-12-31 20:25:43.337666: W tensorflow/compiler/xla/stream_executor/platform/default/dso_loader.cc:64] Could not load dynamic library 'libcudart.so.11.0'; dlerror: libcudart.so.11.0: cannot open shared object file: No such file or directory; LD_LIBRARY_PATH: /.singularity.d/libs
2022-12-31 20:25:44.465670: W tensorflow/compiler/xla/stream_executor/platform/default/dso_loader.cc:64] Could not load dynamic library 'libnvinfer.so.7'; dlerror: libnvinfer.so.7: cannot open shared object file: No such file or directory; LD_LIBRARY_PATH: /.singularity.d/libs
2022-12-31 20:25:44.465814: W tensorflow/compiler/xla/stream_executor/platform/default/dso_loader.cc:64] Could not load dynamic library 'libnvinfer_plugin.so.7'; dlerror: libnvinfer_plugin.so.7: cannot open shared object file: No such file or directory; LD_LIBRARY_PATH: /.singularity.d/libs
2022-12-31 20:25:44.465836: W tensorflow/compiler/tf2tensorrt/utils/py_utils.cc:38] TF-TRT Warning: Cannot dlopen some TensorRT libraries. If you would like to use Nvidia GPU with TensorRT, please make sure the missing libraries mentioned above are installed properly.
2022-12-31 20:25:46.170534: W tensorflow/compiler/xla/stream_executor/platform/default/dso_loader.cc:64] Could not load dynamic library 'libcuda.so.1'; dlerror: libcuda.so.1: cannot open shared object file: No such file or directory; LD_LIBRARY_PATH: /.singularity.d/libs
2022-12-31 20:25:46.170631: W tensorflow/compiler/xla/stream_executor/cuda/cuda_driver.cc:265] failed call to cuInit: UNKNOWN ERROR (303)
[32m[I 2022-12-31 20:50:45,223][0m Trial 259 finished with value: 0.7549932810034936 and parameters: {'regressor__regressor__batch_size': 20, 'regressor__regressor__epochs': 390, 'regressor__regressor__optimizer': 'Nadam', 'regressor__regressor__optimizer__learning_rate': 0.0002763411817036769, 'regressor__regressor__model__init_mode': 'glorot_normal', 'regressor__regressor__model__activation': 'elu', 'regressor__regressor__model__dropout_rate': 0.04988732219616472, 'regressor__regressor__model__weight_constraint': 3.621494261073874, 'regressor__regressor__model__regu_L1': 2.3290418178413985e-06, 'regressor__regressor__model__regu_L2': 1.5542056859443553e-05, 'regressor__regressor__model__n_layers': 5, 'regressor__regressor__model__n_units': 361, 'regressor__regressor__loss': 'mean_absolute_error'}. Best is trial 239 with value: 0.777033467707341.[0m
[32m[I 2022-12-31 20:51:22,622][0m Trial 254 finished with value: 0.677173552853463 and parameters: {'regressor__regressor__batch_size': 10, 'regressor__regressor__epochs': 370, 'regressor__regressor__optimizer': 'Nadam', 'regressor__regressor__optimizer__learning_rate': 0.00022737846620650803, 'regressor__regressor__model__init_mode': 'glorot_normal', 'regressor__regressor__model__activation': 'elu', 'regressor__regressor__model__dropout_rate': 0.035205891370030495, 'regressor__regressor__model__weight_constraint': 3.69562187895681, 'regressor__regressor__model__regu_L1': 3.6450283851070148e-06, 'regressor__regressor__model__regu_L2': 2.5013891152583593e-05, 'regressor__regressor__model__n_layers': 7, 'regressor__regressor__model__n_units': 341, 'regressor__regressor__loss': 'mean_absolute_error'}. Best is trial 239 with value: 0.777033467707341.[0m
2022-12-31 20:51:27.757875: W tensorflow/compiler/xla/stream_executor/platform/default/dso_loader.cc:64] Could not load dynamic library 'libcudart.so.11.0'; dlerror: libcudart.so.11.0: cannot open shared object file: No such file or directory; LD_LIBRARY_PATH: /.singularity.d/libs
2022-12-31 20:51:29.454515: W tensorflow/compiler/xla/stream_executor/platform/default/dso_loader.cc:64] Could not load dynamic library 'libnvinfer.so.7'; dlerror: libnvinfer.so.7: cannot open shared object file: No such file or directory; LD_LIBRARY_PATH: /.singularity.d/libs
2022-12-31 20:51:29.454647: W tensorflow/compiler/xla/stream_executor/platform/default/dso_loader.cc:64] Could not load dynamic library 'libnvinfer_plugin.so.7'; dlerror: libnvinfer_plugin.so.7: cannot open shared object file: No such file or directory; LD_LIBRARY_PATH: /.singularity.d/libs
2022-12-31 20:51:29.454674: W tensorflow/compiler/tf2tensorrt/utils/py_utils.cc:38] TF-TRT Warning: Cannot dlopen some TensorRT libraries. If you would like to use Nvidia GPU with TensorRT, please make sure the missing libraries mentioned above are installed properly.
2022-12-31 20:51:31.583263: W tensorflow/compiler/xla/stream_executor/platform/default/dso_loader.cc:64] Could not load dynamic library 'libcuda.so.1'; dlerror: libcuda.so.1: cannot open shared object file: No such file or directory; LD_LIBRARY_PATH: /.singularity.d/libs
2022-12-31 20:51:31.583365: W tensorflow/compiler/xla/stream_executor/cuda/cuda_driver.cc:265] failed call to cuInit: UNKNOWN ERROR (303)
[32m[I 2022-12-31 22:49:17,277][0m Trial 260 finished with value: 0.5255411905069771 and parameters: {'regressor__regressor__batch_size': 20, 'regressor__regressor__epochs': 370, 'regressor__regressor__optimizer': 'Nadam', 'regressor__regressor__optimizer__learning_rate': 0.00023082858905923429, 'regressor__regressor__model__init_mode': 'glorot_normal', 'regressor__regressor__model__activation': 'elu', 'regressor__regressor__model__dropout_rate': 0.45900029596481606, 'regressor__regressor__model__weight_constraint': 3.8888831105355943, 'regressor__regressor__model__regu_L1': 2.4389888702825845e-06, 'regressor__regressor__model__regu_L2': 1.4494063171179378e-05, 'regressor__regressor__model__n_layers': 7, 'regressor__regressor__model__n_units': 361, 'regressor__regressor__loss': 'mean_absolute_error'}. Best is trial 239 with value: 0.777033467707341.[0m
2022-12-31 22:49:22.691819: W tensorflow/compiler/xla/stream_executor/platform/default/dso_loader.cc:64] Could not load dynamic library 'libcudart.so.11.0'; dlerror: libcudart.so.11.0: cannot open shared object file: No such file or directory; LD_LIBRARY_PATH: /.singularity.d/libs
2022-12-31 22:49:24.511830: W tensorflow/compiler/xla/stream_executor/platform/default/dso_loader.cc:64] Could not load dynamic library 'libnvinfer.so.7'; dlerror: libnvinfer.so.7: cannot open shared object file: No such file or directory; LD_LIBRARY_PATH: /.singularity.d/libs
2022-12-31 22:49:24.512178: W tensorflow/compiler/xla/stream_executor/platform/default/dso_loader.cc:64] Could not load dynamic library 'libnvinfer_plugin.so.7'; dlerror: libnvinfer_plugin.so.7: cannot open shared object file: No such file or directory; LD_LIBRARY_PATH: /.singularity.d/libs
2022-12-31 22:49:24.512334: W tensorflow/compiler/tf2tensorrt/utils/py_utils.cc:38] TF-TRT Warning: Cannot dlopen some TensorRT libraries. If you would like to use Nvidia GPU with TensorRT, please make sure the missing libraries mentioned above are installed properly.
2022-12-31 22:49:26.950171: W tensorflow/compiler/xla/stream_executor/platform/default/dso_loader.cc:64] Could not load dynamic library 'libcuda.so.1'; dlerror: libcuda.so.1: cannot open shared object file: No such file or directory; LD_LIBRARY_PATH: /.singularity.d/libs
2022-12-31 22:49:26.950993: W tensorflow/compiler/xla/stream_executor/cuda/cuda_driver.cc:265] failed call to cuInit: UNKNOWN ERROR (303)
[32m[I 2023-01-01 02:19:31,982][0m Trial 261 finished with value: 0.7604167906421535 and parameters: {'regressor__regressor__batch_size': 20, 'regressor__regressor__epochs': 390, 'regressor__regressor__optimizer': 'Nadam', 'regressor__regressor__optimizer__learning_rate': 0.00022184346124925886, 'regressor__regressor__model__init_mode': 'glorot_normal', 'regressor__regressor__model__activation': 'elu', 'regressor__regressor__model__dropout_rate': 0.05184359522203188, 'regressor__regressor__model__weight_constraint': 3.872301851975015, 'regressor__regressor__model__regu_L1': 2.270799594674635e-06, 'regressor__regressor__model__regu_L2': 1.5686616588720913e-05, 'regressor__regressor__model__n_layers': 7, 'regressor__regressor__model__n_units': 361, 'regressor__regressor__loss': 'mean_absolute_error'}. Best is trial 239 with value: 0.777033467707341.[0m
2023-01-01 02:19:36.374892: W tensorflow/compiler/xla/stream_executor/platform/default/dso_loader.cc:64] Could not load dynamic library 'libcudart.so.11.0'; dlerror: libcudart.so.11.0: cannot open shared object file: No such file or directory; LD_LIBRARY_PATH: /.singularity.d/libs
2023-01-01 02:19:37.912643: W tensorflow/compiler/xla/stream_executor/platform/default/dso_loader.cc:64] Could not load dynamic library 'libnvinfer.so.7'; dlerror: libnvinfer.so.7: cannot open shared object file: No such file or directory; LD_LIBRARY_PATH: /.singularity.d/libs
2023-01-01 02:19:37.912958: W tensorflow/compiler/xla/stream_executor/platform/default/dso_loader.cc:64] Could not load dynamic library 'libnvinfer_plugin.so.7'; dlerror: libnvinfer_plugin.so.7: cannot open shared object file: No such file or directory; LD_LIBRARY_PATH: /.singularity.d/libs
2023-01-01 02:19:37.912991: W tensorflow/compiler/tf2tensorrt/utils/py_utils.cc:38] TF-TRT Warning: Cannot dlopen some TensorRT libraries. If you would like to use Nvidia GPU with TensorRT, please make sure the missing libraries mentioned above are installed properly.
2023-01-01 02:19:39.851483: W tensorflow/compiler/xla/stream_executor/platform/default/dso_loader.cc:64] Could not load dynamic library 'libcuda.so.1'; dlerror: libcuda.so.1: cannot open shared object file: No such file or directory; LD_LIBRARY_PATH: /.singularity.d/libs
2023-01-01 02:19:39.853153: W tensorflow/compiler/xla/stream_executor/cuda/cuda_driver.cc:265] failed call to cuInit: UNKNOWN ERROR (303)
[32m[I 2023-01-01 02:25:47,322][0m Trial 264 finished with value: 0.7762057133395004 and parameters: {'regressor__regressor__batch_size': 20, 'regressor__regressor__epochs': 390, 'regressor__regressor__optimizer': 'Nadam', 'regressor__regressor__optimizer__learning_rate': 0.00014120167054840538, 'regressor__regressor__model__init_mode': 'glorot_normal', 'regressor__regressor__model__activation': 'elu', 'regressor__regressor__model__dropout_rate': 0.03103164662105232, 'regressor__regressor__model__weight_constraint': 3.8610362310989235, 'regressor__regressor__model__regu_L1': 1.174771814274162e-06, 'regressor__regressor__model__regu_L2': 1.5800885246930327e-05, 'regressor__regressor__model__n_layers': 7, 'regressor__regressor__model__n_units': 381, 'regressor__regressor__loss': 'mean_absolute_error'}. Best is trial 239 with value: 0.777033467707341.[0m
